"497875","Boletim da Sociedade Paranaense de Matemática (BSPM)","18-Aug-2023 13:56:25","Boletim da Sociedade Paranaense de Matemática (BSPM)","1","0037-8712","2175-1188","DOAJ","Matematikk","Realfag og teknologi","","1","1","1","1","1","","","","","","","","","","","","","","","","","1958","","","Sociedade Paranaense de Matemática","Brasil","Portugisisk","0","http://www.periodicos.uem.br/ojs/index.php/BSocParanMat/index"
"497876","Computational Methods for Differential Equations (CMDE)","18-Aug-2023 13:56:25","Computational Methods for Differential Equations (CMDE)","1","2345-3982","2383-2533","DOAJ","Matematikk","Realfag og teknologi","","1","1","1","1","1","","","","","","","","","","","","","","","","","2013","","","University of Tabriz","Iran","Engelsk","0","https://cmde.tabrizu.ac.ir/"
"497877","Journal de l'École polytechnique. Mathématiques","18-Aug-2023 13:56:25","Journal de l'École polytechnique. Mathématiques","1","2429-7100","2270-518X","DOAJ","Matematikk","Realfag og teknologi","","1","1","1","1","1","","","","","","","","","","","","","","","","25182","2014","","Les Editions de l'Ecole Polythechnique","","Frankrike","Flerspråklig","0","http://jep.cedram.org"
"497878","Mathematical Sciences","18-Aug-2023 13:56:25","Mathematical Sciences","1","2008-1359","2251-7456","","Matematikk","Realfag og teknologi","","1","1","1","1","1","","","","","","","","","","","","","","","","22512","2007","","Springer","","Iran","Engelsk","0","http://www.iaumath.com/"
"497879","Methods of Functional Analysis and Topology (MFAT)","18-Aug-2023 13:56:25","Methods of Functional Analysis and Topology (MFAT)","1","1029-3531","2415-7503","DOAJ","Matematikk","Realfag og teknologi","","0","0","0","0","0","","","","","","","","","","","","","","","","","1995","","","TBiMC","","Engelsk","0","http://mfat.imath.kiev.ua"
"497880","Problemy Analiza","18-Aug-2023 13:56:25","Problemy Analiza","1","2306-3424","2306-3432","DOAJ","Matematikk","Realfag og teknologi","","1","1","1","1","1","","","","","","","","","","","","","","","","","2012","","","Petrozavodsk State University","Russland","Flerspråklig","0","http://issuesofanalysis.petrsu.ru/"
"497881","Knowledge and Space","06-Jun-2023 12:22:29","Knowledge and Space","1","2543-0580","1877-9220","","Tverrfaglig samfunnsforskning","Samfunnsvitenskap","","1","1","1","1","1","","","","","","","","","","","","","","","","22512","2008","","Springer","","Nederland","Engelsk","0","https://www.springer.com/series/7568"
"497882","Proceedings of the International Web Audio Conference (WAC)","06-Jun-2023 12:22:29","Proceedings of the International Web Audio Conference (WAC)","1","","2663-5844","","IKT","Realfag og teknologi","","1","1","1","1","1","","","","","","","","","","","","","","","","","2015","","","Web Audio Conference","Internasjonal","Engelsk","1","http://webaudioconf.com"
"497883","An International Journal of Optimization and Control: Theories & Applications (IJOCTA)","18-Aug-2023 13:56:25","An International Journal of Optimization and Control: Theories & Applications (IJOCTA)","1","2146-0957","2146-5703","DOAJ","Matematikk","Realfag og teknologi","","1","1","1","1","1","","","","","","","","","","","","","","","","","2011","","","Balikesir University","Tyrkia","Engelsk","0","http://ijocta.balikesir.edu.tr"
"497884","Journal of Applied Mathematics and Computational Mechanics (JAMCM)","18-Aug-2023 13:56:25","Journal of Applied Mathematics and Computational Mechanics (JAMCM)","1","2299-9965","2353-0588","DOAJ","Matematikk","Realfag og teknologi","","1","1","1","1","1","","","","","","","","","","","","","","","","","2013","","","Publishing House of Czestochowa University of Technology","Polen","Engelsk","0","http://amcm.pcz.pl/"
"497885","AKCE International Journal of Graphs and Combinatorics","18-Aug-2023 13:56:25","AKCE International Journal of Graphs and Combinatorics","1","0972-8600","2543-3474","DOAJ","Matematikk","Realfag og teknologi","","0","0","0","0","0","","","","","","","","","","","","","","","","18173","2004","","Elsevier","","India, Nederland","Engelsk","0","https://www.journals.elsevier.com/akce-international-journal-of-graphs-and-combinatorics"
"497886","Arab Journal of Mathematical Sciences","18-Aug-2023 13:56:25","Arab Journal of Mathematical Sciences","1","1319-5166","2588-9214","DOAJ","Matematikk","Realfag og teknologi","","0","0","0","0","0","","","","","","","","","","","","","","","","18173","1995","","Elsevier","","Saudi-Arabia","Engelsk","0","https://www.journals.elsevier.com/arab-journal-of-mathematical-sciences/"
"497887","Arabian Journal of Mathematics","18-Aug-2023 13:56:25","Arabian Journal of Mathematics","1","2193-5343","2193-5351","DOAJ","Matematikk","Realfag og teknologi","","1","1","1","1","1","","","","","","","","","","","","","","","","22512","2012","","Springer","","Tyskland","Engelsk","0","https://www.springer.com/journal/40065"
"497888","Communications in Combinatorics and Optimization (CCO)","18-Aug-2023 13:56:25","Communications in Combinatorics and Optimization (CCO)","1","2538-2128","2538-2136","DOAJ","Matematikk","Realfag og teknologi","","1","1","1","1","1","","","","","","","","","","","","","","","","","2016","","","Azarbaijan Shahid Madani University","Iran","Flerspråklig","0","http://comb-opt.azaruniv.ac.ir/"
"497889","Categories and General Algebraic Structures with Applications","18-Aug-2023 13:56:25","Categories and General Algebraic Structures with Applications","1","2345-5853","2345-5861","DOAJ","Matematikk","Realfag og teknologi","","1","1","1","1","1","","","","","","","","","","","","","","","","","2014","","","Shahid Beheshti University","Iran","Flerspråklig","0","http://www.cgasa.ir/"
"497890","Computer Science Journal of Moldova (CSJM)","18-Aug-2023 13:56:25","Computer Science Journal of Moldova (CSJM)","1","","1561-4042","DOAJ","Matematikk","Realfag og teknologi","","1","1","1","1","1","","","","","","","","","","","","","","","","","1993","","","Vladimir Andrunakievich Institute of Mathematics and Computer Science of Moldova","Moldova","Engelsk","0","http://www.math.md/en/publications/csjm/"
"497891","Discussiones Mathematicae - General Algebra and Applications (DMGAA)","18-Aug-2023 13:56:25","Discussiones Mathematicae - General Algebra and Applications (DMGAA)","1","1509-9415","2084-0373","DOAJ","Matematikk","Realfag og teknologi","","1","1","1","1","1","","","","","","","","","","","","","","","","","2000","","","Faculty of Mathematics Computer Science and Econometrics University of Zielona Góra","Polen","Engelsk","0","https://www.degruyter.com/view/j/dmgaa"
"497892","Opuscula Mathematica","18-Aug-2023 13:56:25","Opuscula Mathematica","1","1232-9274","2300-6919","DOAJ","Matematikk","Realfag og teknologi","","1","1","1","1","1","","","","","","","","","","","","","","","","","1994","","","AGH University of Science and Technology Press","Polen","Flerspråklig","0","https://www.opuscula.agh.edu.pl/"
"497893","Journal of Algebra and Related Topics (JART)","18-Aug-2023 13:56:25","Journal of Algebra and Related Topics (JART)","1","2345-3931","2382-9877","DOAJ","Matematikk","Realfag og teknologi","","1","1","1","1","1","","","","","","","","","","","","","","","","","2013","","","University of Guilan","Iran","Engelsk","0","http://jart.guilan.ac.ir/"
"497894","Transactions on Combinatorics","18-Aug-2023 13:56:25","Transactions on Combinatorics","1","2251-8657","2251-8665","DOAJ","Matematikk","Realfag og teknologi","","1","1","1","1","1","","","","","","","","","","","","","","","","","2012","","","University of Isfahan","Iran","Engelsk","0","http://toc.ui.ac.ir/"
"497895","Revista Internacional de Métodos Numéricos para Cálculo y Diseño en Ingeniería (RIMNI)","18-Aug-2023 13:56:25","International Journal of Numerical Methods for Calculation and Design in Engineering","1","0213-1315","1886-158X","DOAJ","Matematikk","Realfag og teknologi","","1","1","1","1","1","","","","","","","","","","","","","","","","","1985","","","Universitat Politécnica de Catalunya","Spania","Flerspråklig","0","https://www.scipedia.com/sj/rimni"
"497896","Endocrinology, Diabetes & Metabolism","18-Aug-2023 13:56:25","Endocrinology, Diabetes & Metabolism","1","","2398-9238","DOAJ","Endokrinologi","Medisin og helsefag","","1","1","1","1","1","","","","","","","","","","","","","","","","18270","2018","","John Wiley & Sons","","Storbritannia","Engelsk","0","https://onlinelibrary.wiley.com/journal/23989238"
"497897","Balkan Society of Geometers Proceedings (BGS Proceedings)","06-Jun-2023 12:22:29","Balkan Society of Geometers Proceedings (BGS Proceedings)","1","1843-2654","1843-2859","DOAJ","Matematikk","Realfag og teknologi","","0","0","0","0","0","","","","","","","","","","","","","","","","","1997","","","Geometry Balkan Press","Romania","Flerspråklig","1","http://www.mathem.pub.ro/proc/"
"497898","International Public Management Review (IPMR)","08-Jun-2023 11:42:57","International Public Management Review (IPMR)","1","","1662-1387","","Statsvitenskap","Samfunnsvitenskap","","1","1","1","1","1","","","","","","","","","","","","","","","","","2000","","","International Public Management Network (IPMN)","Sveits","Engelsk","0","http://journals.sfu.ca/ipmr/index.php/ipmr"
"497899","Atos de pesquisa em educação","06-Jun-2023 12:22:29","Atos de pesquisa em educação","1","","1809-0354","","Pedagogikk og utdanning","Samfunnsvitenskap","","1","1","1","1","1","","","","","","","","","","","","","","","","","2005","","","Universidade Regional de Blumenau","Brasil","Portugisisk","0","http://www.furb.br/atosdepesquisa/"
"497900","Revista de Administração, Sociedade e Inovação (RASI)","06-Jun-2023 12:22:29","Revista de Administração, Sociedade e Inovação (RASI)","1","","2447-8156","DOAJ","Tverrfaglig teknologi","Realfag og teknologi","","1","1","1","1","1","","","","","","","","","","","","","","","","","2015","","","The Federal University of Fluminese","Brasil","Portugisisk","0","http://www.rasi.vr.uff.br/index.php/rasi"
"497901","Voluntaristic Review","06-Jun-2023 12:22:29","Voluntaristic Review","1","2405-4925","2405-4933","","Tverrfaglig samfunnsforskning","Samfunnsvitenskap","","1","1","1","1","1","","","","","","","","","","","","","","","","","2016","","","Brill","Nederland","Engelsk","0","https://brill.com/view/journals/vrbr/vrbr-overview.xml"
"497902","Revista Eletrônica Estudos Hegelianos","06-Jun-2023 12:22:29","Online Journal of Hegelian Studies","1","","1980-8372","","Filosofi","Humaniora","","1","1","1","1","1","","","","","","","","","","","","","","","","","2004","","","Sociedade Hegel Brasileira","Brasil","Portugisisk","0","http://ojs.hegelbrasil.org/index.php/reh/index"
"497903","Psicología, Conocimiento y Sociedad","06-Jun-2023 12:22:29","Psicología, Conocimiento y Sociedad","1","","1688-7026","DOAJ","Psykologi","Medisin og helsefag","","1","1","1","1","1","","","","","","","","","","","","","","","","","2010","","","Facultad de Psicología, Universidad de la República","Uruguay","Spansk","0","https://revista.psico.edu.uy/index.php/revpsicologia/index"
"497904","IEEE International Conference on Identity, Security and Behavior Analysis (ISBA)","06-Jun-2023 12:22:29","IEEE International Conference on Identity, Security and Behavior Analysis (ISBA)","1","2640-5555","2640-0790","","Tverrfaglig teknologi","Realfag og teknologi","","1","1","1","1","1","","","","","","","","","","","","","","","","18231","2015","","IEEE (Institute of Electrical and Electronics Engineers)","","USA","Engelsk","1","https://www.idrbt.ac.in/ISBA/"
"497905","DASH (Delft Architectural Studies on Housing)","06-Jun-2023 12:22:29","DASH (Delft Architectural Studies on Housing)","1","1877-7007","","","Arkitektur og design","Humaniora","","1","1","1","1","1","","","","","","","","","","","","","","","","","2009","","","Nai010 publishers, Rotterdam","Nederland","Flerspråklig","0","http://dash-journal.com/"
"497906","Revista Pós Ciências Sociais","06-Jun-2023 12:22:29","Revista Pós Ciências Sociais","1","1983-4527","2236-9473","DOAJ","Sosiologi","Samfunnsvitenskap","","1","1","1","1","1","","","","","","","","","","","","","","","","","2005","","","Universidade Federal do Maranhão","Brasil","Portugisisk","0","http://www.periodicoseletronicos.ufma.br/index.php/rpcsoc/index"
"497907","Matkailututkimus","08-Jun-2023 11:39:34","Finnish Journal of Tourism Studies","1","","2490-2039","DOAJ","Tverrfaglig samfunnsforskning","Samfunnsvitenskap","","1","1","1","1","1","","","","","","","","","","","","","","","","","2017","","","Suomen matkailututkimuksen seura","Finland","Flerspråklig","0","https://journal.fi/matkailututkimus"
"497908","Journal of Optimization in Industrial Engineering (JOIE)","18-Aug-2023 13:56:25","Journal of Optimization in Industrial Engineering (JOIE)","1","2251-9904","2423-3935","DOAJ","Tverrfaglig teknologi","Realfag og teknologi","","1","1","1","1","1","","","","","","","","","","","","","","","","","2011","","","Islamic Azad University, Qazvin Branch","Iran","Engelsk","0","http://www.qjie.ir/"
"497909","International Journal of Industrial Engineering and Production Research (IJIE)","18-Aug-2023 13:56:25","International Journal of Industrial Engineering and Production Research (IJIE)","1","2008-4889","2345-363X","DOAJ","Tverrfaglig teknologi","Realfag og teknologi","","1","1","1","1","1","","","","","","","","","","","","","","","","","2008","","","Iran University of Science & Technology","Iran","Engelsk","0","http://ijiepr.iust.ac.ir/"
