"Tidsskrift id","Original tittel","Sist endret","Internasjonal tittel","Aktiv","Print ISSN","Online ISSN","Open Access","NPI Fagfelt","NPI Fagområde","Nivå 2024","Nivå 2023","Nivå 2022","Nivå 2021","Nivå 2020","Nivå 2019","Nivå 2018","Nivå 2017","Nivå 2016","Nivå 2015","Nivå 2014","Nivå 2013","Nivå 2012","Nivå 2011","Nivå 2010","Nivå 2009","Nivå 2008","Nivå 2007","Nivå 2006","Nivå 2005","Nivå 2004","Forlag id","Etablert år","Nedlagt år","Forlag","Utgiver","Utgiverland","Språk","Konferanserapport","Url"
"497782","Zeitschrift fur Allgemeinmedizin (ZFA)","18-Aug-2023 13:56:25","Zeitschrift fur Allgemeinmedizin (ZFA)","1","1433-6251","1439-9229","","Generell medisin","Medisin og helsefag","","1","1","1","1","1","","","","","","","","","","","","","","","","","1976","","","Deutscher Aerzte-Verlag GmbH","Tyskland","Tysk","0","https://www.online-zfa.de/"
"497783","Asian Journal of Agriculture and Rural Development (AJARD)","25-Aug-2023 07:26:20","Asian Journal of Agriculture and Rural Development (AJARD)","1","2304-1455","2224-4433","","Biovitenskap","Realfag og teknologi","","0","0","0","0","0","","","","","","","","","","","","","","","","","2011","","","Asian Economic and Social Society","Pakistan","Engelsk","0","http://www.aessweb.com/journals/5005"
"497784","Baozha Yu Chongji","18-Aug-2023 13:56:25","Explosion and Shock Waves","1","1001-1455","","","Fysikk","Realfag og teknologi","","1","1","1","1","1","","","","","","","","","","","","","","","","","1981","","","Baozha yu Chongji Bianjibu","","Kinesisk","0","http://www.bzycj.cn/"
"497785","Environmental Chemistry for a Sustainable World","08-Jun-2023 11:42:57","Environmental Chemistry for a Sustainable World","1","2213-7114","2213-7122","","Tverrfaglig teknologi","Realfag og teknologi","","1","1","1","1","1","","","","","","","","","","","","","","","","22512","2012","","Springer","","Nederland","Engelsk","0","https://link.springer.com/bookseries/11480"
"497786","Economics of Disasters and Climate Change","08-Jun-2023 11:39:34","Economics of Disasters and Climate Change","1","2511-1280","2511-1299","","Samfunnsøkonomi","Samfunnsvitenskap","","1","1","1","1","1","","","","","","","","","","","","","","","","22512","2017","","Springer","","Sveits","Engelsk","0","https://www.springer.com/journal/41885"
"497790","Populism","18-Aug-2023 13:56:25","Populism","1","2588-8064","2588-8072","","Statsvitenskap","Samfunnsvitenskap","","1","1","1","1","1","","","","","","","","","","","","","","","","18109","2018","","Brill Academic Publishers","","Nederland","Engelsk","0","https://brill.com/view/journals/popu/popu-overview.xml"
"497800","Revista Brasileira de Bioética (RBB)","06-Jun-2023 12:22:29","Brazilian Journal of Bioethics","1","1984-1760","1808-6020","","Tverrfaglig naturvitenskap og medisin","Realfag og teknologi","","1","1","1","1","1","","","","","","","","","","","","","","","","","2005","","","Sociedade Brasileira de Bioética","Brasil","Flerspråklig","0","http://periodicos.unb.br/index.php/rbb"
"497801","Zeitschrift für Empirische Hochschulforschung (ZeHf)","06-Jun-2023 12:22:29","Zeitschrift für Empirische Hochschulforschung (ZeHf)","1","2367-3044","2367-3052","","Pedagogikk og utdanning","Samfunnsvitenskap","","1","1","1","1","1","","","","","","","","","","","","","","","","23126","2017","","Verlag Barbara Budrich","","Tyskland","Tysk","0","https://www.budrich-journals.de/index.php/zehf/index"
"497802","International Journal of Lifecycle Performance Engineering (IJLCPE)","06-Jun-2023 12:22:29","International Journal of Lifecycle Performance Engineering (IJLCPE)","1","2043-8648","2043-8656","","Konstruksjonsfag","Realfag og teknologi","","1","1","1","1","1","","","","","","","","","","","","","","","","17842","2011","","InderScience Publishers","","Storbritannia","Engelsk","0","https://www.inderscience.com/jhome.php?jcode=ijlcpe"
"497803","Arbeiten zur Kirchengeschichte","06-Jun-2023 12:22:29","Arbeiten zur Kirchengeschichte","1","1861-5996","","","Teologi og religionsvitenskap","Humaniora","","1","1","1","1","1","","","","","","","","","","","","","","","","18493","1925","","Walter de Gruyter (De Gruyter)","","Tyskland","Flerspråklig","0","https://www.degruyter.com/serial/AKG-B/html"
"497804","Policy and Pedagogy with Under-three Year Olds (POPED)","06-Jun-2023 12:22:29","Policy and Pedagogy with Under-three Year Olds (POPED)","1","2509-6680","2509-6699","","Pedagogikk og utdanning","Samfunnsvitenskap","","1","1","1","1","1","","","","","","","","","","","","","","","","22512","2017","","Springer","","Singapore","Engelsk","0","https://www.springer.com/series/13629"
"497805","Studies in the History of Medieval Religion","06-Jun-2023 12:22:29","Studies in the History of Medieval Religion","1","0955-2480","","","Teologi og religionsvitenskap","Humaniora","","1","1","1","1","1","","","","","","","","","","","","","","","","18667","1989","","Boydell & Brewer","","Storbritannia","Engelsk","0","https://boydellandbrewer.com/series/studies-in-the-history-of-medieval-religion.html"
"497806","Beiträge zu Evangelisation und Gemeindeentwicklung (BEG)","06-Jun-2023 12:22:29","Beiträge zu Evangelisation und Gemeindeentwicklung (BEG)","1","2567-9066","2567-9074","","Teologi og religionsvitenskap","Humaniora","","1","1","1","1","1","","","","","","","","","","","","","","","","18480","2005","","Vandenhoeck & Ruprecht","","Tyskland","Tysk","0","https://www.vandenhoeck-ruprecht-verlage.com/themen-entdecken/gemeindepraxis/gemeindearbeit/622/beitraege-zu-evangelisation-und-gemeindeentwicklung"
"497807","International Journal of Embedded Systems (IJES)","18-Aug-2023 13:56:25","International Journal of Embedded Systems (IJES)","1","1741-1068","1741-1076","","IKT","Realfag og teknologi","","1","1","1","1","1","","","","","","","","","","","","","","","","17842","2005","","InderScience Publishers","","Storbritannia","Engelsk","0","https://www.inderscience.com/jhome.php?jcode=ijes"
"497808","Journal of Astronomy & Earth sciences education (JAESE)","06-Jun-2023 12:17:35","Journal of Astronomy & Earth sciences education (JAESE)","1","2374-6246","2374-6254","","Pedagogikk og utdanning","Samfunnsvitenskap","","1","1","1","1","1","","","","","","","","","","","","","","","","","2014","","","The Clute Institute","USA","Engelsk","0","https://clutejournals.com/index.php/JAESE/about"
"497809","Magyar Tudomány","08-Jun-2023 11:40:28","Hungarian Science","1","0025-0325","1588-1245","","Teatervitenskap og drama","Humaniora","","1","1","1","1","1","","","","","","","","","","","","","","","","18045","1956","","Akadémiai Kiadó","","Ungarn","Ungarsk","0","http://www.matud.iif.hu/impresszum/start.html"
"497810","ESAIM: Proceedings and Surveys","08-Jun-2023 11:39:34","ESAIM: Proceedings and Surveys","1","","2267-3059","DOAJ","Matematikk","Realfag og teknologi","","1","1","1","1","1","1","1","1","1","1","","","","","","","","","","","18169","2014","","EDP Sciences","","Frankrike","Engelsk","1","https://www.esaim-proc.org/"
"497811","UNATC Journal of Drama Teaching","06-Jun-2023 12:22:29","UNATC Journal of Drama Teaching","1","2601-209X","2668-4438","DOAJ","Teatervitenskap og drama","Humaniora","","0","0","0","0","0","","","","","","","","","","","","","","","","","2017","","","UNATC Press, Bucharest","Romania","Engelsk","0","https://unatcjournalofdramateaching.wordpress.com/"
"497812","Proceedings of the ACM/IEEE International Conference on Software Engineering (ICSE-C)","06-Jun-2023 12:22:29","Proceedings of the ACM/IEEE International Conference on Software Engineering(ICSE-C)","1","2574-1926","2574-1934","","IKT","Realfag og teknologi","","1","1","1","1","1","","","","","","","","","","","","","","","","18231","2016","","IEEE (Institute of Electrical and Electronics Engineers)","","USA","Engelsk","1","https://dl.acm.org/citation.cfm?id=3339663"
"497813","Orvosi hetilap","18-Aug-2023 13:56:25","Orvosi hetilap","1","0030-6002","1788-6120","","Endokrinologi","Medisin og helsefag","","0","0","0","0","0","","","","","","","","","","","","","","","","18045","1857","","Akadémiai Kiadó","","Ungarn","Ungarsk","0","http://www.akademiai.com/loi/650"
"497819","Journal of Integrative Bioinformatics (JIB)","18-Aug-2023 13:56:25","Journal of Integrative Bioinformatics (JIB)","1","","1613-4516","DOAJ","Biovitenskap","Realfag og teknologi","","1","1","1","1","1","","","","","","","","","","","","","","","","18493","2004","","Walter de Gruyter (De Gruyter)","","Tyskland","Engelsk","0","https://www.degruyter.com/view/j/jib"
"497820","Advances in Systems Analysis, Software Engineering, and High Performance Computing (ASASEHPC)","06-Jun-2023 12:22:29","Advances in Systems Analysis, Software Engineering, and High Performance Computing (ASASEHPC)","1","2327-3453","2327-3461","","IKT","Realfag og teknologi","","1","1","1","1","1","","","","","","","","","","","","","","","","20555","2010","","IGI Global","","USA","Engelsk","0","https://www.igi-global.com/book-series/advances-systems-analysis-software-engineering/73689"
"497821","Επιθεώρηση Υγείας","06-Jun-2023 12:22:29","Health Review","1","1105-9311","2623-4785","","Tverrfaglig samfunnsforskning","Samfunnsvitenskap","","1","1","1","1","1","","","","","","","","","","","","","","","","","1991","","","Hellenic Health Services Management Association","Hellas","Flerspråklig","0","https://www.eemyy.gr/%CF%80%CE%B5%CF%81%CE%B9%CE%BF%CE%B4%CE%B9%CE%BA%CF%8C-%CE%B5%CF%80%CE%B9%CE%B8%CE%B5%CF%8E%CF%81%CE%B7%CF%83%CE%B7-%CF%85%CE%B3%CE%B5%CE%B9%CE%B1%CF%83"
"497822","Complex and Enterprise Systems Engineering","06-Jun-2023 12:22:29","Complex and Enterprise Systems Engineering","1","2380-0666","2154-9508","","Tverrfaglig teknologi","Realfag og teknologi","","1","1","1","1","1","","","","","","","","","","","","","","","","18140","2009","","CRC Press","","USA","Engelsk","0","https://www.crcpress.com/Complex-and-Enterprise-Systems-Engineering/book-series/AUECOMENTSYS"
"497823","UNSCN Nutrition","06-Jun-2023 12:22:29","UNSCN Nutrition","1","1564-3743","1564-3751","","Ernæring","Medisin og helsefag","","0","0","0","0","0","","","","","","","","","","","","","","","","","1988","","","United Nations. ACC/SCN","Internasjonal","Engelsk","0","https://www.unscn.org/en/resource-center/Unscn-news"
"497830","Journal of Biomedical Research (JBR)","18-Aug-2023 13:56:25","Journal of Biomedical Research (JBR)","1","1674-8301","2352-4685","","Biomedisin","Medisin og helsefag","","1","1","1","1","1","","","","","","","","","","","","","","","","","2010","","","Editorial Department of Journal of Biomedical Research","Kina, Singapore","Engelsk","0","http://www.jbr-pub.org.cn/"
"497831","Geofizicheskiy zhurnal","06-Jun-2023 12:22:29","Geophysical journal ","1","0203-3100","2524-1052","","Geovitenskap","Realfag og teknologi","","0","0","0","0","0","","","","","","","","","","","","","","","","","1979","","","Natsional'na Akademiya Nauk Ukrainy * Instytut Heofizyky im. S.I. Subbotina","Ukraina","Flerspråklig","0","http://journals.uran.ua/geofizicheskiy"
"497832","International Journal of Grid and Utility Computing (IJGUC)","18-Aug-2023 13:56:25","International Journal of Grid and Utility Computing (IJGUC)","1","1741-847X","1741-8488","","IKT","Realfag og teknologi","","1","1","1","1","1","","","","","","","","","","","","","","","","17842","2005","","InderScience Publishers","","Storbritannia","Engelsk","0","https://www.inderscience.com/jhome.php?jcode=ijguc"
"497836","International Journal of Ecosystems and Ecology Science (IJEES)","06-Jun-2023 12:22:29","International Journal of Ecosystems and Ecology Science (IJEES)","1","","2224-4980","","Tverrfaglig naturvitenskap og medisin","Realfag og teknologi","","0","0","0","0","0","","","","","","","","","","","","","","","","","2011","","","Health and Environment Association","Albania","Engelsk","0","http://www.ijees.net/"
"497837","The programming historian","06-Jun-2023 12:22:29","The programming historian","1","","2397-2068","DOAJ","Tverrfaglig humanistisk forskning","Humaniora","","1","1","1","1","1","","","","","","","","","","","","","","","","","2012","","","The Programming Historian","Storbritannia","Engelsk","0","https://programminghistorian.org"
"497838","International Journal of Inventory Research","08-Jun-2023 11:42:57","International Journal of Inventory Research","1","1746-6962","1746-6970","","Økonomisk-administrative fag","Samfunnsvitenskap","","1","1","1","1","1","","","","","","","","","","","","","","","","17842","2008","","InderScience Publishers","","Storbritannia","Engelsk","0","https://www.inderscience.com/jhome.php?jcode=ijir"
"497839","Pakistan Administrative Review","06-Jun-2023 12:22:29","Pakistan Administrative Review","1","2520-5463","2521-0203","DOAJ","Tverrfaglig samfunnsforskning","Samfunnsvitenskap","","1","1","1","1","1","","","","","","","","","","","","","","","","","2017","","","Fatima Jinnah Women University, Pakistan","Pakistan","Engelsk","0","http://www.par.fjwu.edu.pk"
"497840","International Journal of Industrial Electronics and Drives","06-Jun-2023 12:22:29","International Journal of Industrial Electronics and Drives","1","1757-3874","1757-3882","","Elektrofag","Realfag og teknologi","","1","1","1","1","1","","","","","","","","","","","","","","","","17842","2009","","InderScience Publishers","Inderscience","Storbritannia","Engelsk","0","https://www.inderscience.com/jhome.php?jcode=ijied"
"497841","Big Data Analytics","06-Jun-2023 12:22:29","Big Data Analytics","1","","2058-6345","DOAJ","IKT","Realfag og teknologi","","1","1","1","1","1","","","","","","","","","","","","","","","","16994","2016","","BioMed Central (BMC)","","Storbritannia","Engelsk","0","https://bdataanalytics.biomedcentral.com/"
"497842","Europäisch-jüdische Studien – Beiträge","06-Jun-2023 12:22:29","European-Jewish Studies – Contributions","1","2192-9602","2192-9610","","Tverrfaglig samfunnsforskning","Samfunnsvitenskap","","1","1","1","1","1","","","","","","","","","","","","","","","","18493","2012","","Walter de Gruyter (De Gruyter)","","Tyskland","Flerspråklig","0","https://www.degruyter.com/serial/EJSB-B/html"
"497843","Quaternary","18-Aug-2023 13:56:25","Quaternary","1","","2571-550X","DOAJ","Geovitenskap","Realfag og teknologi","","1","1","1","1","1","","","","","","","","","","","","","","","","26778","2018","","MDPI","","Sveits","Engelsk","0","https://www.mdpi.com/journal/quaternary"
"497844","IEEE International Conference on Big Data and Smart Computing","06-Jun-2023 12:22:29","IEEE International Conference on Big Data and Smart Computing","1","","2375-9356","","IKT","Realfag og teknologi","","1","1","1","1","1","","","","","","","","","","","","","","","","18231","2014","","IEEE (Institute of Electrical and Electronics Engineers)","","USA","Engelsk","0","https://ieeexplore.ieee.org/xpl/conhome/1803439/all-proceedings"
"497845","Journal of Medicinal Plants for Economic Development (JOMPED)","18-Aug-2023 13:56:25","Journal of Medicinal Plants for Economic Development (JOMPED)","1","2519-559X","2616-4809","DOAJ","Tverrfaglig naturvitenskap og medisin","Realfag og teknologi","","1","1","1","1","1","","","","","","","","","","","","","","","","26681","2017","","AOSIS","","Sør-Afrika","Engelsk","0","https://jomped.org/index.php/jomped"
"497846","SA Journal of Oncology (SAJO)","06-Jun-2023 12:22:29","SA Journal of Oncology (SAJO)","1","2518-8704","2523-0646","DOAJ","Onkologi","Medisin og helsefag","","1","1","1","1","1","","","","","","","","","","","","","","","","26681","2016","","AOSIS","","Sør-Afrika","Engelsk","0","https://sajo.org.za/index.php/sajo"
"497847","Advances in immigrant family research","06-Jun-2023 12:22:29","Advances in immigrant family research","1","2625-364X","2625-3666","","Sosialforskning","Samfunnsvitenskap","","1","1","1","1","1","","","","","","","","","","","","","","","","22512","2013","","Springer","","USA","Engelsk","0","https://www.springer.com/series/8807"
"497848","International Journal for History, Culture and Modernity","18-Aug-2023 13:56:25","International Journal for History, Culture and Modernity","1","2666-6529","2213-0624","","Historie og Idéhistorie","Humaniora","","1","1","1","1","1","","","","","","","","","","","","","","","","","2013","","","BRILL","Nederland","Engelsk","0","https://brill.com/view/journals/hcm/hcm-overview.xml"
"497849","European Radiology Experimental","18-Aug-2023 13:56:25","European Radiology Experimental","1","","2509-9280","DOAJ","Radiologi og billeddiagnostikk","Medisin og helsefag","","1","1","1","1","1","","","","","","","","","","","","","","","","22512","2017","","Springer","","Sveits","Engelsk","0","https://eurradiolexp.springeropen.com"
"497850","Uden for Nummer","08-Jun-2023 11:42:57","Uden for Nummer","1","1600-888X","1604-844X","","Sosiologi","Samfunnsvitenskap","","1","1","1","1","1","","","","","","","","","","","","","","","","","2000","","","Dansk Socialrådgiverforening","Danmark","Dansk","0","https://socialraadgiverne.dk/fag-og-debat/tidsskriftet-uden-for-nummer/"
"497851","Tropical diseases, travel medicine and vaccines.","18-Aug-2023 13:56:25","Tropical diseases, travel medicine and vaccines.","1","","2055-0936","DOAJ","Infeksjoner","Medisin og helsefag","","1","1","1","1","1","","","","","","","","","","","","","","","","16994","2015","","BioMed Central (BMC)","","Storbritannia","Engelsk","0","https://tdtmvjournal.biomedcentral.com"
"497852","Microbiology Insights","08-Jun-2023 11:40:28","Microbiology Insights","1","","1178-6361","DOAJ","Infeksjoner","Medisin og helsefag","","1","1","1","1","1","","","","","","","","","","","","","","","","18411","2008","","Sage Publications","","USA","Engelsk","0","https://journals.sagepub.com/home/mbi"
"497853","Journal of Urban Mathematics Education (JUME)","18-Aug-2023 13:56:25","Journal of Urban Mathematics Education (JUME)","1","","2151-2612","DOAJ","Matematikk","Realfag og teknologi","","1","1","1","1","1","","","","","","","","","","","","","","","","20348","2008","","Texas A&M University Press","","USA","Engelsk","0","https://jume-ojs-tamu.tdl.org/jume/index.php/JUME"
"497854","Revisita Latinoamericano de Etnomatemática (RLE)","08-Jun-2023 11:42:57","Revisita Latinoamericano de Etnomatemática (RLE)","1","","2011-5474","DOAJ","Matematikk","Realfag og teknologi","","1","1","1","1","1","","","","","","","","","","","","","","","","","2008","","","Red Latinoamerica de Etnomatematica","","Engelsk","0","http://www.revista.etnomatematica.org/index.php/RevLatEm"
"497855","Zeitschrift für Orthopädie und Unfallchirurgie","18-Aug-2023 13:56:25","Zeitschrift für Orthopädie und Unfallchirurgie","1","1864-6697","1864-6743","","Kirurgiske fag","Medisin og helsefag","","0","0","0","0","0","","","","","","","","","","","","","","","","18197","2007","","Thieme","","Tyskland","Flerspråklig","0","https://www.thieme-connect.de/products/ejournals/journal/10.1055/s-00000099"
"497856","Hungarian Journal of Legal Studies (HJLS)","18-Aug-2023 13:56:25","Hungarian Journal of Legal Studies (HJLS)","1","2498-5473","2560-1067","","Rettsvitenskap","Samfunnsvitenskap","","0","0","1","1","1","","","","","","","","","","","","","","","","18045","2016","","Akadémiai Kiadó","","Ungarn","Engelsk","0","https://akjournals.com/view/journals/2052/2052-overview.xml"
"497858","International Journal of Pediatrics","18-Aug-2023 13:56:25","International Journal of Pediatrics","1","1687-9740","1687-9759","DOAJ","Pediatri","Medisin og helsefag","","1","1","1","1","1","","","","","","","","","","","","","","","","18220","2008","","Hindawi Limited","","Storbritannia","Engelsk","0","https://www.hindawi.com/journals/ijpedi/"
"497859","ChemTexts","18-Aug-2023 13:56:25","ChemTexts","1","","2199-3793","","Kjemi og materialteknologi","Realfag og teknologi","","1","1","1","1","1","","","","","","","","","","","","","","","","22512","2015","","Springer","","Sveits","Engelsk","0","https://www.springer.com/journal/40828"
"497860","Organization, Technology & Management in Construction (OTMC)","18-Aug-2023 13:56:25","Organization, Technology & Management in Construction (OTMC)","1","1847-5450","1847-6228","DOAJ","Konstruksjonsfag","Realfag og teknologi","","1","1","1","1","1","","","","","","","","","","","","","","","","","2010","","","University of Zagreb, Faculty of Civil engineering","Kroatia","Engelsk","0","https://www.grad.unizg.hr/otmc_journal"
"497861","Nanoscale Advances","18-Aug-2023 13:56:25","Nanoscale Advances","1","","2516-0230","DOAJ","Kjemi og materialteknologi","Realfag og teknologi","","1","1","1","1","1","","","","","","","","","","","","","","","","19875","2018","","Royal Society of Chemistry (RSC)","","Storbritannia","Engelsk","0","https://www.rsc.org/journals-books-databases/about-journals/nanoscale-advances/"
"497862","Substantia","18-Aug-2023 13:56:25","Substantia","1","","2532-3997","DOAJ","Kjemi og materialteknologi","Realfag og teknologi","","1","1","1","1","1","","","","","","","","","","","","","","","","19978","2017","","Firenze University Press (FUP)","","Italia","Engelsk","0","https://riviste.fupress.net/index.php/subs/about"
"497863","Review of Science, Mathematics and ICT Education","06-Jun-2023 12:22:29","Review of Science, Mathematics and ICT Education","1","1791-261X","1792-3999","DOAJ","Matematikk","Realfag og teknologi","","1","1","1","1","1","","","","","","","","","","","","","","","","","2007","","","Library & Information Center, University of Patras","Hellas","Flerspråklig","0","https://pasithee.library.upatras.gr/review"
"497864","Radio Physics and Radio Astronomy (RPRA)","18-Aug-2023 13:56:25","Radio Physics and Radio Astronomy (RPRA)","1","1027-9636","2415-7007","DOAJ","Fysikk","Realfag og teknologi","","1","1","1","1","1","","","","","","","","","","","","","","","","","1996","","","Publishing House “Akademperiodyka”/  National Academy of Sciences of Ukraine Institute of Radio Astronomy Ukrainian Committee URSI","Ukraina","Flerspråklig","0","http://rpra-journal.org.ua/index.php/ra/pages/view/aboutjournal"
"497865","Wiadomości Statystyczne. The Polish Statistician","06-Jun-2023 12:22:29","Wiadomości Statystyczne. The Polish Statistician","1","0043-518X","2543-8476","DOAJ","Samfunnsøkonomi","Samfunnsvitenskap","","1","1","1","1","1","","","","","","","","","","","","","","","","","1956","","","Główny Urząd Statystyczny (Statistics Poland)","Polen","Flerspråklig","0","https://ws.stat.gov.pl/"
"497866","Journal of Comparative Literature and Aesthetics","08-Jun-2023 11:40:28","Journal of Comparative Literature and Aesthetics","1","0252-8169","","","Filosofi","Humaniora","","1","1","1","1","1","","","","","","","","","","","","","","","","","1978","","","Vishvanatha Kaviraja Institute of Comparative Literature and Aesthetics","India","Engelsk","0","http://jcla.in"
"497867","MISES: Revista Interdisciplinar de Filosofia, Direito e Economia","06-Jun-2023 12:22:29","MISES: Interdisciplinary Journal of Philosophy, Law and Economics","1","2318-0811","2594-9187","DOAJ","Økonomisk-administrative fag","Samfunnsvitenskap","","1","1","1","1","1","","","","","","","","","","","","","","","","24120","2013","","Ludwig von Mises Institute","","Brasil","Portugisisk","0","https://www.misesjournal.org.br"
"497868","Occhialì – Rivista sul Mediterraneo islamico","06-Jun-2023 12:22:29","Occhialì – Rivista sul Mediterraneo islamico","1","","2532-6740","DOAJ","Tverrfaglig samfunnsforskning","Samfunnsvitenskap","","1","1","1","1","1","","","","","","","","","","","","","","","","","2017","","","Università della Calabria","Italia","Flerspråklig","0","http://phi.unical.it/wp34/occhiali/la-rivista/"
"497869","ICME-13 Monographs","06-Jun-2023 12:22:29","ICME-13 Monographs","1","2520-8322","2520-8330","","Matematikk","Realfag og teknologi","","1","1","1","1","1","","","","","","","","","","","","","","","","22512","2017","","Springer","","Sveits","Engelsk","0","https://www.springer.com/series/15585"
"497870","Oppimisen ja oppimisvaikeuksien erityislehti","08-Jun-2023 11:39:34","Oppimisen ja oppimisvaikeuksien erityislehti","1","2342-9046","","","Pedagogikk og utdanning","Samfunnsvitenskap","","1","1","1","1","1","","","","","","","","","","","","","","","","","2015","","","Niilo Mäki Institute","Finland","Finsk","0","https://bulletin.nmi.fi/"
"497871","Asian Journal of Management Science and Applications (AJMSA)","06-Jun-2023 12:22:29","Asian Journal of Management Science and Applications (AJMSA)","1","2049-8683","2049-8691","","Tverrfaglig teknologi","Realfag og teknologi","","1","1","1","1","1","","","","","","","","","","","","","","","","17842","2013","","InderScience Publishers","","Storbritannia","Engelsk","0","https://www.inderscience.com/jhome.php?jcode=ajmsa"
"497872","Civil Szemle","08-Jun-2023 11:39:34","Civil Review (CR)","1","1786-3341","","","Teatervitenskap og drama","Humaniora","","0","0","0","0","0","","","","","","","","","","","","","","","","","2004","","","Civil Szemle Alapitvany Új Mandátum Kiadó","Ungarn","Ungarsk","0","http://www.civilszemle.hu/en/"
"497873","Integrative Medicine Research (IMR)","18-Aug-2023 13:56:25","Integrative Medicine Research (IMR)","1","2213-4220","2213-4239","DOAJ","Biomedisin","Medisin og helsefag","","1","1","1","1","1","","","","","","","","","","","","","","","","18173","2012","","Elsevier","","Nederland","Engelsk","0","https://www.journals.elsevier.com/integrative-medicine-research"
"497874","Quaestio Insularis","06-Jun-2023 12:22:29","Quaestio Insularis","1","1471-3314","","","Lingvistikk","Humaniora","","1","1","1","1","1","","","","","","","","","","","","","","","","","2000","","","University of Cambridge, Department of Anglo-Saxon, Norse & Celtic","Storbritannia","Engelsk","0","https://www.asnc.cam.ac.uk/publications/quaestio/index.html"
