"493920","Journal of Hospitality and Tourism Management","18-Aug-2023 13:56:25","Journal of Hospitality and Tourism Management","1","1447-6770","","","Tverrfaglig samfunnsforskning","Samfunnsvitenskap","","1","1","1","1","1","1","","","","","","","","","","","","","","","18173","2002","","Elsevier","","Australia","Engelsk","0","http://www.sciencedirect.com/science/journal/14476770"
"493921","Bois et Forêts des Tropiques","18-Aug-2023 13:56:25","Journal of Forest Science to serve the South","1","0006-579X","1777-5760","","Biovitenskap","Realfag og teknologi","","0","0","0","0","0","0","","","","","","","","","","","","","","","","1947","","","Centre de cooperation internationale en recherche agronomique pour le developpement (CIRAD)","Frankrike","Flerspråklig","0","http://revues.cirad.fr/index.php/BFT"
"493922","Proceedings of the International Conference of Fluid Flow, Heat and Mass Transfer","06-Jun-2023 12:22:29","Proceedings of the International Conference of Fluid Flow, Heat and Mass Transfer","1","","2369-3029","","Tverrfaglig teknologi","Realfag og teknologi","","0","0","0","0","0","0","","","","","","","","","","","","","","","","2015","","","Avestia Publishing","Canada","Engelsk","1","https://avestia.com/TANN2017_Proceedings/"
"493923","Brill Research Perspectives in the Law of the Sea (RPLS)","08-Jun-2023 11:39:34","Brill Research Perspectives in the Law of the Sea (RPLS)","1","2451-9340","2451-9359","","Rettsvitenskap","Samfunnsvitenskap","","1","1","1","1","0","0","","","","","","","","","","","","","","","18109","2016","","Brill Academic Publishers","","Nederland","Engelsk","0","https://brill.com/view/journals/rpls/rpls-overview.xml"
"493924","IATSS Research","18-Aug-2023 13:56:25","IATSS Research","1","0386-1112","2210-4240","DOAJ","Konstruksjonsfag","Realfag og teknologi","","1","1","1","1","1","1","","","","","","","","","","","","","","","","1977","","","International Association of Traffic and Safety Sciences/Elsevier","Japan","Engelsk","0","https://www.sciencedirect.com/journal/iatss-research"
"493925","Technika Poszukiwań Geologicznych","06-Jun-2023 12:22:29","Geological Exploration Technology","1","0304-520X","","","Geovitenskap","Realfag og teknologi","","1","1","1","1","1","1","","","","","","","","","","","","","","","","1975","","","Mineral and Energy Economy Research Institute of the Polish Academy of Sciences (MEERI PAS)","Polen","Flerspråklig","0","https://min-pan.krakow.pl/wydawnictwo/en/czasopisma/technika-pozyskiwan-geologicznych-geotermia-zrownowazony-rozwoj-2/"
"493926","Estudos Teológicos","06-Jun-2023 12:22:29","Estudos Teológicos","1","0101-3130","2237-6461","DOAJ","Teologi og religionsvitenskap","Humaniora","","1","1","1","1","1","1","","","","","","","","","","","","","","","","1961","","","Faculdades EST, São Leopoldo - RS - Brasil","Brasil","Flerspråklig","0","http://periodicos.est.edu.br/index.php/estudos_teologicos/about"
"493927","Currents of Encounter. Studies in Interreligious and Intercultural Relations","06-Jun-2023 12:22:29","Currents of Encounter. Studies in Interreligious and Intercultural Relations","1","0923-6201","","","Teologi og religionsvitenskap","Humaniora","","1","1","1","1","1","1","","","","","","","","","","","","","","","18109","1989","","Brill Academic Publishers","","Nederland","Engelsk","0","http://www.brill.com/products/series/currents-encounter"
"493928","Religionen im Dialog","06-Jun-2023 12:22:29","Religionen im Dialog","1","1867-1292","","","Teologi og religionsvitenskap","Humaniora","","0","0","0","0","0","0","","","","","","","","","","","","","","","","2008","","","Waxmann Verlag","Tyskland","Tysk","0","https://www.waxmann.com/waxmann-reihen/?no_cache=1&tx_p2waxmann_pi2%5Breihe%5D=REI100219&tx_p2waxmann_pi2%5Baction%5D=show&tx_p2waxmann_pi2%5Bcontroller%5D=Reihe&cHash=996de91988a3a9c670a24266f2ce4739"
"493929","Quellen und Forschungen zur sächsischen Geschichte","06-Jun-2023 12:22:29","Quellen und Forschungen zur sächsischen Geschichte","1","1437-7926","","","Teologi og religionsvitenskap","Humaniora","","0","0","0","0","0","0","","","","","","","","","","","","","","","","1963","","","Franz Steiner Verlag","Tyskland","Tysk","0","http://www.steiner-verlag.de/reihe/view/listtitel.html?tx_crondavtitel_pi%5BfilterReihe%5D=111&tx_crondavtitel_pi%5BfilterKategorie%5D=&cHash=1cbcd5be7da8c353872abf985caeb8aa"
"493930","International Conference on Renewable Energy Research and Applications","06-Jun-2023 12:22:29","Conference on Renewable Energy Research and Applications","1","2377-6897","2572-6013","","Elektrofag","Realfag og teknologi","","1","1","1","1","1","1","","","","","","","","","","","","","","","18231","2012","","IEEE (Institute of Electrical and Electronics Engineers)","","USA","Engelsk","1","http://ieeexplore.ieee.org/xpl/conhome.jsp?punumber=1802685"
"493931","China Goes Global","15-Aug-2023 13:31:38","China Goes Global","1","2572-0333","2572-0341","","Økonomisk-administrative fag","Samfunnsvitenskap","0","1","1","1","1","1","1","","","","","","","","","","","","","","","","2008","","","China Goes Global & Chinese Globalization Association","USA","Engelsk","1","http://www.chinagoesglobal.org/"
"493932","CORPORATE GOVERNANCE AND SUSTAINABILITY REVIEW","08-Jun-2023 11:39:34","CORPORATE GOVERNANCE AND SUSTAINABILITY REVIEW","1","2519-8971","2519-898X","","Økonomisk-administrative fag","Samfunnsvitenskap","","1","1","1","1","1","1","","","","","","","","","","","","","","","","2017","","","Virtus Interpress","Ukraina","Engelsk","0","https://www.virtusinterpress.org/-Corporate-Governance-and-Sustainability-Review-.html"
"493933","Corporate Governance and Organizational Behavior Review","18-Aug-2023 13:56:25","Corporate Governance and Organizational Behavior Review","1","2521-1870","2521-1889","","Økonomisk-administrative fag","Samfunnsvitenskap","0","1","1","1","0","0","0","","","","","","","","","","","","","","","19923","2017","","Virtus InterPress","","Ukraina","Engelsk","0","https://virtusinterpress.org/-Corporate-Governance-and-Organizational-Behavior-Review-.html"
"493934","Peaceworks","06-Jun-2023 12:22:29","Peaceworks","1","2320-1754","","","Tverrfaglig samfunnsforskning","Samfunnsvitenskap","","0","0","0","0","0","0","","","","","","","","","","","","","","","","2011","","","Centre for Peace and Development (CPD)","India","Engelsk","0","http://www.development-peace.org/journal.htm"
"493935","Journal of Education and Culture Studies","06-Jun-2023 12:22:29","Journal of Education and Culture Studies","1","2573-0401","2573-041X","","Pedagogikk og utdanning","Samfunnsvitenskap","","0","0","0","0","0","0","","","","","","","","","","","","","","","","2017","","","Scholink","USA","Engelsk","0","http://www.scholink.org"
"493936","Revista do processo - RePro","06-Jun-2023 12:22:29","Procedural Review","1","0100-1981","","","Rettsvitenskap","Samfunnsvitenskap","","1","1","1","1","1","1","","","","","","","","","","","","","","","","1981","","","Thomson Reuters","Brasil","Portugisisk","0","http://www.rt.com.br/marketing/hotsite/Revistas2014/Repro.html"
"493937","International Command and Control Research and Technology Symposium (ICCRTS) proceedings","06-Jun-2023 12:28:56","International Command and Control Research and Technology Symposium (ICCRTS) proceedings","1","","2577-1604","","Tverrfaglig teknologi","Realfag og teknologi","","1","1","1","1","1","1","","","","","","","","","","","","","","","","1995","","","International Command and Control Institute","USA","Engelsk","1","http://internationalc2institute.org/"
"493938","International Research Journal of Environmental Sciences","06-Jun-2023 12:22:29","International Research Journal of Environmental Sciences","1","","2319-1414","","Biovitenskap","Realfag og teknologi","","0","0","0","0","0","0","","","","","","","","","","","","","","","","2012","","","International Science Community Association","India","Engelsk","0","http://www.isca.in/IJENS/"
"493939","Advances in Operator Theory","18-Aug-2023 13:56:25","Advances in Operator Theory","1","2662-2009","2538-225X","","Matematikk","Realfag og teknologi","","0","0","0","0","0","0","","","","","","","","","","","","","","","18096","2016","","Birkhäuser Verlag","Tusi Mathematical Research Group","Sveits, Iran","Engelsk","0","https://www.springer.com/journal/43036"
"493940","Jahrbuch für Wirtschaftswissenschaften","18-Aug-2023 13:56:25","Review of Economics","1","0948-5139","2366-035X","","Samfunnsøkonomi","Samfunnsvitenskap","","1","1","1","1","1","1","","","","","","","","","","","","","","","","1995","","","De Gruyter Oldenbourg","Tyskland","Flerspråklig","0","https://www.degruyter.com/journal/key/roe/html"
"493941","Bilingual Processing and Asquisition","15-Aug-2023 13:31:38","Bilingual Processing and Asquisition","1","2352-0531","","","Lingvistikk","Humaniora","0","1","1","1","1","1","1","","","","","","","","","","","","","","","","2016","","","John Benjamins Publishing Company","Nederland","Engelsk","0","https://benjamins.com/"
"493942","Journal of Functional Morphology and Kinesiology","18-Aug-2023 13:56:25","Journal of Functional Morphology and Kinesiology","1","","2411-5142","DOAJ","Generell medisin","Medisin og helsefag","","1","1","1","1","1","1","","","","","","","","","","","","","","","26778","2016","","MDPI","","Sveits","Engelsk","0","http://www.mdpi.com/journal/jfmk"
"493943","Current Aging Science","18-Aug-2023 13:56:25","Current Aging Science","1","1874-6098","1874-6128","","Geriatri","Medisin og helsefag","","0","0","0","0","0","0","","","","","","","","","","","","","","","26744","2008","","Bentham Science Publishers","","Nederland","Engelsk","0","http://www.eurekaselect.com/680/journal/current-aging-science"
"493944","Nature Electronics","18-Aug-2023 13:56:25","Nature Electronics","1","","2520-1131","","IKT","Realfag og teknologi","","1","1","1","1","1","1","","","","","","","","","","","","","","","","2018","","","Nature Portfolio","Storbritannia","Engelsk","0","https://www.nature.com/natelectron/"
"493945","World Scientific Series on the Economics of Climate Change","06-Jun-2023 12:22:29","World Scientific Series on the Economics of Climate Change","1","2010-2127","","","Samfunnsøkonomi","Samfunnsvitenskap","","0","0","0","0","0","0","","","","","","","","","","","","","","","","2011","","","World Scientific","Singapore","Engelsk","0","https://www.worldscientific.com/series/wssecc"
"493946","Romanian Journal of European Affairs","18-Aug-2023 13:56:25","Romanian Journal of European Affairs","1","1582-8271","1841-4273","DOAJ","Statsvitenskap","Samfunnsvitenskap","","1","1","1","1","1","1","","","","","","","","","","","","","","","","2001","","","","Romania","Engelsk","0","http://rjea.ier.gov.ro/"
"493947","IEEE Power Electronics Magazine","18-Aug-2023 13:56:25","IEEE Power Electronics Magazine","1","2329-9207","2329-9215","","Elektrofag","Realfag og teknologi","","1","1","1","1","1","1","","","","","","","","","","","","","","","","2014","","","IEEE Power Electronics Society","USA","Engelsk","1","http://ieeexplore.ieee.org/xpl/RecentIssue.jsp?punumber=6570649"
"493948","Journal of Patient-Reported Outcomes","18-Aug-2023 13:56:25","Journal of Patient-Reported Outcomes","1","","2509-8020","DOAJ","Generell medisin","Medisin og helsefag","","1","1","1","1","1","1","","","","","","","","","","","","","","","22512","2017","","Springer","","Storbritannia","Engelsk","0","https://jpro.springeropen.com/"
"493949","American Journal of Information Systems","06-Jun-2023 12:22:29","American Journal of Information Systems","1","2374-1953","2374-1988","","IKT","Realfag og teknologi","","0","0","0","0","0","0","","","","","","","","","","","","","","","","2013","","","SciEP","USA","Engelsk","0","http://www.sciepub.com/journal/ajis"
"493950","Asia Pacific Journal of Public Administration","18-Aug-2023 13:56:25","Asia Pacific Journal of Public Administration","1","2327-6665","2327-6673","","Statsvitenskap","Samfunnsvitenskap","","1","1","1","1","1","1","","","","","","","","","","","","","","","","2004","","","","Storbritannia","Engelsk","0","http://www.tandfonline.com/loi/rapa20"
"493951","Labour History: A Journal of Labour and Social History","18-Aug-2023 13:56:25","Labour History: A Journal of Labour and Social History","1","0023-6942","1839-3039","","Historie og Idéhistorie","Humaniora","","1","1","1","1","0","0","","","","","","","","","","","","","","","","1963","","","The Australian Society for the Study of Labour History","Australia","Engelsk","0","https://www.labourhistory.org.au/journal/about/"
"493952","Qualitative Research Journal","18-Aug-2023 13:56:25","Qualitative Research Journal","1","1443-9883","1448-0980","","Pedagogikk og utdanning","Samfunnsvitenskap","","1","1","1","1","1","1","","","","","","","","","","","","","","","","2000","","","Emerald Insight","Australia","Engelsk","0","http://www.emeraldinsight.com/journal/qrj"
