"485729","SAE International Journal of Engines","18-Aug-2023 13:56:25","SAE International Journal of Engines","1","1946-3936","1946-3944","","Konstruksjonsfag","Realfag og teknologi","","1","1","1","1","1","1","1","1","1","","","","","","","","","","","","","2009","","","SAE International","USA","Engelsk","0","http://saeeng.saejournals.org/"
"485730","SAE International Journal of Fuels and Lubricants","18-Aug-2023 13:56:25","SAE International Journal of Fuels and Lubricants","1","1946-3952","1946-3960","","Geovitenskap","Realfag og teknologi","","1","1","1","1","1","1","1","1","1","","","","","","","","","","","","","2009","","","SAE International","USA","Engelsk","0","http://saefuel.saejournals.org/"
"485731","SAE International Journal of Materials & Manufacturing","18-Aug-2023 13:56:25","SAE International Journal of Materials & Manufacturing","1","1946-3979","1946-3987","","Kjemi og materialteknologi","Realfag og teknologi","","1","1","1","1","1","1","1","1","1","","","","","","","","","","","","","2009","","","SAE International","USA","Engelsk","0","http://saematman.saejournals.org/"
"485732","SAE International Journal of Passenger Cars - Mechanical Systems","06-Jun-2023 12:22:29","SAE International Journal of Passenger Cars - Mechanical Systems","1","1946-3995","1946-4002","","Konstruksjonsfag","Realfag og teknologi","","1","1","1","1","1","1","1","1","1","","","","","","","","","","","","","2009","","","SAE International","USA","Engelsk","0","http://saepcmech.saejournals.org/"
"485733","SAE International Journal of Passenger Cars - Electronic and Electrical Systems","18-Aug-2023 13:54:28","SAE International Journal of Passenger Cars - Electronic and Electrical Systems","1","1946-4614","1946-4622","","IKT","Realfag og teknologi","","1","1","1","1","1","1","1","1","1","","","","","","","","","","","","","2009","","","SAE International","USA","Engelsk","0","http://saepcelec.saejournals.org/"
"485734","SAE International Journal of Alternative Powertrains","06-Jun-2023 12:22:29","SAE International Journal of Alternative Powertrains","1","2167-4191","2167-4205","","Konstruksjonsfag","Realfag og teknologi","","1","1","1","1","1","1","1","1","1","","","","","","","","","","","","","2012","","","SAE International","USA","Engelsk","0","http://saealtpow.saejournals.org/"
"485735","SAE International Journal of Transportation Safety","18-Aug-2023 13:56:25","SAE International Journal of Transportation Safety","1","2327-5626","2327-5634","","Tverrfaglig teknologi","Realfag og teknologi","","1","1","1","1","1","1","1","1","1","","","","","","","","","","","","","2013","","","SAE International","USA","Engelsk","0","http://saetransaf.saejournals.org/"
"485736","Wasserwirtschaft","18-Aug-2023 13:56:25","Wasserwirtschaft","1","0043-0978","2192-8762","","Biovitenskap","Realfag og teknologi","","1","1","1","1","1","1","1","1","1","","","","","","","","","","","","22512","1948","","Springer","","Tyskland","Flerspråklig","0","http://www.springer.com/environment/journal/35147"
"485738","Forskning om undervisning och lärande","15-Aug-2023 13:31:38","Forskning om undervisning och lärande","1","2000-9674","2001-6131","","Pedagogikk og utdanning","Samfunnsvitenskap","0","1","1","1","1","1","1","1","1","1","","","","","","","","","","","","","2009","","","Stiftelsen SAF i samverkan med Lärarförbundet","Sverige","Svensk","0","http://forskul.se"
"485745","Critical Military Studies","18-Aug-2023 13:56:25","Critical Military Studies","1","2333-7486","2333-7494","","Statsvitenskap","Samfunnsvitenskap","","1","1","1","1","1","1","1","0","0","","","","","","","","","","","","18442","2015","","Taylor & Francis","","Storbritannia","Engelsk","0","http://www.tandfonline.com/loi/rcms20"
"485747","Eesti ja soome-ugri keeleteaduse ajakiri","18-Aug-2023 13:56:25","Journal of Estonian and Finno-Ugric Linguistics","1","1736-8987","2228-1339","DOAJ","Lingvistikk","Humaniora","","1","1","1","1","1","1","1","1","1","","","","","","","","","","","","","2010","","","University of Tartu Press","Estland","Engelsk","0","http://jeful.ut.ee/index.php/JEFUL"
"485749","Gate to Computer Science and Research","06-Jun-2023 12:22:29","Gate to Computer Science and Research","1","2241-9055","2241-9063","","IKT","Realfag og teknologi","","0","0","0","0","0","0","0","0","0","","","","","","","","","","","","","2014","","","Science gate publishing","Hellas","Engelsk","0","http://sciencegatepub.com/books/gcsr/"
"485750","Dotawo. A Journal of Nubian Studies","08-Jun-2023 11:40:28","Dotawo. A Journal of Nubian Studies","1","","2373-2571","DOAJ","Tverrfaglig humanistisk forskning","Humaniora","","1","1","1","1","1","1","1","0","0","","","","","","","","","","","","","2014","","","Fairfield University","USA","Engelsk","0","http://digitalcommons.fairfield.edu/djns/"
"485751","Revue du Gévaudan, des Causses et des Cévennes","06-Jun-2023 12:22:29","Revue du Gévaudan, des Causses et des Cévennes","1","0484-8691","","","Historie og Idéhistorie","Humaniora","","0","0","0","0","0","0","0","0","0","","","","","","","","","","","","","1955","","","Société des lettres, sciences et arts","Frankrike","Fransk","0","http://www.societedeslettres48.org/index.php?option=com_content&view=article&id=98&Itemid=13"
"485752","Il Capitale Culturale. Studies on the Value of Cultural Heritage","18-Aug-2023 13:56:25","Il Capitale Culturale. Studies on the Value of Cultural Heritage","1","","2039-2362","DOAJ","Tverrfaglig humanistisk forskning","Humaniora","","1","1","1","1","1","1","1","1","1","","","","","","","","","","","","","2010","","","Università di Macerata","Italia","Italiensk","0","http://riviste.unimc.it/index.php/cap-cult"
"485758","Studies in Costume & Performance","18-Aug-2023 13:56:25","Studies in Costume & Performance","1","2052-4013","2052-4021","","Teatervitenskap og drama","Humaniora","","1","1","1","1","1","0","0","0","0","","","","","","","","","","","","18252","2016","","Intellect Ltd.","","Storbritannia","Engelsk","0","https://www.intellectbooks.com/studies-in-costume-performance"
"485759","Proceeding International Conference on Operations and Supply Chain Management (OSCM)","06-Jun-2023 12:22:29","Proceeding International Conference on Operations and Supply Chain Management (OSCM)","1","2407-2273","","","Kjemi og materialteknologi","Realfag og teknologi","","0","0","0","0","0","0","0","0","0","","","","","","","","","","","","","2014","","","Surabaya: Jurusan Teknik Industri, Fakultas Teknologi Industri, Institut Teknologi Sepuluh Nopember","Indonesia","Ukjent","1","http://www.oscm-forum.org"
"485764","The Pluralist","18-Aug-2023 13:56:25","The Pluralist","1","1930-7365","1944-6489","","Filosofi","Humaniora","","1","1","1","1","1","1","1","1","1","","","","","","","","","","","","","2006","","","University of Illinois Press","USA","Engelsk","0","http://www.press.uillinois.edu/journals/plur.html"
"485765","European Journal of Pragmatism and American Philosophy","18-Aug-2023 13:56:25","European Journal of Pragmatism and American Philosophy","1","","2036-4091","DOAJ","Filosofi","Humaniora","","1","1","1","1","1","1","1","1","1","","","","","","","","","","","","","2009","","","Associazione Culturale Pragma","Italia","Engelsk","0","https://journals.openedition.org/ejpap/"
"485766","Pragmatism Today","18-Aug-2023 13:56:25","Pragmatism Today","1","","1338-2799","","Filosofi","Humaniora","","1","1","1","1","1","1","1","0","0","","","","","","","","","","","","","2010","","","Central European Pragmatist Forum","Slovakia","Engelsk","0","http://www.pragmatismtoday.eu/"
"485767","Journal of games criticism","08-Jun-2023 11:39:34","Journal of games criticism","1","","2374-202X","","Medier og kommunikasjon","Humaniora","","0","0","0","0","0","0","0","0","0","","","","","","","","","","","","","2014","","","Rensselaer Polytechnic Institute","USA","Engelsk","0","http://gamescriticism.org"
"485771","Studien zum Neuen Testament und seiner Umwelt","06-Jun-2023 12:22:29","Studien zum Neuen Testament und seiner Umwelt","1","1027-3360","","","Teologi og religionsvitenskap","Humaniora","","1","1","1","1","1","1","1","1","","","","","","","","","","","","","","1976","","","Katholisch-Theologische Privatuniversität Linz","Østerrike","Flerspråklig","0","http://www.sntu.at"
"485788","Nordic journal of nursing research","18-Aug-2023 13:56:25","Nordic journal of nursing research","1","2057-1585","2057-1593","","Sykepleie","Medisin og helsefag","","1","1","1","1","1","1","1","1","1","","","","","","","","","","","","18411","2015","","Sage Publications","","Storbritannia","Engelsk","0","http://www.uk.sagepub.com/journals/Journal202360/title"
"485789","Zhongguo Jixie Gongcheng Xuekan","18-Aug-2023 13:56:25","Journal of the Chinese Society of Mechanical Engineers","1","0257-9731","","","Konstruksjonsfag","Realfag og teknologi","","1","1","1","1","1","1","1","1","1","","","","","","","","","","","","","1980","","","Chinese Society of Mechanical Engineer","Taiwan","Flerspråklig","0","http://csme-journal.nutn.edu.tw/index.asp"
"485790","Critical Studies in Teaching and Learning","18-Aug-2023 13:56:25","Critical Studies in Teaching and Learning","1","","2310-7103","DOAJ","Pedagogikk og utdanning","Samfunnsvitenskap","","1","1","1","1","1","1","1","1","1","","","","","","","","","","","","","2013","","","University of the Western Cape","Sør-Afrika","Engelsk","0","http://cristal.epubs.ac.za/"
"485791","Review of Economics & Finance","18-Aug-2023 13:56:25","Review of Economics & Finance","1","1923-7529","1923-8401","","Økonomisk-administrative fag","Samfunnsvitenskap","","0","0","0","0","0","0","0","0","0","","","","","","","","","","","","","2011","","","Better Advanced Press","Canada","Engelsk","0","http://www.bapress.ca/ref.php"
"485792","@nalyses","06-Jun-2023 12:22:29","@nalyses","1","","1715-9261","","Romansk","Humaniora","","1","1","1","1","1","1","1","1","1","","","","","","","","","","","","","2006","","","Université d'Ottawa. Département de français","Canada","Fransk","0","https://uottawa.scholarsportal.info/ojs/index.php/revue-analyses/index"
"485793","British Journal of Education, Society & Behavioural Science","08-Jun-2023 11:39:34","British Journal of Education, Society & Behavioural Science","1","","2278-0998","","Pedagogikk og utdanning","Samfunnsvitenskap","","0","0","0","0","0","1","1","1","1","","","","","","","","","","","","","2012","","","Sciencedomain International","India","Engelsk","0","http://www.sciencedomain.org/journal/21"
"485794","Historia (Three Rivers)","15-Aug-2023 13:31:38","Historia (Three Rivers)","1","0018-229X","2309-8392","DOAJ","Historie og Idéhistorie","Humaniora","0","1","1","1","1","1","1","1","1","1","","","","","","","","","","","","","1956","","","Historical Association of South Africa","Sør-Afrika","Flerspråklig","0","http://www.scielo.org.za/scielo.php?script=sci_serial&pid=0018-229X&lng=en&nrm=iso"
"485795","Nordic Journal of Studies in Educational Policy","18-Aug-2023 13:56:25","Nordic Journal of Studies in Educational Policy","1","","2002-0317","DOAJ","Pedagogikk og utdanning","Samfunnsvitenskap","","1","1","1","1","1","1","1","1","1","","","","","","","","","","","","18442","2015","","Taylor & Francis","","Storbritannia","Engelsk","0","https://www.tandfonline.com/journals/znst20"
"485796","Regional Research of Russia","18-Aug-2023 13:56:25","Regional Research of Russia","1","2079-9705","2079-9713","","Geografi","Samfunnsvitenskap","","1","1","1","1","1","1","1","1","1","","","","","","","","","","","","22512","2011","","Springer","","Russland","Engelsk","0","http://www.springer.com/economics/regional+science/journal/13393"
"485797","Guangzi xuebao","18-Aug-2023 13:56:25","Acta Photonica Sinica","1","1004-4213","","","Fysikk","Realfag og teknologi","","1","1","1","1","1","1","1","1","1","","","","","","","","","","","","","1992","","","Kexue Chubanshe","Kina","Kinesisk","0","http://www.oriprobe.com/journals/gzxb.html"
"485798","Studies in Russian and Soviet Cinema","18-Aug-2023 13:56:25","Studies in Russian and Soviet Cinema","1","1750-3132","1750-3140","","Medier og kommunikasjon","Humaniora","","1","1","1","1","1","1","1","1","1","","","","","","","","","","","","18442","2007","","Taylor & Francis","","Storbritannia","Engelsk","0","http://www.tandfonline.com/loi/rrsc20"
"485799","Journal of Interactive Technology and Pedagogy","06-Jun-2023 12:22:29","Journal of Interactive Technology and Pedagogy","1","","2166-6245","","Pedagogikk og utdanning","Samfunnsvitenskap","","0","0","0","0","0","0","0","0","0","","","","","","","","","","","","","2012","","","City University of New York","USA","Engelsk","0","http://jitp.commons.gc.cuny.edu/"
