"499291","Journal of Science and Technology in Lighting","06-Jun-2023 12:22:29","Journal of Science and Technology in Lighting","1","2432-3225","2432-3233","","IKT","Realfag og teknologi","","1","1","1","1","1","1","1","","","","","","","","","","","","","","","2017","","","Illuminating Engineering Institute of Japan","Japan","Engelsk","0","https://www.jstage.jst.go.jp/browse/jstl/-char/en"
"499292","Psychology of Sexual Orientation and Gender Diversity","18-Aug-2023 13:56:25","Psychology of Sexual Orientation and Gender Diversity","1","2329-0382","2329-0390","","Psykologi","Medisin og helsefag","","1","1","1","","","","","","","","","","","","","","","","","","18063","2013","","American Psychological Association (APA)","","USA","Engelsk","0","https://www.apa.org/pubs/journals/sgd"
"499311","Learning and Analytics in Intelligent Systems (LAIS)","06-Jun-2023 12:17:35","Learning and Analytics in Intelligent Systems (LAIS)","1","2662-3447","2662-3455","","IKT","Realfag og teknologi","","1","1","1","1","","","","","","","","","","","","","","","","","22512","2019","","Springer","","Sveits","Engelsk","0","https://www.springer.com/series/16172"
"499312","Applications in Engineering Science","18-Aug-2023 13:56:25","Applications in Engineering Science","1","","2666-4968","DOAJ","Konstruksjonsfag","Realfag og teknologi","","1","1","1","1","","","","","","","","","","","","","","","","","18173","2020","","Elsevier","","Storbritannia","Engelsk","0","https://www.sciencedirect.com/journal/Applications-in-Engineering-Science"
"499314","MAHABBAH: Journal of Religion and Education (MJRE)","06-Jun-2023 12:22:29","MAHABBAH: Journal of Religion and Education (MJRE)","1","","2723-147X","","Teologi og religionsvitenskap","Humaniora","","0","0","0","0","","","","","","","","","","","","","","","","","","2020","","","Scriptura Indonesia","Indonesia","Flerspråklig","0","http://mahabbah.org/e-journal/index.php/mjre"
"499318","Optics","08-Jun-2023 11:39:34","Optics","1","","2673-3269","DOAJ","Fysikk","Realfag og teknologi","","1","1","1","1","","","","","","","","","","","","","","","","","26778","2020","","MDPI","","Sveits","Engelsk","0","https://www.mdpi.com/journal/optics"
"499319","International Journal of Bullying Prevention","18-Aug-2023 13:56:25","International Journal of Bullying Prevention","1","2523-3653","2523-3661","","Tverrfaglig samfunnsforskning","Samfunnsvitenskap","","1","1","1","1","","","","","","","","","","","","","","","","","22512","2019","","Springer","International Bullying Prevention Association","Sveits","Engelsk","0","https://www.springer.com/journal/42380"
"499320","Journal of Global Postcolonial Studies","18-Aug-2023 13:56:25","Journal of Global Postcolonial Studies","1","2643-8380","2643-8399","","Tverrfaglig humanistisk forskning","Humaniora","","1","1","1","1","","","","","","","","","","","","","","","","","25156","2020","","University Press of Florida","","USA","Engelsk","0","http://journals.upress.ufl.edu/jgps/index"
"499321","rEFLections","18-Aug-2023 13:56:25","rEFLections","1","1513-5934","2651-1479","","Pedagogikk og utdanning","Samfunnsvitenskap","","1","1","1","1","","","","","","","","","","","","","","","","","","2000","","","King Mongkut's University of Technology Thonburi, Thailand","Thailand","Engelsk","0","https://so05.tci-thaijo.org/index.php/reflections/index"
"499322","Horticulture Research","18-Aug-2023 13:56:25","Horticulture Research","1","2662-6810","2052-7276","DOAJ","Biovitenskap","Realfag og teknologi","","1","1","1","1","","","","","","","","","","","","","","","","","26805","2014","","Springer Nature","Nanjing Agricultural University","Kina, Storbritannia","Engelsk","0","https://www.nature.com/hortres/"
"499323","Περιοδικό Εκπαίδευση και Θέατρο","06-Jun-2023 12:22:29","Education & Theatre Journal","1","1109-821X","","","Teatervitenskap og drama","Humaniora","","1","1","1","1","","","","","","","","","","","","","","","","","","2003","","","Hellenic Theatre/Drama & Education Network (TENet-Gr)","Hellas","Gresk","0","http://theatroedu.gr/en/What-we-do/Education-Theatre-Journal"
"499324","Oceans","06-Jun-2023 12:22:29","Oceans","1","","2673-1924","DOAJ","Geovitenskap","Realfag og teknologi","","1","1","1","1","","","","","","","","","","","","","","","","","26778","2019","","MDPI","","Sveits","Engelsk","0","https://www.mdpi.com/journal/oceans"
"499325","International Journal of Economics and Business Administration (IJEBA)","06-Jun-2023 12:22:29","International Journal of Economics and Business Administration (IJEBA)","1","","2241-4754","","Økonomisk-administrative fag","Samfunnsvitenskap","","1","1","1","1","","","","","","","","","","","","","","","","","","2013","","","International strategic management association","Hellas","Engelsk","0","https://www.ijeba.com/"
"499343","Alternative Francophone - Pour une francophonie en mode mineur (AF)","08-Jun-2023 11:39:34","Alternative Francophone - Pour une francophonie en mode mineur (AF)","1","","1916-8470","DOAJ","Litteraturvitenskap","Humaniora","","1","1","1","1","","","","","","","","","","","","","","","","","","2008","","","University of Alberta","Canada","Fransk","0","https://journals.library.ualberta.ca/af/index.php/af/about"
"499344","AI","06-Jun-2023 12:17:35","AI","1","","2673-2688","DOAJ","IKT","Realfag og teknologi","","1","1","1","1","","","","","","","","","","","","","","","","","26778","2019","","MDPI","","Sveits","Engelsk","0","https://www.mdpi.com/journal/ai"
"499346","Zetetiké","06-Jun-2023 12:22:29","Zetetiké","1","0104-4877","2176-1744","DOAJ","Pedagogikk og utdanning","Samfunnsvitenskap","","0","0","0","0","","","","","","","","","","","","","","","","","","1993","","","Universidade Estadual de Campinas, Faculty of Education","Brasil","Portugisisk","0","https://periodicos.sbu.unicamp.br/ojs/index.php/zetetike/index"
"499349","Central European Journal of Labour Law and Personnel Management","06-Jun-2023 12:22:29","Central European Journal of Labour Law and Personnel Management","1","2644-4917","2644-4542","","Rettsvitenskap","Samfunnsvitenskap","","1","1","1","1","","","","","","","","","","","","","","","","","","2018","","","Labour Law Association","Slovakia","Engelsk","0","https://www.ceeol.com/search/journal-detail?id=2411"
"499360","Palgrave Studies in Business, Arts and Humanities (PSBAH)","06-Jun-2023 12:22:29","Palgrave Studies in Business, Arts and Humanities (PSBAH)","1","2662-1266","2662-1274","","Økonomisk-administrative fag","Samfunnsvitenskap","","1","1","1","1","","","","","","","","","","","","","","","","","18370","2018","","Palgrave Macmillan","","Sveits","Engelsk","0","https://www.palgrave.com/gp/series/15463"
"499361","Revista Internacional de Pesquisa em Educação Matemática","06-Jun-2023 12:22:29","International Journal for Research in Mathematics Education","1","","2238-0345","","Pedagogikk og utdanning","Samfunnsvitenskap","","1","1","1","1","","","","","","","","","","","","","","","","","","2011","","","Sociedade Brasileira de Educação Matemática","Brasil","Flerspråklig","0","http://sbem.iuri0094.hospedagemdesites.ws/revista/index.php/ripem"
"499362","South African Journal of Education (SAJE)","18-Aug-2023 13:56:25","South African Journal of Education (SAJE)","1","0256-0100","2076-3433","DOAJ","Pedagogikk og utdanning","Samfunnsvitenskap","","1","1","1","1","","","","","","","","","","","","","","","","","","1981","","","Official journal of the Education Association of South Africa (EASA)","Sør-Afrika","Flerspråklig","0","http://www.sajournalofeducation.co.za/index.php/saje/index"
"499363","JMIR Nursing","08-Jun-2023 11:39:34","JMIR Nursing","1","","2562-7600","DOAJ","Sykepleie","Medisin og helsefag","","1","1","1","1","","","","","","","","","","","","","","","","","","2018","","","JMIR Publications Inc.","Canada","Engelsk","0","https://nursing.jmir.org/"
"499364","Journal of Polymer Science","18-Aug-2023 13:56:25","Journal of Polymer Science","1","2642-4150","2642-4169","","Kjemi og materialteknologi","Realfag og teknologi","","1","1","1","1","","","","","","","","","","","","","","","","","18270","2020","","John Wiley & Sons","","USA","Engelsk","0","https://onlinelibrary.wiley.com/journal/26424169"
"499365","Journal of the British Academy (JBA)","08-Jun-2023 11:40:28","Journal of the British Academy (JBA)","1","","2052-7217","DOAJ","Tverrfaglig humanistisk forskning","Humaniora","","1","1","1","1","","","","","","","","","","","","","","","","","","2013","","","The British Academy","USA","Engelsk","0","https://www.thebritishacademy.ac.uk/publishing/journal-british-academy/"
"499366","Journal of Cybersecurity and Privacy (JCP)","06-Jun-2023 12:28:56","Journal of Cybersecurity and Privacy (JCP)","1","","2624-800X","DOAJ","IKT","Realfag og teknologi","","1","1","1","0","","","","","","","","","","","","","","","","","26778","2018","","MDPI","","Sveits","Engelsk","0","https://www.mdpi.com/journal/jcp"
"499367","Athens Journal of Sports (AJS)","08-Jun-2023 11:40:28","Athens Journal of Sports (AJS)","1","","2241-7915","","Idrettsforskning","Medisin og helsefag","","1","1","1","1","","","","","","","","","","","","","","","","","24062","2014","","Athens Institute for Education and Research (ATINER)","","Hellas","Engelsk","0","https://www.athensjournals.gr/ajspo"
"499368","Journal of Agricultural and Marine Sciences (JAMS)","06-Jun-2023 12:22:29","Journal of Agricultural and Marine Sciences (JAMS)","1","2410-1060","2410-1079","DOAJ","Tverrfaglig naturvitenskap og medisin","Realfag og teknologi","","1","1","1","1","","","","","","","","","","","","","","","","","","2014","","","Sultan Qaboos University, Oman","","Flerspråklig","0","https://journals.squ.edu.om/index.php/jams"
"499374","Revista da UIIPS - Unidade de Investigacao do Instituto Politécnico de Santarém","06-Jun-2023 12:22:29","Revista da UIIPS - Unidade de Investigacao do Instituto Politécnico de Santarém","1","2182-9616","2182-9608","","Tverrfaglig samfunnsforskning","Samfunnsvitenskap","","0","0","0","0","","","","","","","","","","","","","","","","","","2013","","","Instituto Politécnico de Santarém","Portugal","Portugisisk","0","https://revistas.rcaap.pt/uiips/index"
"499375","Behavioral Science & Policy (BSP)","18-Aug-2023 13:56:25","Behavioral Science & Policy (BSP)","1","2379-4607","2379-4615","","Psykologi","Medisin og helsefag","","1","1","1","1","","","","","","","","","","","","","","","","","","2015","","","Behavioral Science & Policy Association","USA","Engelsk","0","https://behavioralpolicy.org/publications/"
"499376","Mining Science and Technology (Russia)","18-Aug-2023 13:56:25","Gornye nauki i tehnologii","1","","2500-0632","DOAJ","Geovitenskap","Realfag og teknologi","","1","1","1","1","","","","","","","","","","","","","","","","","","2016","","","The National University of Science and Technology MISiS (NUST MISiS), Moscow, Russia","Russland","Flerspråklig","0","https://mst.misis.ru"
"499377","Critical Times: Interventions in Global Critical Theory","08-Jun-2023 11:39:34","Critical Times: Interventions in Global Critical Theory","1","","2641-0478","DOAJ","Tverrfaglig samfunnsforskning","Samfunnsvitenskap","","1","1","1","1","","","","","","","","","","","","","","","","","18151","2018","","Duke University Press","","USA","Engelsk","0","https://www.dukeupress.edu/critical-times"
"499378","Advanced Dental Journal","06-Jun-2023 12:22:29","Advanced Dental Journal","1","2636-302X","2636-3038","DOAJ","Odontologi","Medisin og helsefag","","0","0","0","0","","","","","","","","","","","","","","","","","","2019","","","Faculty of Oral & Dental Medicine, Cairo University","Egypt","Engelsk","0","https://adjc.journals.ekb.eg/"
"499379","The Journal of Diversity and Gender Studies (DiGeSt)","08-Jun-2023 11:39:34","The Journal of Diversity and Gender Studies (DiGeSt)","1","2593-0273","2593-0281","DOAJ","Kjønnsforskning","Samfunnsvitenskap","","1","1","1","1","","","","","","","","","","","","","","","","","","2014","","","Ghent University Open Access","Belgia","Engelsk","0","https://www.digest.ugent.be/index"
"499380","ARCHAEOLOGIAE Research by Foreign Missions in Italy","06-Jun-2023 12:22:29","ARCHAEOLOGIAE Research by Foreign Missions in Italy","1","1723-5804","1724-2274","","Arkeologi og konservering","Humaniora","","1","1","1","1","","","","","","","","","","","","","","","","","","2003","","","Fabrizio Serra editore,Pisa- Roma","Italia","Flerspråklig","0","http://archaeologiae.libraweb.net"
"499381","Frontiers in Blockchain","08-Jun-2023 11:40:28","Frontiers in Blockchain","1","","2624-7852","DOAJ","IKT","Realfag og teknologi","","1","1","1","1","","","","","","","","","","","","","","","","","26841","2018","","Frontiers Media S.A.","","Sveits","Engelsk","0","https://www.frontiersin.org/journals/blockchain"
