"471373","The Police Journal","18-Aug-2023 13:56:25","The Police Journal","1","0032-258X","1740-5599","","Tverrfaglig samfunnsforskning","Samfunnsvitenskap","","1","1","1","1","1","1","1","1","1","1","1","1","1","1","1","1","1","","","","","","","","Vathek Publishing","Storbritannia","","0","http://www.vathek.com/pj/home.php"
"471374","Asian Journal of Water, Environment and Pollution","18-Aug-2023 13:56:25","Asian Journal of Water, Environment and Pollution","1","0972-9860","1875-8568","","Biovitenskap","Realfag og teknologi","","1","1","1","1","1","1","1","1","1","1","1","1","1","1","1","1","1","","","","18259","","","IOS Press","","Nederland","","0","http://www.iospress.nl/loadtop/load.php?isbn=09729860"
"471375","Journal of Applied Packaging Research","08-Jun-2023 11:42:57","Journal of Applied Packaging Research","1","1557-7244","","DOAJ","Økonomisk-administrative fag","Samfunnsvitenskap","","1","1","1","1","1","1","1","1","1","1","1","1","1","1","1","1","1","","","","","","","","DEStech Publications, Inc.","USA","","0","http://www.destechpub.com/pageview.asp?pageid=31576"
"471376","Nepal Journal of Science and Technology (NJST)","06-Jun-2023 12:17:35","Nepal Journal of Science and Technology (NJST)","1","1994-1412","","","Tverrfaglig teknologi","Realfag og teknologi","","1","1","0","0","0","0","0","0","0","0","0","","","","","","","","","","","1999","","","Royal Nepal Academy of Science and Technology","Nepal","Engelsk","0","https://www.nepjol.info/index.php/NJST/about"
"471377","Himalayan Journal of Sciences","06-Jun-2023 12:22:29","Himalayan Journal of Sciences","1","1727-5210","1727-5229","","Biovitenskap","Realfag og teknologi","","1","1","1","1","1","1","1","1","1","1","1","1","1","1","1","1","1","","","","","","","","Himalayan Journal Publishing Group","Nepal","","0","http://himjsci.com/"
"471378","Strategic Analysis","18-Aug-2023 13:56:25","Strategic Analysis","1","0970-0161","1754-0054","","Statsvitenskap","Samfunnsvitenskap","","1","1","1","1","1","1","1","1","1","1","1","1","1","1","1","1","1","","","","18442","","","Taylor & Francis","","Storbritannia","","0","http://www.tandf.co.uk/journals/titles/09700161.asp"
"471379","América Latina Hoy","18-Aug-2023 13:56:25","ALH","1","1130-2887","2340-4396","DOAJ","Statsvitenskap","Samfunnsvitenskap","","1","1","1","1","1","1","1","1","1","1","1","1","1","1","1","1","1","","","","","","","","Ediciones Universidad de Salamanca","Spania","Spansk","0","https://revistas.usal.es//index.php/1130-2887/index"
"471380","Lateinamerika Analysen","15-Feb-2016 14:02:49","Lateinamerika Analysen","0","0176-2818","","","Statsvitenskap","Samfunnsvitenskap","","","","","","","","","","","","","","","","","","1","","","","","1984","2001","","GIGA Institute for Ibero-American Studies","Tyskland","","0","http://www.giga-hamburg.de/index.php?file=z_la_analysen.html&folder=publikationen"
"471381","International Symposium on Empirical Software Engineering and Measurement","08-Jun-2023 11:39:34","International Symposium on Empirical Software Engineering and Measurement","1","1949-3770","1949-3789","","IKT","Realfag og teknologi","","1","1","1","1","1","1","1","1","1","1","1","1","1","1","1","1","1","","","","","2007","","","IEEE Geoscience and Remote Sensing Society","USA","","0","http://www.esem-conferences.org/"
"471382","The Icfai Journal of Derivatives Markets","15-Aug-2023 13:31:38","The Icfai Journal of Derivatives Markets","1","0972-9119","","","Økonomisk-administrative fag","Samfunnsvitenskap","0","1","1","1","1","1","1","1","1","1","1","1","1","1","1","1","1","1","","","","20072","","","Icfai University Press","","India","","0","http://www.icfaipress.org"
"471383","International Journal of Contemporary Mathematical Sciences","08-Jun-2023 11:40:28","International Journal of Contemporary Mathematical Sciences","1","1312-7586","1314-7544","","Matematikk","Realfag og teknologi","","0","0","0","0","0","0","0","0","0","0","0","1","1","1","1","1","1","","","","","","","","Hikari Ltd.","Bulgaria","","0","http://www.m-hikari.com/ijcms.html"
"471384","Roman 20-50. Revue d'étude du roman du XXe siècle","15-Aug-2023 13:31:38","Roman 20-50. Revue d'étude du roman du XXe siècle","1","0295-5024","2492-0614","","Litteraturvitenskap","Humaniora","0","1","1","1","1","1","1","1","1","1","1","1","1","1","1","1","1","1","","","","18387","1986","","Presses Universitaires du Septentrion","","Frankrike","Fransk","0","http://www.septentrion.com/fr/revues/roman20-50/"
"471385","Conference record of IEEE International Symposium on Electrical Insulation","06-Jun-2023 12:22:29","Conference record of IEEE International Symposium on Electrical Insulation","1","1089-084X","","","Elektrofag","Realfag og teknologi","","1","1","1","1","1","1","1","1","1","1","1","1","1","1","1","1","1","","","","","","","","IEEE Geoscience and Remote Sensing Society","USA","","0","http://ieeexplore.ieee.org/xpls/abs_all.jsp?arnumber=1380363"
"471386","AILA Applied Linguistics Series","15-Aug-2023 13:31:38","AILA Applied Linguistics Series","1","1875-1113","","","Lingvistikk","Humaniora","0","1","1","1","1","1","1","1","1","1","1","1","1","2","2","2","2","2","","","","18269","","","John Benjamins Publishing Company","","Nederland","","0","http://www.benjamins.com/cgi-bin/t_seriesview.cgi?series=AALS"
"471387","Advances in Consciousness Research","08-Jun-2023 11:42:57","Advances in Consciousness Research","1","1381-589X","","","Psykologi","Medisin og helsefag","","1","1","1","1","1","1","1","1","1","1","1","1","1","2","2","2","2","","","","18269","","","John Benjamins Publishing Company","","Nederland","","0","http://www.benjamins.com/cgi-bin/t_seriesview.cgi?series=AiCR"
"471388","American Translators Association Scholarly Monograph Series","15-Aug-2023 13:31:38","American Translators Association Scholarly Monograph Series","1","0890-4111","","","Engelsk","Humaniora","0","1","1","1","1","1","1","1","1","1","1","1","1","1","1","1","2","2","","","","18269","","","John Benjamins Publishing Company","","Nederland","","0","http://www.benjamins.com/cgi-bin/t_seriesview.cgi?series=ATA"
"471389","Benjamins Current Topics","15-Aug-2023 13:31:38","Benjamins Current Topics","1","1874-0081","","","Lingvistikk","Humaniora","0","1","1","1","1","1","1","1","1","1","1","1","1","2","2","2","2","2","","","","18269","","","John Benjamins Publishing Company","","Nederland","","0","http://www.benjamins.com/cgi-bin/t_seriesview.cgi?series=BCT"
"471390","Cognitive Linguistics in Practice","15-Aug-2023 13:31:38","Cognitive Linguistics in Practice","1","1388-6231","","","Lingvistikk","Humaniora","0","1","1","1","1","1","1","1","1","1","1","1","1","1","1","1","2","2","","","","18269","","","John Benjamins Publishing Company","","Nederland","","0","http://www.benjamins.com/cgi-bin/t_seriesview.cgi?series=CLiP"
"471391","Comparative History of Literatures in European Languages","08-Jun-2023 11:42:57","Comparative History of Literatures in European Languages","1","0238-0668","","","Litteraturvitenskap","Humaniora","2","2","2","2","2","2","2","2","2","2","2","2","2","2","2","2","2","2","","","","18269","1973","","John Benjamins Publishing Company","","Ungarn","Flerspråklig","0","http://www.benjamins.com/cgi-bin/t_seriesview.cgi?series=CHLEL"
"471392","Constructional Approaches to Language","18-Aug-2023 13:56:25","Constructional Approaches to Language","1","1573-594X","","","Lingvistikk","Humaniora","","1","1","1","1","1","1","1","1","1","1","1","1","2","2","2","2","2","","","","18269","","","John Benjamins Publishing Company","","Nederland","","0","http://www.benjamins.com/cgi-bin/t_seriesview.cgi?series=CAL"
"471394","Controversies","08-Jun-2023 11:42:57","Controversies","1","1574-1583","","","Filosofi","Humaniora","","1","1","1","1","2","2","2","2","2","2","2","2","2","2","2","2","2","","","","18269","","","John Benjamins Publishing Company","","Nederland","","0","http://www.benjamins.com/cgi-bin/t_seriesview.cgi?series=CVS"
"471395","Converging Evidence in Language and Communication Research","08-Jun-2023 11:42:57","Converging Evidence in Language and Communication Research","1","1566-7774","","","Lingvistikk","Humaniora","","1","1","1","1","1","1","1","1","1","1","1","1","1","1","1","2","2","","","","18269","","","John Benjamins Publishing Company","","Nederland","","0","http://www.benjamins.com/cgi-bin/t_seriesview.cgi?series=CELCR"
"471396","Creole Language Library","15-Aug-2023 13:31:38","Creole Language Library","1","0920-9026","","","Lingvistikk","Humaniora","0","1","1","1","1","1","1","1","1","1","1","1","1","1","1","1","2","2","","","","18269","","","John Benjamins Publishing Company","","Nederland","","0","http://www.benjamins.com/cgi-bin/t_seriesview.cgi?series=CLL"
"471397","Dialogue Studies","18-Aug-2023 13:56:25","Dialogue Studies","1","1875-1792","","","Lingvistikk","Humaniora","","1","1","1","1","1","1","1","1","1","1","1","1","1","1","1","2","2","","","","18269","","","John Benjamins Publishing Company","","Nederland","","0","http://www.benjamins.com/cgi-bin/t_seriesview.cgi?series=DS"
"471398","Discourse Approaches to Politics, Society and Culture","18-Aug-2023 13:56:25","Discourse Approaches to Politics, Society and Culture","1","1569-9463","","","Lingvistikk","Humaniora","","1","1","1","1","1","1","1","1","1","1","1","1","2","2","2","2","2","","","","18269","","","John Benjamins Publishing Company","","Nederland","","0","http://www.benjamins.com/cgi-bin/t_seriesview.cgi?series=DAPSAC"
"471399","Document Design Companion Series","15-Aug-2023 13:31:38","Document Design Companion Series","1","1568-1963","","","Medier og kommunikasjon","Humaniora","0","1","1","1","1","1","1","1","1","2","2","2","2","2","2","2","2","2","","","","18269","2001","","John Benjamins Publishing Company","","Nederland","","0","http://www.benjamins.com/cgi-bin/t_seriesview.cgi?series=DDCS"
"471400","FIT Monograph Series","15-Aug-2023 13:31:38","FIT Monograph Series","1","1566-0575","","","Lingvistikk","Humaniora","0","1","1","1","1","1","1","1","1","1","1","1","1","1","1","1","2","2","","","","18269","1999","","John Benjamins Publishing Company","","Nederland","","0","http://www.benjamins.com/cgi-bin/t_seriesview.cgi?series=FIT"
"471401","Gesture Studies","15-Aug-2023 13:31:38","Gesture Studies","1","1874-6829","","","Lingvistikk","Humaniora","0","1","1","1","1","1","1","1","1","1","1","1","1","2","2","2","2","2","","","","18269","","","John Benjamins Publishing Company","","Nederland","","0","http://www.benjamins.com/cgi-bin/t_seriesview.cgi?series=GS"
"471402","Hamburg Studies on Multilingualism","15-Aug-2023 13:31:38","Hamburg Studies on Multilingualism","1","1571-4934","","","Lingvistikk","Humaniora","0","1","1","1","1","1","1","1","1","1","1","1","1","1","1","1","2","2","","","","18269","","","John Benjamins Publishing Company","","Nederland","","0","http://www.benjamins.com/cgi-bin/t_seriesview.cgi?series=HSM"
"471403","Human Cognitive Processing","18-Aug-2023 13:56:25","Human Cognitive Processing","1","1387-6724","","","Lingvistikk","Humaniora","0","1","1","1","1","1","1","1","1","1","1","1","1","1","1","1","2","2","","","","18269","","","John Benjamins Publishing Company","","Nederland","","0","http://www.benjamins.com/cgi-bin/t_seriesview.cgi?series=HCP"
"471404","IMPACT: Studies in Language and Society","18-Aug-2023 13:56:25","IMPACT: Studies in Language and Society","1","1385-7908","","","Lingvistikk","Humaniora","","1","1","1","1","1","1","1","1","1","2","2","2","2","2","2","2","2","","","","18269","","","John Benjamins Publishing Company","","Nederland","","0","http://www.benjamins.com/cgi-bin/t_seriesview.cgi?series=Impact"
"471405","Iconicity in Language and Literature","18-Aug-2023 13:56:25","Iconicity in Language and Literature","1","1873-5037","","","Litteraturvitenskap","Humaniora","2","2","2","2","2","2","2","2","2","2","2","2","2","2","2","2","2","2","","","","18269","","","John Benjamins Publishing Company","","Nederland","","0","http://www.benjamins.com/cgi-bin/t_seriesview.cgi?series=ILL"
"471406","Language Learning & Language Teaching","15-Aug-2023 13:31:38","Language Learning & Language Teaching","1","1569-9471","","","Lingvistikk","Humaniora","0","1","1","1","1","1","1","1","1","1","1","1","1","2","2","2","2","2","","","","18269","","","John Benjamins Publishing Company","","Nederland","","0","http://www.benjamins.com/cgi-bin/t_seriesview.cgi?series=LL%26LT"
