"490548","International Conference on Cyber Conflict, CYCON","08-Jun-2023 11:40:28","International Conference on Cyber Conflict, CYCON","1","2325-5366","2325-5374","","IKT","Realfag og teknologi","","1","1","1","1","1","1","1","1","","","","","","","","","","","","","","2000","","","","","Engelsk","1","https://ccdcoe.org/cycon/frontpage.html"
"490549","Signal Processing - Algorithms, Architectures, Arrangements, and Applications Conference Proceedings, SPA","08-Jun-2023 11:39:34","Signal Processing - Algorithms, Architectures, Arrangements, and Applications Conference Proceedings, SPA","1","2326-0262","2326-0319","","IKT","Realfag og teknologi","","1","1","1","1","1","1","1","1","","","","","","","","","","","","","18231","2000","","IEEE (Institute of Electrical and Electronics Engineers)","","","Engelsk","1","https://meetings.vtools.ieee.org/m/39401"
"490550","Journal of Media Ethics: Exploring Questions of Media Morality","18-Aug-2023 13:56:25","Journal of Media Ethics: Exploring Questions of Media Morality","1","2373-6992","2373-700X","","Medier og kommunikasjon","Humaniora","","1","1","1","1","1","1","1","1","","","","","","","","","","","","","18442","2015","","Taylor & Francis","","USA","Engelsk","0","http://www.tandfonline.com/loi/hmme21?open=32&year=2017&repitition=0"
"490551","International Conference on Wireless and Mobile Computing, Networking and Communications","06-Jun-2023 12:22:29","International Conference on Wireless and Mobile Computing, Networking and Communications","1","2161-9646","2161-9654","","IKT","Realfag og teknologi","","1","1","1","1","1","1","1","1","","","","","","","","","","","","","18231","2005","","IEEE (Institute of Electrical and Electronics Engineers)","","USA","Engelsk","1","http://www.ieee.org/conferences_events/conferences/conferencedetails/index.html?Conf_ID=38708"
"490552","Journal of Environmental Protection and Ecology","18-Aug-2023 13:56:25","Journal of Environmental Protection and Ecology","1","1311-5065","","","Tverrfaglig naturvitenskap og medisin","Realfag og teknologi","","1","1","1","1","1","1","1","1","","","","","","","","","","","","","","2000","","","Scientific Bulgarian Communications","Bulgaria","Engelsk","0","https://scibulcom.net/en/journal/1311-5065"
"490554","Journal of Causal Inference","18-Aug-2023 13:56:25","Journal of Causal Inference","1","2193-3677","2193-3685","DOAJ","Tverrfaglig samfunnsforskning","Samfunnsvitenskap","","1","1","1","1","1","1","1","","","","","","","","","","","","","","18493","2013","","Walter de Gruyter (De Gruyter)","","Tyskland","Engelsk","0","https://www.degruyter.com/journal/key/JCI/html"
"490555","Journal of Learning Analytics","18-Aug-2023 13:56:25","Journal of Learning Analytics","1","","1929-7750","","IKT","Realfag og teknologi","","1","1","1","1","1","1","1","","","","","","","","","","","","","","","","","","","Canada","Engelsk","0","http://learning-analytics.info/journals/index.php/JLA/about"
"490556","Journal of Poverty Alleviation and International Development","15-Aug-2023 13:31:38","Journal of Poverty Alleviation and International Development","1","2233-6192","","","Tverrfaglig samfunnsforskning","Samfunnsvitenskap","0","1","1","1","1","1","1","1","","","","","","","","","","","","","","","2010","","","","Sør-Korea","Engelsk","0","http://jpaid.yonsei.ac.kr/"
"490557","Les Cahiers de la recherche sur l'éducation et les savoirs","08-Jun-2023 11:39:34","Les Cahiers de la recherche sur l'éducation et les savoirs","1","1635-3544","2265-7762","DOAJ","Pedagogikk og utdanning","Samfunnsvitenskap","","1","1","1","1","1","1","1","","","","","","","","","","","","","","","2002","","","Les éditions de la Maison des sciences de l’Homme","Frankrike","Fransk","0","https://cres.revues.org/"
"490558","Zeitschrift für Religionskunde - Revue de didactique des sciences des religions","06-Jun-2023 12:22:29","Zeitschrift für Religionskunde - Revue de didactique des sciences des religions","1","2297-6469","","DOAJ","Teologi og religionsvitenskap","Humaniora","","1","1","1","1","1","1","1","","","","","","","","","","","","","","","2015","","","Gesellschaft für Religionskunde / Société pour la didactique des sciences des religions","Sveits","Flerspråklig","0","http://www.religionskunde.ch/"
"490559","Studies in Late Antiquity","18-Aug-2023 13:56:25","Studies in Late Antiquity","1","","2470-2048","","Tverrfaglig humanistisk forskning","Humaniora","","1","1","1","1","1","1","1","","","","","","","","","","","","","","18458","","","University of California Press","","USA","Engelsk","0","http://sla.ucpress.edu/"
"490560","Journal of Intelligence","18-Aug-2023 13:56:25","Journal of Intelligence","1","","2079-3200","DOAJ","Psykologi","Medisin og helsefag","","1","1","1","1","1","1","1","","","","","","","","","","","","","","26778","2013","","MDPI","","Sveits","Engelsk","0","https://www.mdpi.com/journal/jintelligence"
"490561","Nature Biomedical Engineering","18-Aug-2023 13:56:25","Nature Biomedical Engineering","1","","2157-846X","","Tverrfaglig teknologi","Realfag og teknologi","","1","1","1","1","1","1","1","","","","","","","","","","","","","","","2017","","","Nature Portfolio","Storbritannia","Engelsk","0","http://www.nature.com/natbiomedeng/"
"490562","Age, Culture, Humanities","08-Jun-2023 11:42:57","Age, Culture, Humanities","1","2375-8856","2373-5481","DOAJ","Tverrfaglig humanistisk forskning","Humaniora","","1","1","1","1","1","1","1","","","","","","","","","","","","","","","2014","","","Athenaeum Press","USA","Engelsk","0","http://ageculturehumanities.org/"
"490563","Life Course Research and Social Policies","18-Aug-2023 13:56:25","Life Course Research and Social Policies","1","2211-7776","2211-7784","","Sosiologi","Samfunnsvitenskap","","1","1","1","1","1","1","1","","","","","","","","","","","","","","22512","2013","","Springer","","Nederland","Engelsk","0","http://www.springer.com/series/10158"
"490564","Informatics","18-Aug-2023 13:56:25","Informatics","1","","2227-9709","DOAJ","IKT","Realfag og teknologi","","1","1","1","1","1","1","1","","","","","","","","","","","","","","26778","2014","","MDPI","","Sveits","Engelsk","0","http://www.mdpi.com/journal/informatics"
"490568","Taikomoji kalbotyra","18-Aug-2023 13:56:25","Applied Linguistics","1","","2029-8935","DOAJ","Lingvistikk","Humaniora","","1","1","1","","","","","","","","","","","","","","","","","","26749","2012","","Vilniaus universiteto leidykla","","Litauen","Litauisk","0","https://www.journals.vu.lt/taikomojikalbotyra"
"490580","OncoTargets and Therapy","06-Oct-2023 06:09:05","OncoTargets and Therapy","1","","1178-6930","DOAJ","Onkologi","Medisin og helsefag","","1","1","1","1","1","1","1","","","","","","","","","","","","","","","2008","","","Dove press","New Zealand","Engelsk","0","https://www.dovepress.com/oncotargets-and-therapy-journal"
"490582","Bunron - Journal of Japanese Literary Studies","06-Jun-2023 12:22:29","Bunron - Journal of Japanese Literary Studies","1","2199-2754","","DOAJ","Tverrfaglig humanistisk forskning","Humaniora","","1","1","1","1","1","1","1","","","","","","","","","","","","","","","2014","","","University of Heidelberg, Germany","Tyskland","Flerspråklig","0","http://crossasia-journals.ub.uni-heidelberg.de/index.php/bunron/about"
"490587","Konińskie studia społeczno-ekonomiczne","06-Jun-2023 12:22:29","Konin Socio-Economic Studies","1","2391-8632","","","Samfunnsøkonomi","Samfunnsvitenskap","","1","1","1","1","1","1","","","","","","","","","","","","","","","","2015","","","Konin : Państwowa Wyższa Szkoła Zawodowa","Polen","Polsk","0","http://ksse.pwsz.konin.edu.pl/?page_id=177"
"490590","Journal of Biomolecular Techniques","18-Aug-2023 13:56:25","Journal of Biomolecular Techniques","1","1524-0215","1943-4731","","Biovitenskap","Realfag og teknologi","","1","1","1","1","1","1","1","","","","","","","","","","","","","","","1998","","","Association of Biomolecular Resource Facilities.","USA","Engelsk","0","http://jbt.abrf.org/jbt-static/index.html"
"490599","Journal of Tourism, Heritage & Services Marketing","18-Aug-2023 13:56:25","Journal of Tourism, Heritage & Services Marketing","1","","2529-1947","DOAJ","Økonomisk-administrative fag","Samfunnsvitenskap","","1","1","1","1","1","1","","","","","","","","","","","","","","","","2015","","","Alexander Technological Institute of Thessaloniki","Hellas","Engelsk","0","http://www.jthsm.gr"
"490606","The journal of wealth management","18-Aug-2023 13:56:25","The journal of wealth management","1","1534-7524","","","Økonomisk-administrative fag","Samfunnsvitenskap","","1","1","1","1","1","1","1","1","1","1","1","1","1","1","1","1","1","1","","","","2000","","","Institutional Investor, Inc.","USA","Engelsk","0","http://www.iijpe.com/JPPM/default.asp"
"490607","Финансы и бизнес","06-Jun-2023 12:22:29","Finance and Business","1","1814-4802","","","Økonomisk-administrative fag","Samfunnsvitenskap","","0","0","0","0","0","0","0","","","","","","","","","","","","","","","2005","","","","Russland","Flerspråklig","0","http://finbiz.spb.ru/index.php?option=com_frontpage&Itemid=1"
"490608","CM: Communication and Media","06-Jun-2023 12:22:29","CM: Communication and Media","1","2466-541X","2466-5452","DOAJ","Medier og kommunikasjon","Humaniora","","1","1","1","1","1","1","1","","","","","","","","","","","","","","","2016","","","Novi Sad Institut za usmeravanje komunikacija Beograd Fakultet političkih nauka","Serbia","Engelsk","0","http://aseestant.ceon.rs/index.php/comman/issue/current"
"490609","IEEE Control Systems","18-Aug-2023 13:56:25","IEEE Control Systems","1","1066-033X","","","IKT","Realfag og teknologi","","1","1","1","1","1","1","1","","","","","","","","","","","","","","18231","1991","","IEEE (Institute of Electrical and Electronics Engineers)","","USA","Engelsk","1","http://ccta2017.ieeecss.org"
"490611","Artivate: A Journal of Entrepreneurship in the Arts","06-Jun-2023 12:22:29","Artivate: A Journal of Entrepreneurship in the Arts","1","","2164-7747","","Tverrfaglig samfunnsforskning","Samfunnsvitenskap","","1","1","1","1","1","1","1","","","","","","","","","","","","","","","2012","","","Pave Program in Arts Entrepreneurship, Arizona State University","USA","Engelsk","0","http://artivate.hida.asu.edu/index.php/artivate/index"
"490612","Revista da Associação Portuguesa de Linguística","15-Aug-2023 13:31:38","Revista da Associação Portuguesa de Linguística","1","","2183-9077","","Lingvistikk","Humaniora","0","1","1","1","1","1","1","1","","","","","","","","","","","","","","","2016","","","University of porto","Portugal","Portugisisk","0","http://ojs.letras.up.pt/index.php/APL/"
"490613","Conference proceedings: The Future of Education","08-Jun-2023 11:40:28","Conference proceedings: The Future of Eeducation","1","2384-9509","","","Pedagogikk og utdanning","Samfunnsvitenskap","","1","1","1","1","1","1","0","","","","","","","","","","","","","","","2011","","","Libreria Universitaria/Pixel/Filodiritto Editore","Italia","Engelsk","1","http://conference.pixel-online.net/FOE/index.php"
"490616","Journal of Rehabilitation and Assistive Technologies Engineering","06-Jun-2023 12:22:29","Journal of Rehabilitation and Assistive Technologies Engineering","1","","2055-6683","","Rehabilitering, fysioterapi, ergoterapi og ortopediingeniørfag","Medisin og helsefag","","1","1","1","1","1","1","1","","","","","","","","","","","","","","18411","2014","","Sage Publications","","Storbritannia","Engelsk","0","http://journals.sagepub.com/home/jrt"
"490617","Proceedings of the [xx]th Conference of Open Innovations Association FRUCT","08-Jun-2023 11:39:34","Proceedings of the [xx]th Conference of Open Innovations Association FRUCT","1","2305-7254","2343-0737","DOAJ","IKT","Realfag og teknologi","","1","1","1","1","1","1","1","","","","","","","","","","","","","","","","","","FRUCT Oy","","Engelsk","1","http://fruct.org/publication"
"490618","Biomedical Engineering & Physics Express","18-Aug-2023 13:56:25","Biomedical Engineering & Physics Express","1","","2057-1976","","Tverrfaglig naturvitenskap og medisin","Realfag og teknologi","","1","1","1","1","1","1","1","","","","","","","","","","","","","","18245","2015","","IOP Publishing","","Storbritannia","Engelsk","0","http://iopscience.iop.org/journal/2057-1976"
"490621","IS&T International Symposium on Electronic Imaging Science and Technology","08-Jun-2023 11:39:34","IS&T International Symposium on Electronic Imaging Science and Technology","1","","2470-1173","","Tverrfaglig teknologi","Realfag og teknologi","","1","1","1","1","1","1","1","","","","","","","","","","","","","","","2016","","","Society for Imaging Science and Technology","Internasjonal","Engelsk","1","https://www.ingentaconnect.com/content/ist/ei;jsessionid=aagf6gtilb79q.x-ic-live-03"
"490622","Complementary Medicine Research","18-Aug-2023 13:56:25","Complementary Medicine Research","1","2504-2092","2504-2106","","Generell medisin","Medisin og helsefag","","1","1","1","1","1","1","1","","","","","","","","","","","","","","18410","2017","","S. Karger","","Sveits","Engelsk","0","https://www.karger.com/CMR"
