"468949","Annales des Sciences Mathématiques du Québec","04-Jun-2019 17:17:20","Annales des Sciences Mathématiques du Québec","0","0707-9109","","","Matematikk","Realfag og teknologi","","","","","","","","","","","","","1","1","1","1","1","1","1","1","","","1977","2012","","Groupe des Chercheurs en Sciences Mathématiques","Canada","","0","http://www.labmath.uqam.ca/~annales/"
"468950","Journal of Inverse and Ill-Posed Problems","18-Aug-2023 13:56:25","Journal of Inverse and Ill-Posed Problems","1","0928-0219","1569-3945","","Matematikk","Realfag og teknologi","","1","1","1","1","1","1","1","1","1","1","1","1","1","1","1","1","1","1","1","","","1993","","","","Nederland","","0","http://www.vsppub.com/journals/jn-JouInvIllPosPro.html"
"468951","African Journal of AIDS Research","18-Aug-2023 13:56:25","African Journal of AIDS Research","1","1608-5906","1727-9445","","Biomedisin","Medisin og helsefag","","1","1","1","1","1","1","1","1","1","1","1","1","1","1","1","1","1","1","1","","19132","2002","","NISC - National Inquiry Services Centre","","Sør-Afrika","Afrikaans","0","http://www.ajol.info/journal_index.php?ab=ajar&jid=46"
"468952","Mitteilungen der Deutschen Mathematiker-Vereinigung (DMV)","06-Jun-2023 12:17:35","Mitteilungen der Deutschen Mathematiker-Vereinigung (DMV)","1","0947-4471","","","Matematikk","Realfag og teknologi","","1","1","1","1","1","1","1","1","1","1","1","1","1","1","1","1","1","1","1","","19224","1993","","Deutsche Mathematiker-Vereinigung","","Tyskland","","0","http://www.math.tu-berlin.de/~mdmv/"
"468953","Chinese Annals of Mathematics. Series A","06-Jun-2023 12:22:29","Chinese Annals of Mathematics. Series A","1","1000-8314","","","Matematikk","Realfag og teknologi","","1","1","1","1","1","1","1","1","1","1","1","1","1","1","1","1","1","1","1","","19109","1983","","Fudan University Press","","Kina","","0","http://camath.fudan.edu.cn/camacn/ch/index.aspx"
"468954","Modern Logic","15-Apr-2020 14:53:19","Modern Logic","0","1047-5982","1943-7390","","Matematikk","Realfag og teknologi","","","","","","1","1","1","1","1","1","1","1","1","1","1","1","1","1","1","","","1990","2001","","Modern Logic Pub (Online), Department of Mathematics Statistics and Computer Science Marquette University","USA","Engelsk","0","http://projecteuclid.org/DPubS?service=UI&version=1.0&verb=Display&handle=euclid.rml"
"468955","Georgian Mathematical Journal","18-Aug-2023 13:56:25","Georgian Mathematical Journal","1","1072-947X","1572-9176","","Matematikk","Realfag og teknologi","","1","1","1","1","1","1","1","1","1","1","1","1","1","1","1","1","1","1","1","","","1994","","","Heldermann Verlag","Tyskland","","0","http://www.emis.de/journals/GMJ/"
"468956","Representation Theory: An Electronic Journal of the AMS","18-Aug-2023 13:56:25","Representation Theory: An Electronic Journal of the AMS","1","","1088-4165","","Matematikk","Realfag og teknologi","","1","1","1","1","1","1","1","1","1","1","1","1","1","1","1","1","1","1","1","","","1997","","","","USA","","0","http://www.ams.org/ert/"
"468957","Conformal Geometry and Dynamics","18-Aug-2023 13:56:25","Conformal Geometry and Dynamics","1","","1088-4173","","Matematikk","Realfag og teknologi","","1","1","1","1","1","1","1","1","1","1","1","1","1","1","1","1","1","1","1","","","1997","","","","USA","","0","http://www.ams.org/journals/ecgd/"
"468958","Foro Internacional","08-Jun-2023 11:42:57","Foro Internacional","1","0185-013X","","DOAJ","Statsvitenskap","Samfunnsvitenskap","","1","1","1","1","1","1","1","1","1","1","1","1","1","1","1","1","1","1","1","","19134","2000","","El colegio de México","","Mexico","","0","http://dialnet.unirioja.es/servlet/revista?codigo=6696"
"468959","Journal of Information, Information Technology, and Organizations","08-Jun-2023 11:39:34","Journal of Information, Information Technology, and Organizations","1","1557-1319","1557-1327","","Biblioteks- og informasjonsvitenskap","Samfunnsvitenskap","","0","0","0","0","1","1","1","1","1","1","1","1","1","1","1","1","1","1","1","","19135","2006","","Informing Science Institute","","USA","Engelsk","0","https://www.informingscience.org/Journals/JIITO/Articles"
"468960","Rendiconti di Matematica e delle sue Applicazioni. Serie VII","18-Aug-2023 13:56:25","Rendiconti di Matematica e delle sue Applicazioni. Serie VII","1","1120-7183","","DOAJ","Matematikk","Realfag og teknologi","","1","1","1","1","1","1","1","1","1","1","1","1","1","1","1","1","1","1","1","","","1981","","","","Italia","","0","http://library.epfl.ch/en/periodicals/?recId=12825020"
"468961","International Journal of Doctoral Studies (IJDS)","18-Aug-2023 13:56:25","International Journal of Doctoral Studies (IJDS)","1","1556-8881","1556-8873","","Pedagogikk og utdanning","Samfunnsvitenskap","","0","0","0","0","1","1","1","1","1","1","1","1","1","1","1","1","1","1","1","","19135","2006","","Informing Science Institute","","USA","Engelsk","0","http://ijds.org/"
"468962","Journal de Théorie des Nombres de Bordeaux","18-Aug-2023 13:56:25","Journal de Théorie des Nombres de Bordeaux","1","1246-7405","2118-8572","","Matematikk","Realfag og teknologi","","1","1","1","1","1","1","1","1","1","1","1","1","1","1","1","1","1","1","1","","18384","1993","","Presses Universitaires de Bordeaux","","Frankrike","","0","http://almira.math.u-bordeaux.fr/jtnb/jtnb_english.html"
"468963","Interdisciplinary Journal of Information, Knowledge, and Management (IJIKM)","18-Aug-2023 13:56:25","Interdisciplinary Journal of Information, Knowledge, and Management (IJIKM)","1","1555-1229","1555-1237","","Biblioteks- og informasjonsvitenskap","Samfunnsvitenskap","","0","0","0","0","1","1","1","1","1","1","1","1","1","1","1","1","1","1","1","","19135","2006","","Informing Science Institute","","USA","Engelsk","0","http://ijikm.org/"
"468964","Mathematical Proceedings of the Royal Irish Academy","08-Jun-2023 11:42:57","Mathematical Proceedings of the Royal Irish Academy","1","1393-7197","2009-0021","","Matematikk","Realfag og teknologi","","1","1","1","1","1","1","1","1","1","1","1","1","1","1","1","1","1","1","1","","","1998","","","","Irland","","1","http://www.ria.ie/publications/journals/procai/index.html"
"468965","Milan Journal of Mathematics","18-Aug-2023 13:56:25","Milan Journal of Mathematics","1","1424-9286","1424-9294","","Matematikk","Realfag og teknologi","","1","1","1","1","1","1","1","1","1","1","1","1","1","1","1","1","1","1","1","","18096","2002","","Birkhäuser Verlag","","","","0","http://www.springer.com/birkhauser/mathematics/journal/32?changeHeader"
"468966","Algebraic and Geometric Topology","18-Aug-2023 13:56:25","Algebraic and Geometric Topology","1","1472-2747","1472-2739","","Matematikk","Realfag og teknologi","","1","1","1","1","1","1","1","1","1","1","1","1","1","1","1","1","1","1","1","","","2001","","","University of Warwick","Storbritannia","","0","http://www.maths.warwick.ac.uk/agt/"
"468967","Communications in Mathematical Sciences","18-Aug-2023 13:56:25","Communications in Mathematical Sciences","1","1539-6746","1945-0796","","Matematikk","Realfag og teknologi","","1","1","1","1","1","1","1","1","1","1","1","1","1","1","1","1","1","1","1","","","2002","","","","USA","","0","http://www.intlpress.com/CMS/"
"468968","Graeco-Arabica","15-Aug-2023 13:31:38","Graeco-Arabica","1","1108-4103","","","Asia- Midtøsten- og Nord-Afrikastudier","Humaniora","0","1","1","1","1","1","1","1","1","1","1","1","1","1","1","1","1","1","1","1","","19137","1982","","Institute for Graeco-Oriental and African Studies","","Hellas","","0","http://www.igoas.org/"
"468969","Quaestiones Mathematicae. Journal of the South African Mathematical Society","18-Aug-2023 13:56:25","Quaestiones Mathematicae. Journal of the South African Mathematical Society","1","1607-3606","1727-933X","","Matematikk","Realfag og teknologi","","1","1","1","1","1","1","1","1","1","1","1","1","1","1","1","1","1","1","1","","","1976","","","","Sør-Afrika","Afrikaans","0","http://www.nisc.co.za/journals?id=7&PHPSESSID=16b7d8a752e612b3088c42f28b61f683"
"468970","Moscow Mathematical Journal","18-Aug-2023 13:56:25","Moscow Mathematical Journal","1","1609-3321","1609-4514","","Matematikk","Realfag og teknologi","","1","1","1","1","1","1","1","1","1","1","1","1","1","1","1","1","1","1","1","","","2001","","","","Russland","","0","http://www.ams.org/distribution/mmj/"
"468971","Journal of Qur'anic Studies","18-Aug-2023 13:56:25","Journal of Qur'anic Studies","1","1465-3591","1755-1730","","Teologi og religionsvitenskap","Humaniora","","1","1","1","1","1","1","1","1","1","1","1","1","1","1","1","1","1","1","1","","18159","1999","","Edinburgh University Press","","Storbritannia","Engelsk","0","http://www.euppublishing.com/journal/jqs"
"468972","International Conference on Parallel Processing (ICPP)","08-Jun-2023 11:39:34","International Conference on Parallel Processing (ICPP)","1","0190-3918","2332-5690","","IKT","Realfag og teknologi","","1","1","1","1","1","1","1","1","1","1","1","1","1","1","1","1","1","1","1","","18231","1976","","IEEE (Institute of Electrical and Electronics Engineers)","","USA","Engelsk","1","https://ieeexplore.ieee.org/xpl/conhome/1000540/all-proceedings"
"468973","Bulletin de la Société Archéologique et Historique du Limousin","06-Jun-2023 12:22:29","Bulletin de la Société Archéologique et Historique du Limousin","1","0184-7651","","","Ikke tildelt","Ikke tildelt","","0","0","0","0","0","0","0","0","0","0","0","0","0","0","0","0","","","0","","","","","","","Frankrike","","0","http://www.premiumwanadoo.com/sahl/"
"468974","Medelhavsmuseet. Focus on the Mediterranean","01-Jul-2017 14:05:22","Medelhavsmuseet. Focus on the Mediterranean","0","1652-4535","","","Ikke tildelt","Ikke tildelt","","","","","","","","","0","0","0","0","0","0","0","0","0","","","0","","19141","2004","2010","Medelhavsmuseet","","Sverige","Engelsk","0","http://www.varldskulturmuseerna.se/medelhavsmuseet/"
"468975","Special Publication - Royal Numismatic Society","15-Aug-2023 13:31:38","Special Publication - Royal Numismatic Society","1","0080-4487","","","Historie og Idéhistorie","Humaniora","0","1","1","1","1","1","1","1","1","1","1","1","1","1","1","1","1","1","1","1","","","1956","","","Royal Numismatic Society","Storbritannia","Engelsk","0","https://numismatics.org.uk/society-publications-2/special-publications-and-coin-hoards/"
"468976","The Journal of Symplectic Geometry","18-Aug-2023 13:56:25","The Journal of Symplectic Geometry","1","1527-5256","1540-2347","","Matematikk","Realfag og teknologi","","1","1","1","1","1","1","1","1","1","1","1","1","1","1","1","1","1","1","1","","","2001","","","","USA","","0","http://www.intlpress.com/JSG/"
"468977","Questiones Mathematicae","06-Jun-2023 12:22:29","Questiones Mathematicae","1","0379-9468","","","Matematikk","Realfag og teknologi","","1","1","1","1","1","1","1","1","1","1","1","1","1","1","1","1","1","1","1","","","1976","","","","Sør-Afrika","Afrikaans","0","http://www.nisc.co.za/journals?id=7"
"468978","Numismatica e antichità classiche","06-Jun-2023 12:22:29","Numismatica e antichità classiche","1","1420-1739","","","Ikke tildelt","Ikke tildelt","","0","0","0","0","0","0","0","0","0","0","0","0","0","0","0","0","","","0","","","1972","","","","Sveits","Italiensk","0","http://www.quaderniticinesi.com"
"468979","Annales Mathematicae et Informaticae","08-Feb-2016 14:36:49","Annales Mathematicae et Informaticae","0","1216-6014","","","IKT","Realfag og teknologi","","","","","","","","","","","","","","","","","","","","1","","","1991","1999","","","Ungarn","","0","http://www.ektf.hu/tanszek/matematika/ami/"
"468980","Functional Differential Equations","18-Aug-2023 13:56:25","Functional Differential Equations","1","0793-1786","","","Matematikk","Realfag og teknologi","","1","1","1","1","1","1","1","1","1","1","1","1","1","1","1","1","1","1","1","","","","","","Research Institute, College of Judea & Samaria","Israel","","0","http://www.hait.ac.il/staff/BenzionS/FDE.html"
"468981","Izvestiia vysshikh uchebnykh zavedenii. Matematika (Izvestija Vuzov. Mathematics)","13-Jun-2023 09:31:40","Izvestiia vysshikh uchebnykh zavedenii. Matematika (Izvestija Vuzov. Mathematics)","1","0021-3446","2076-4626","","Ikke tildelt","Ikke tildelt","","0","0","0","0","0","0","0","0","0","0","0","0","0","0","0","0","","","0","","","","","","","Russland","","0","https://energy.bntu.by/jour"
"468982","Communications on Applied Nonlinear Analysis","18-Aug-2023 13:56:25","Communications on Applied Nonlinear Analysis","1","1074-133X","","","Matematikk","Realfag og teknologi","","1","1","1","1","1","1","1","1","1","1","1","1","1","1","1","1","1","1","1","","","1994","","","","USA","","0","http://www.internationalpubls.com/communications.htm"
"468983","Communications in Applied Analysis","08-Jun-2023 11:40:28","Communications in Applied Analysis","1","1083-2564","","","Matematikk","Realfag og teknologi","","0","0","0","0","0","1","1","1","1","1","1","1","1","1","1","1","1","1","1","","","1997","","","Academic Solutions Ltd. and Dynamic Publishers, Inc","USA","","0","http://www.acadsol.eu/caa/home"
