"500086","Endocrinology, Diabetes and Metabolism Case Reports","18-Aug-2023 13:56:25","Endocrinology, Diabetes and Metabolism Case Reports","1","","2052-0573","DOAJ","Endokrinologi","Medisin og helsefag","","1","1","1","1","","","","","","","","","","","","","","","","","18095","2013","","Bioscientifica","","Storbritannia","Engelsk","0","https://edm.bioscientifica.com/"
"500090","Forensic Science International: Reports","18-Aug-2023 13:56:25","Forensic Science International: Reports","1","","2665-9107","DOAJ","Rettsvitenskap","Samfunnsvitenskap","","1","1","1","1","","","","","","","","","","","","","","","","","18173","2019","","Elsevier","","Nederland","Engelsk","0","https://www.sciencedirect.com/journal/forensic-science-international-reports"
"500091","Frontiers of Medicine","18-Aug-2023 13:56:25","Frontiers of Medicine","1","2095-0217","2095-0225","","Generell medisin","Medisin og helsefag","","1","1","1","1","","","","","","","","","","","","","","","","","22512","2011","","Springer","","Kina","Engelsk","0","https://www.springer.com/journal/11684"
"500092","International Journal of Mechatronics and Manufacturing Systems (IJMMS)","18-Aug-2023 13:56:25","International Journal of Mechatronics and Manufacturing Systems (IJMMS)","1","1753-1039","1753-1047","","Konstruksjonsfag","Realfag og teknologi","","1","1","1","1","","","","","","","","","","","","","","","","","17842","2008","","InderScience Publishers","","Storbritannia","Engelsk","0","https://www.inderscience.com/jhome.php?jcode=ijmms"
"500093","International Journal of Pediatrics and Adolescent Medicine","18-Aug-2023 13:56:25","International Journal of Pediatrics and Adolescent Medicine","1","","2352-6467","DOAJ","Pediatri","Medisin og helsefag","","1","1","1","1","","","","","","","","","","","","","","","","","18173","2014","","Elsevier","King Faisal Specialist Hospital and Research Centre","Nederland","Engelsk","0","https://www.sciencedirect.com/journal/international-journal-of-pediatrics-and-adolescent-medicine"
"500094","International Journal of Population Data Science (IJPDS)","18-Aug-2023 13:56:25","International Journal of Population Data Science (IJPDS)","1","","2399-4908","DOAJ","Sosiologi","Samfunnsvitenskap","","1","1","1","1","","","","","","","","","","","","","","","","","","2017","","","Swansea University","Storbritannia","Engelsk","0","https://ijpds.org/"
"500095","International Real Estate Review (IRER)","18-Aug-2023 13:56:25","International Real Estate Review (IRER)","1","2154-8919","","","Samfunnsøkonomi","Samfunnsvitenskap","","1","1","1","1","","","","","","","","","","","","","","","","","","1998","","","Asian Real Estate Society","USA","Engelsk","0","https://www.um.edu.mo/fba/irer/index.htm"
"500097","Iraqi Geological Journal","18-Aug-2023 13:56:25","Iraqi Geological Journal","1","2414-6064","2663-8754","DOAJ","Geovitenskap","Realfag og teknologi","","1","1","1","1","","","","","","","","","","","","","","","","","","2015","","","Iraqi Geologists Association","Irak","Engelsk","0","http://igj-iraq.org/"
"500098","IEEE Open Access Journal of Power and Energy","18-Aug-2023 13:56:25","IEEE Open Access Journal of Power and Energy","1","","2687-7910","DOAJ","Konstruksjonsfag","Realfag og teknologi","","1","1","1","1","","","","","","","","","","","","","","","","","18231","2020","","IEEE (Institute of Electrical and Electronics Engineers)","","USA","Engelsk","0","https://ieeexplore.ieee.org/xpl/RecentIssue.jsp?punumber=8784343"
"500099","Italian Journal of Vascular and Endovascular Surgery","18-Aug-2023 13:56:25","Italian Journal of Vascular and Endovascular Surgery","1","1824-4777","1827-1847","","Kirurgiske fag","Medisin og helsefag","","1","1","1","1","","","","","","","","","","","","","","","","","","2004","","","Edizioni Minerva Medica","Italia","Engelsk","0","https://www.minervamedica.it/en/journals/vascular-endovascular-surgery/"
"500101","JCO Global Oncology","18-Aug-2023 13:56:25","JCO Global Oncology","1","","2687-8941","DOAJ","Onkologi","Medisin og helsefag","","1","1","1","1","","","","","","","","","","","","","","","","","","2020","","","American Society of Clinical Oncology","USA","Engelsk","0","https://ascopubs.org/journal/go"
"500104","Journal of Arid Land","18-Aug-2023 13:56:25","Journal of Arid Land","1","1674-6767","2194-7783","","Geovitenskap","Realfag og teknologi","","1","1","1","1","","","","","","","","","","","","","","","","","22512","2009","","Springer","Co-sponsored by Xinjiang Institute of Ecology and Geography, the Chinese Academy of Sciences and Science Press","Kina, Tyskland","Engelsk","0","https://www.springer.com/journal/40333"
"500105","Journal of Discrete Mathematical Sciences and Cryptography (JDMSC)","29-Aug-2023 05:39:51","Journal of Discrete Mathematical Sciences and Cryptography (JDMSC)","1","0972-0529","2169-0065","","Matematikk","Realfag og teknologi","","1","1","1","1","","","","","","","","","","","","","","","","","19256","1998","","Taru Publications","","India","Engelsk","0","https://www.tarupublications.com/journal/JDMSC"
"500108","Journal of Evidence-Based Social Work","18-Aug-2023 13:56:25","Journal of Evidence-Based Social Work","1","2640-8066","2640-8074","","Tverrfaglig samfunnsforskning","Samfunnsvitenskap","","1","1","1","1","1","","","","","","","","","","","","","","","","18442","2019","","Taylor & Francis","","USA","Engelsk","0","https://www.tandfonline.com/toc/webs22/current"
"500109","Journal of Insect Biodiversity (JIB)","18-Aug-2023 13:56:25","Journal of Insect Biodiversity (JIB)","1","2538-1318","2147-7612","","Biovitenskap","Realfag og teknologi","","1","1","1","1","","","","","","","","","","","","","","","","","19676","2013","","Magnolia Press","","New Zealand, Tyrkia","Engelsk","0","https://mapress.com/j/jib/"
"500112","Journal of Medical and Biological Engineering (JMBE)","18-Aug-2023 13:56:25","Journal of Medical and Biological Engineering (JMBE)","1","1609-0985","2199-4757","","Biovitenskap","Realfag og teknologi","","1","1","1","1","","","","","","","","","","","","","","","","","22512","2000","","Springer","","Sveits, Tyskland","Engelsk","0","https://www.springer.com/journal/40846"
"500116","Journal of Medical Ultrasound","18-Aug-2023 13:56:25","Journal of Medical Ultrasound","1","0929-6441","2212-1552","DOAJ","Radiologi og billeddiagnostikk","Medisin og helsefag","","1","1","1","1","","","","","","","","","","","","","","","","","15103","1993","","Wolters Kluwer","","Hongkong, Nederland","Engelsk","0","https://www.jmuonline.org/"
"500118","Journal of Occupational Therapy, Schools, and Early Intervention","18-Aug-2023 13:56:25","Journal of Occupational Therapy, Schools, and Early Intervention","1","1941-1243","1941-1251","","Tverrfaglig samfunnsforskning","Samfunnsvitenskap","","1","1","1","1","","","","","","","","","","","","","","","","","18442","2008","","Taylor & Francis","","USA","Engelsk","0","https://www.tandfonline.com/toc/wjot20/current"
"500119","Journal of Pharmacy and Bioallied Sciences","18-Aug-2023 13:56:25","Journal of Pharmacy and Bioallied Sciences","1","0976-4879","0975-7406","DOAJ","Farmasi, farmakologi og toksikologi","Medisin og helsefag","","1","1","1","1","","","","","","","","","","","","","","","","","15103","2009","","Wolters Kluwer","","India","Engelsk","0","https://www.jpbsonline.org/"
"500120","Journal of Structural Integrity and Maintenance","18-Aug-2023 13:56:25","Journal of Structural Integrity and Maintenance","1","2470-5314","2470-5322","","Konstruksjonsfag","Realfag og teknologi","","1","1","1","1","","","","","","","","","","","","","","","","","18442","2016","","Taylor & Francis","","Storbritannia","Engelsk","0","https://www.tandfonline.com/toc/tstr20/current"
"500121","Fīzīk-i zamīn va faz̤ā","18-Aug-2023 13:56:25","Journal of the Earth and Space Physics (JESP)","1","2538-371X","2538-3906","","Geovitenskap","Realfag og teknologi","","0","0","0","0","","","","","","","","","","","","","","","","","","2005","","","Dānishgāh-i Tihrān mu̓assisah-i zhi̓ufīzīk","Iran","Flerspråklig","0","http://nsd.no/"
"500122","Journal of the Korean Academy of Child and Adolescent Psychiatry (JKACAP)","18-Aug-2023 13:56:25","Journal of the Korean Academy of Child and Adolescent Psychiatry (JKACAP)","1","1225-729X","","","Psykiatri","Medisin og helsefag","","1","1","1","1","","","","","","","","","","","","","","","","","","1990","","","Korean Academy of Child and Adolescent Psychiatry","Sør-Korea","Engelsk","0","https://www.jkacap.org/main.html"
"500123","Journal of Transnational Management","18-Aug-2023 13:56:25","Journal of Transnational Management","1","1547-5778","1547-5786","","Økonomisk-administrative fag","Samfunnsvitenskap","","1","1","1","1","1","1","1","1","1","1","1","1","1","1","1","1","1","1","1","","18442","2004","","Taylor & Francis","","USA","Engelsk","0","https://www.tandfonline.com/toc/wtnm20/current"
"500124","Journal of Transportation Safety and Security (JTSS)","18-Aug-2023 13:56:25","Journal of Transportation Safety and Security (JTSS)","1","1943-9962","1943-9970","","Geografi","Samfunnsvitenskap","","1","1","1","1","","","","","","","","","","","","","","","","","18442","2009","","Taylor & Francis","","USA","Engelsk","0","https://www.tandfonline.com/toc/utss20/current"
"500125","Keikinzoku Yosetsu","18-Aug-2023 13:56:25","Journal of Light Metal Welding","1","0368-5306","2186-618X","","Kjemi og materialteknologi","Realfag og teknologi","","0","0","0","0","","","","","","","","","","","","","","","","","","1963","","","Keikinzoku yosetsu kyokai","Japan","Flerspråklig","0","https://www.jstage.jst.go.jp/browse/jlwa"
"500126","Magazine of Civil Engineering","18-Aug-2023 13:56:25","Magazine of Civil Engineering","1","","2712-8172","DOAJ","Konstruksjonsfag","Realfag og teknologi","","1","1","1","1","","","","","","","","","","","","","","","","","","2017","","","Peter the Great St. Petersburg Polytechnic University","Russland","Engelsk","0","https://engstroy.spbstu.ru/en/"
"500127","Marine Biological Journal","18-Aug-2023 13:56:25","Marine Biological Journal","1","2499-9768","2499-9776","DOAJ","Biovitenskap","Realfag og teknologi","","1","1","1","1","","","","","","","","","","","","","","","","","","2016","","","A. O. Kovalevsky Institute of Biology of the Southern Seas of RAS","Russland","Flerspråklig","0","https://mbj.marine-research.org/index"
"500128","Wiley Interdisciplinary Reviews: Data Mining and Knowledge Discovery (WIREs)","18-Aug-2023 13:56:25","Wiley Interdisciplinary Reviews: Data Mining and Knowledge Discovery (WIREs)","1","1942-4787","1942-4795","","IKT","Realfag og teknologi","","1","1","1","1","","","","","","","","","","","","","","","","","18270","2010","","John Wiley & Sons","","USA","Engelsk","0","https://onlinelibrary.wiley.com/journal/19424795"
"500131","Medical Science Educator","18-Aug-2023 13:56:25","Medical Science Educator","1","","2156-8650","","Generell medisin","Medisin og helsefag","","1","1","1","1","","","","","","","","","","","","","","","","","22512","2011","","Springer","International Association of Medical Science Educators (IAMSE)","USA","Engelsk","0","https://www.springer.com/journal/40670"
"500132","Medicina Fluminensis","18-Aug-2023 13:56:25","Medicina Fluminensis","1","1847-6864","1848-820X","","Generell medisin","Medisin og helsefag","","1","1","1","1","1","1","1","1","1","1","1","1","1","","","","","","","","","2008","","","Hrvatski liječnički zbor Podružnica","Kroatia","Kroatisk","0","https://hrcak.srce.hr/medicina?lang=en"
"500134","Neurobiology of Stress","18-Aug-2023 13:56:25","Neurobiology of Stress","1","","2352-2895","DOAJ","Nevrologi","Medisin og helsefag","","1","1","1","1","","","","","","","","","","","","","","","","","18173","2015","","Elsevier","","Nederland","Engelsk","0","https://www.sciencedirect.com/journal/neurobiology-of-stress"
"500135","Neurophotonics","18-Aug-2023 13:56:25","Neurophotonics","1","2329-423X","2329-4248","DOAJ","Nevrologi","Medisin og helsefag","","1","1","1","1","","","","","","","","","","","","","","","","","18426","2014","","SPIE - The International Society for Optics and Photonics","","USA","Engelsk","0","https://www.spiedigitallibrary.org/journals/neurophotonics?SSO=1"
"500136","Obstetrics and Gynecology Science","18-Aug-2023 13:56:25","Obstetrics and Gynecology Science","1","2287-8572","2287-8580","DOAJ","Fødselshjelp og kvinnesykdommer","Medisin og helsefag","","1","1","1","1","","","","","","","","","","","","","","","","","","2013","","","Korean Society of Obstetrics and Gynecology","Sør-Korea","Engelsk","0","https://www.ogscience.org/"
