"Tidsskrift id","Original tittel","Sist endret","Internasjonal tittel","Aktiv","Print ISSN","Online ISSN","Open Access","NPI Fagfelt","NPI Fagområde","Nivå 2024","Nivå 2023","Nivå 2022","Nivå 2021","Nivå 2020","Nivå 2019","Nivå 2018","Nivå 2017","Nivå 2016","Nivå 2015","Nivå 2014","Nivå 2013","Nivå 2012","Nivå 2011","Nivå 2010","Nivå 2009","Nivå 2008","Nivå 2007","Nivå 2006","Nivå 2005","Nivå 2004","Forlag id","Etablert år","Nedlagt år","Forlag","Utgiver","Utgiverland","Språk","Konferanserapport","Url"
"441394","IEEE Transactions on Communications","18-Aug-2023 13:56:25","IEEE Transactions on Communications","1","0090-6778","1558-0857","","IKT","Realfag og teknologi","2","2","2","2","2","2","2","2","2","2","2","2","2","2","2","2","2","2","2","2","2","19395","1972","","IEEE Sarnoff Symposium","","USA","","0","http://www.comsoc.org/dl/jrnal/transcom.html"
"441395","IEEE transactions on components and packaging technologies","06-Jun-2023 12:22:29","IEEE transactions on components and packaging technologies","1","1521-3331","1557-9972","","Konstruksjonsfag","Realfag og teknologi","","1","1","1","1","1","1","1","1","1","1","1","1","1","1","1","1","1","1","1","1","","1999","","","","USA","","0","http://www.ieee.org/index.html"
"441396","IEEE Transactions on Components, Hybrids and Manufacturing Technology","06-Jun-2023 12:22:29","IEEE Transactions on Components, Hybrids and Manufacturing Technology","1","0148-6411","1558-3082","","Konstruksjonsfag","Realfag og teknologi","","1","1","1","1","1","1","1","1","1","1","1","1","1","1","1","1","1","1","1","1","","1978","","","","","","0","NA"
"441397","IEEE transactions on components, packaging, and manufacturing technology. Part A (Print)","06-Jun-2023 12:22:29","IEEE transactions on components, packaging, and manufacturing technology. Part A (Print)","1","1070-9886","1558-3678","","Konstruksjonsfag","Realfag og teknologi","","1","1","1","1","1","1","1","1","1","1","1","1","1","1","1","1","1","1","1","1","","1994","","","","","","0","NA"
"441398","IEEE Transactions on Components, Packaging, and Manufacturing Technology, Part B","06-Jun-2023 12:22:29","IEEE Transactions on Components, Packaging, and Manufacturing Technology, Part B","1","1070-9894","1558-3686","","Konstruksjonsfag","Realfag og teknologi","","1","1","1","1","1","1","1","1","1","1","1","1","1","1","1","1","1","1","1","1","","1994","","","","","","0","NA"
"441399","IEEE Transactions on Components, Packaging, and Manufacturing Technology, Part C","06-Jun-2023 12:22:29","IEEE Transactions on Components, Packaging, and Manufacturing Technology, Part C","1","1083-4400","1558-1241","","Tverrfaglig teknologi","Realfag og teknologi","","1","1","1","1","1","1","1","1","1","1","1","1","1","1","1","1","1","1","1","1","","1996","","","","","","0","NA"
"441400","IEEE Transactions on Computer-Aided Design of Integrated Circuits and Systems","18-Aug-2023 13:56:25","IEEE Transactions on Computer-Aided Design of Integrated Circuits and Systems","1","0278-0070","1937-4151","","IKT","Realfag og teknologi","","1","1","1","1","1","1","1","1","1","1","1","1","1","1","1","1","1","2","1","1","","1982","","","","USA","","0","http://ieeexplore.ieee.org/xpl/RecentIssue.jsp?punumber=43"
"441401","IEEE transactions on computers","18-Aug-2023 13:56:25","IEEE transactions on computers","1","0018-9340","1557-9956","","IKT","Realfag og teknologi","2","2","2","2","2","2","2","2","2","2","2","2","2","2","2","2","2","2","2","2","1","","1968","","","","USA","","0","http://www.computer.org/portal/site/transactions/menuitem.a66ec5ba52117764cfe79d108bcd45f3/index.jsp?&pName=tc_home&"
"441402","IEEE transactions on consumer electronics","18-Aug-2023 13:56:25","IEEE transactions on consumer electronics","1","0098-3063","1558-4127","","IKT","Realfag og teknologi","","1","1","1","1","1","1","1","1","1","1","1","1","1","1","1","1","1","1","1","1","","1975","","","","","","0","http://www.ieee.org/index.html"
"441403","IEEE Transactions on Control Systems Technology","18-Aug-2023 13:56:25","IEEE Transactions on Control Systems Technology","1","1063-6536","1558-0865","","IKT","Realfag og teknologi","2","2","2","2","2","2","2","2","2","2","2","2","2","2","2","1","1","1","2","1","1","","1993","","","","USA","","0","http://ieeexplore.ieee.org/xpl/RecentIssue.jsp?punumber=87"
"441404","IEEE Transactions on Dependable and Secure Computing","18-Aug-2023 13:56:25","IEEE Transactions on Dependable and Secure Computing","1","1545-5971","1941-0018","","IKT","Realfag og teknologi","2","2","2","2","2","2","2","2","2","2","2","2","2","2","2","2","2","2","2","1","1","","","","","","","","0","http://www.computer.org/portal/site/transactions/menuitem.a66ec5ba52117764cfe79d108bcd45f3/index.jsp?&pName=tdsc_home/&"
"441405","IEEE transactions on device and materials reliability","18-Aug-2023 13:56:25","IEEE transactions on device and materials reliability","1","1530-4388","1558-2574","","Tverrfaglig teknologi","Realfag og teknologi","","1","1","1","1","1","1","1","1","1","1","1","1","1","1","1","1","1","1","1","1","","2001","","","","","","0","http://www.ieee.org/index.html"
"441406","IEEE transactions on dielectrics and electrical insulation","18-Aug-2023 13:56:25","IEEE transactions on dielectrics and electrical insulation","1","1070-9878","1558-4135","","Elektrofag","Realfag og teknologi","","1","1","1","1","2","2","2","2","2","2","2","2","2","2","1","1","1","2","1","1","","1994","","","","USA","","0","http://www.ieee.org/index.html"
"441407","IEEE Transactions on Education","18-Aug-2023 13:56:25","IEEE Transactions on Education","1","0018-9359","1557-9638","","Tverrfaglig teknologi","Realfag og teknologi","","1","1","1","1","1","1","1","1","1","1","1","1","1","1","1","1","1","1","1","1","","1963","","","Institute of Electrical and Electronics Engineers","USA","Engelsk","0","http://ieeexplore.ieee.org/xpl/RecentIssue.jsp?reload=true&punumber=13"
"441408","IEEE Transactions on Electrical Insulation","06-Jun-2023 12:22:29","IEEE Transactions on Electrical Insulation","1","0018-9367","1557-962X","","Elektrofag","Realfag og teknologi","","1","1","1","1","1","1","1","1","1","1","1","1","1","1","1","1","1","1","1","1","","1965","","","","","","0","NA"
"441409","IEEE transactions on electromagnetic compatibility (Print)","18-Aug-2023 13:56:25","IEEE transactions on electromagnetic compatibility (Print)","1","0018-9375","1558-187X","","Elektrofag","Realfag og teknologi","","1","1","1","1","1","1","1","1","1","1","1","1","1","1","1","1","1","1","1","1","","1964","","","","","","0","http://www.ieee.org/index.html"
"441410","IEEE Transactions on Electron Devices","18-Aug-2023 13:56:25","IEEE Transactions on Electron Devices","1","0018-9383","1557-9646","","IKT","Realfag og teknologi","2","2","2","2","2","2","2","2","2","2","2","2","2","2","2","2","2","2","2","1","1","18231","1963","","IEEE (Institute of Electrical and Electronics Engineers)","","USA","Engelsk","0","https://ieeexplore.ieee.org/xpl/RecentIssue.jsp?punumber=16"
"441411","IEEE transactions on electronics packaging manufacturing (Print)","06-Jun-2023 12:22:29","IEEE transactions on electronics packaging manufacturing (Print)","1","1521-334X","1558-0822","","Tverrfaglig teknologi","Realfag og teknologi","","1","1","1","1","1","1","1","1","1","1","1","1","1","1","1","1","1","1","1","1","","1999","","","","","","0","http://www.ieee.org/index.html"
"441412","IEEE transactions on energy conversion","18-Aug-2023 13:56:25","IEEE transactions on energy conversion","1","0885-8969","1558-0059","","Elektrofag","Realfag og teknologi","2","2","2","2","2","2","2","2","2","2","2","2","2","2","2","1","1","1","2","1","1","","1986","","","","USA","","0","http://www.ieee.org/index.html"
"441413","IEEE transactions on engineering management","18-Aug-2023 13:56:25","IEEE transactions on engineering management","1","0018-9391","1558-0040","","Tverrfaglig teknologi","Realfag og teknologi","","1","1","1","1","1","1","1","1","1","1","1","1","1","1","1","1","1","1","1","1","","1963","","","","USA","Engelsk","0","http://ieeexplore.ieee.org/xpl/RecentIssue.jsp?punumber=17"
"441414","IEEE Transactions on Evolutionary Computation","18-Aug-2023 13:56:25","IEEE Transactions on Evolutionary Computation","1","1089-778X","1941-0026","","IKT","Realfag og teknologi","2","2","2","2","2","2","2","2","2","2","2","2","2","2","2","2","2","2","1","1","1","18231","1997","","IEEE (Institute of Electrical and Electronics Engineers)","","USA","","0","http://ieee-cis.org/pubs/tec/"
"441415","IEEE transactions on fuzzy systems","18-Aug-2023 13:56:25","IEEE transactions on fuzzy systems","1","1063-6706","1941-0034","","IKT","Realfag og teknologi","2","2","2","2","2","2","2","2","2","2","2","2","2","2","2","2","2","2","2","2","2","","1993","","","","","","0","http://www.ieee.org/index.html"
"441416","IEEE transactions on industrial electronics (1982. Print)","18-Aug-2023 13:56:25","IEEE transactions on industrial electronics (1982. Print)","1","0278-0046","1557-9948","","Elektrofag","Realfag og teknologi","2","2","2","2","2","2","2","2","2","2","2","2","2","1","1","1","1","1","1","1","1","","1982","","","","","","0","http://www.ieee.org/index.html"
"441417","IEEE transactions on industry applications","18-Aug-2023 13:56:25","IEEE transactions on industry applications","1","0093-9994","1939-9367","","Elektrofag","Realfag og teknologi","","1","1","1","1","1","1","1","1","1","1","1","1","1","1","1","1","1","1","2","2","","1972","","","","USA","","0","http://www.ieee.org/index.html"
"441418","IEEE transactions on information technology in biomedicine","10-Feb-2016 16:08:25","IEEE transactions on information technology in biomedicine","0","1089-7771","1558-0032","","IKT","Realfag og teknologi","","","","","","","","","","","","","2","2","2","2","2","2","2","2","2","","1997","2012","","","USA","","0","http://ieeexplore.ieee.org/xpl/RecentIssue.jsp?punumber=4233"
"441419","IEEE Transactions on Information Theory","18-Aug-2023 13:56:25","IEEE Transactions on Information Theory","1","0018-9448","1557-9654","","IKT","Realfag og teknologi","2","2","2","2","2","2","2","2","2","2","2","2","2","2","2","2","2","2","2","2","2","","1963","","","IEEE Geoscience and Remote Sensing Society","USA","","0","http://ieeexplore.ieee.org/xpl/RecentIssue.jsp?puNumber=18"
"441420","IEEE Transactions on Instrumentation and Measurement","18-Aug-2023 13:56:25","IEEE Transactions on Instrumentation and Measurement","1","0018-9456","1557-9662","","IKT","Realfag og teknologi","","1","1","1","1","1","1","1","1","1","1","1","1","1","1","1","1","1","1","2","2","","1963","","","IEEE Geoscience and Remote Sensing Society","USA","","0","http://ieeexplore.ieee.org/xpl/RecentIssue.jsp?punumber=19"
"441421","IEEE transactions on intelligent transportation systems (Print)","18-Aug-2023 13:56:25","IEEE transactions on intelligent transportation systems (Print)","1","1524-9050","1558-0016","","Konstruksjonsfag","Realfag og teknologi","","1","1","1","1","1","1","1","1","1","1","1","1","1","1","1","1","1","1","1","1","","2000","","","","","","0","http://www.ieee.org/index.html"
"441422","IEEE Transactions on Knowledge and Data Engineering","18-Aug-2023 13:56:25","IEEE Transactions on Knowledge and Data Engineering","1","1041-4347","1558-2191","","IKT","Realfag og teknologi","2","2","2","2","2","2","2","2","2","2","2","2","2","2","2","2","2","2","2","2","2","18231","1989","","IEEE (Institute of Electrical and Electronics Engineers)","","USA","","0","http://www.computer.org/portal/site/transactions/menuitem.eda2ca84d8d67764cfe79d108bcd45f3/index.jsp?&pName=transactions_level1&path=transactions/tkde/content&file=about.xml&xsl=article.xsl&"
"441423","IEEE transactions on magnetics","18-Aug-2023 13:56:25","IEEE transactions on magnetics","1","0018-9464","1941-0069","","Elektrofag","Realfag og teknologi","","1","1","1","1","1","1","1","1","1","1","1","1","1","1","1","1","1","1","1","1","","1965","","","","USA","","0","http://www.ieee.org/index.html"
"441424","IEEE transactions on microwave theory and techniques","18-Aug-2023 13:56:25","IEEE transactions on microwave theory and techniques","1","0018-9480","1557-9670","","IKT","Realfag og teknologi","","1","1","1","1","1","1","1","1","2","2","2","2","2","2","2","2","2","2","2","2","","1963","","","","USA","","0","http://www.ieee.org/index.html"
"441425","IEEE Transactions on Mobile Computing","18-Aug-2023 13:56:25","IEEE Transactions on Mobile Computing","1","1536-1233","","","IKT","Realfag og teknologi","2","2","2","2","2","2","2","2","2","1","1","1","1","1","1","1","1","1","1","1","1","","2002","","","","USA","","0","http://www.ieee.org/index.html"
"441426","IEEE transactions on multimedia","18-Aug-2023 13:56:25","IEEE transactions on multimedia","1","1520-9210","1941-0077","","IKT","Realfag og teknologi","","1","1","1","1","1","1","1","1","1","1","1","1","1","1","1","1","1","1","1","1","","1999","","","","","","0","http://www.ieee.org/index.html"
"441427","IEEE Transactions on Nanobioscience","18-Aug-2023 13:56:25","IEEE Transactions on Nanobioscience","1","1536-1241","1558-2639","","Biovitenskap","Realfag og teknologi","","1","1","1","1","1","1","1","1","1","1","1","1","1","1","1","1","1","1","1","1","","2002","","","","","","0","http://www.ieee.org/index.html"
"441428","IEEE transactions on nanotechnology","18-Aug-2023 13:56:25","IEEE transactions on nanotechnology","1","1536-125X","1941-0085","","Kjemi og materialteknologi","Realfag og teknologi","","1","1","1","1","1","1","1","1","2","2","2","2","2","2","2","2","2","2","1","1","","2002","","","","","","0","http://www.ieee.org/index.html"
"441429","IEEE Transactions on Neural Networks","10-Feb-2016 17:13:31","IEEE Transactions on Neural Networks","0","1045-9227","1941-0093","","IKT","Realfag og teknologi","","","","","","","","","","","","","","2","2","2","2","2","2","2","2","","1990","2011","","","USA","","0","http://ieeexplore.ieee.org/servlet/opac?punumber=72"
"441430","IEEE transactions on neural systems and rehabilitation engineering","18-Aug-2023 13:56:25","IEEE transactions on neural systems and rehabilitation engineering","1","1534-4320","1558-0210","DOAJ","Rehabilitering, fysioterapi, ergoterapi og ortopediingeniørfag","Medisin og helsefag","2","2","2","2","2","2","2","2","2","1","1","1","1","1","1","1","1","1","1","1","1","","2001","","","Institute of Electrical and Electronics Engineers","USA","Engelsk","0","http://ieeexplore.ieee.org/xpl/RecentIssue.jsp?punumber=7333"
"441431","IEEE Transactions on Nuclear Science","18-Aug-2023 13:56:25","IEEE Transactions on Nuclear Science","1","0018-9499","1558-1578","","Energi","Realfag og teknologi","","1","1","1","1","1","1","1","1","1","1","1","1","1","1","1","1","1","1","1","2","18231","1963","","IEEE (Institute of Electrical and Electronics Engineers)","","USA","Engelsk","0","https://ieeexplore.ieee.org/xpl/RecentIssue.jsp?punumber=23"
"441432","IEEE Transactions on Parallel and Distributed Systems","18-Aug-2023 13:56:25","IEEE Transactions on Parallel and Distributed Systems","1","1045-9219","","","IKT","Realfag og teknologi","2","2","2","2","2","2","2","2","2","2","2","2","2","2","2","2","1","1","2","1","1","","1990","","","","USA","","0","http://www.ieee.org/index.html"
"441433","IEEE Transactions on Plasma Science","18-Aug-2023 13:56:25","IEEE Transactions on Plasma Science","1","0093-3813","1939-9375","","Fysikk","Realfag og teknologi","","1","1","1","1","1","1","1","1","1","1","1","1","1","1","1","1","1","1","1","1","18231","1973","","IEEE (Institute of Electrical and Electronics Engineers)","","USA","Engelsk","0","https://ieeexplore.ieee.org/xpl/RecentIssue.jsp?punumber=27"
"441434","IEEE Transactions on Power Delivery","18-Aug-2023 13:56:25","IEEE Transactions on Power Delivery","1","0885-8977","1937-4208","","Elektrofag","Realfag og teknologi","2","2","2","2","2","2","2","2","2","2","2","2","2","2","2","1","1","1","2","1","1","","1986","","","","USA","","0","http://www.ieee.org/index.html"
"441435","IEEE transactions on power electronics","18-Aug-2023 13:56:25","IEEE transactions on power electronics","1","0885-8993","1941-0107","","Elektrofag","Realfag og teknologi","2","2","2","2","2","2","2","2","2","2","2","2","2","2","2","1","1","1","2","1","1","","1986","","","","","","0","http://www.ieee.org/index.html"
"441436","IEEE Transactions on Power Systems","18-Aug-2023 13:56:25","IEEE Transactions on Power Systems","1","0885-8950","1558-0679","","Elektrofag","Realfag og teknologi","2","2","2","2","2","2","2","2","2","2","2","2","2","2","2","1","1","1","2","1","1","","1986","","","","USA","","0","http://www.ieee.org/index.html"
"441437","IEEE Transactions on Professional Communication","18-Aug-2023 13:56:25","IEEE Transactions on Professional Communication","1","0361-1434","1558-1500","","Medier og kommunikasjon","Humaniora","","1","1","1","1","1","1","1","1","1","1","1","1","1","1","1","1","1","1","1","1","","1972","","","IEEE (Institute of Electrical and Electronics Engineers)","USA","Engelsk","0","https://ieeexplore.ieee.org/xpl/RecentIssue.jsp?punumber=47"
"441438","IEEE transactions on rehabilitation engineering","15-Aug-2023 13:31:38","IEEE transactions on rehabilitation engineering","1","1063-6528","1558-0024","","Biomedisin","Medisin og helsefag","0","1","1","1","1","1","1","1","1","1","1","1","1","1","1","1","1","1","1","1","1","","1993","","","","","","0","NA"
"441439","IEEE Transactions on Reliability","18-Aug-2023 13:56:25","IEEE Transactions on Reliability","1","0018-9529","1558-1721","","Tverrfaglig teknologi","Realfag og teknologi","","1","1","1","1","1","1","1","1","1","1","1","1","1","1","1","1","1","1","1","1","","1963","","","","","","0","http://ieeexplore.ieee.org/xpl/RecentIssue.jsp?punumber=24"
"441440","IEEE transactions on robotics and automation","23-May-2016 17:27:16","IEEE transactions on robotics and automation","0","1042-296X","","","Tverrfaglig teknologi","Realfag og teknologi","","","","","","","","","","","","1","","2","2","2","2","","","","1","","1989","2004","","","","","0","NA"
"441441","IEEE transactions on semiconductor manufacturing","18-Aug-2023 13:56:25","IEEE transactions on semiconductor manufacturing","1","0894-6507","1558-2345","","Konstruksjonsfag","Realfag og teknologi","","1","1","1","1","1","1","1","1","1","1","1","1","1","1","1","1","1","1","1","1","","1988","","","","","","0","http://www.ieee.org/index.html"
"441442","IEEE Transactions on Signal Processing","18-Aug-2023 13:56:25","IEEE Transactions on Signal Processing","1","1053-587X","1941-0476","","IKT","Realfag og teknologi","2","2","2","2","2","2","2","2","2","2","2","2","2","2","2","2","2","2","2","1","1","18231","1991","","IEEE (Institute of Electrical and Electronics Engineers)","IEEE Signal Processing Society","USA","Engelsk","0","https://ieeexplore.ieee.org/xpl/RecentIssue.jsp?punumber=78"
"441443","IEEE Transactions on Software Engineering","18-Aug-2023 13:56:25","IEEE Transactions on Software Engineering","1","0098-5589","1939-3520","","IKT","Realfag og teknologi","2","2","2","2","2","2","2","2","2","2","2","2","2","2","2","2","2","2","2","2","2","18231","1975","","IEEE (Institute of Electrical and Electronics Engineers)","","USA","","0","http://www.computer.org/portal/site/transactions/menuitem.eda2ca84d8d67764cfe79d108bcd45f3/index.jsp?&pName=transactions_level1&path=transactions/tse/content&file=about.xml&xsl=article.xsl&"
"441444","IEEE transactions on speech and audio processing","08-Feb-2016 14:36:49","IEEE transactions on speech and audio processing","0","1063-6676","1558-2353","","IKT","Realfag og teknologi","","","","","","","","","","","","","","","","","","","","1","1","","1993","2005","","","","","0","NA"
"441445","IEEE Transactions on Systems, Man and Cybernetics","06-Jun-2023 12:22:29","IEEE Transactions on Systems, Man and Cybernetics","1","0018-9472","2168-2909","","IKT","Realfag og teknologi","","1","1","1","1","1","1","1","1","1","1","1","1","1","1","1","1","1","1","1","1","","1971","","","","","","0","NA"
"441446","IEEE transactions on systems, man and cybernetics. Part A. Systems and humans","06-Jun-2023 12:22:29","IEEE transactions on systems, man and cybernetics. Part A. Systems and humans","1","1083-4427","1558-2426","","IKT","Realfag og teknologi","","1","1","1","1","1","1","1","1","1","1","1","1","1","1","1","1","1","1","1","1","","1996","","","","USA","","0","http://www.ieee.org/index.html"
"441447","IEEE Transactions on Cybernetics","17-Oct-2016 15:12:56","IEEE Transactions on Cybernetics","0","1083-4419","1941-0492","","IKT","Realfag og teknologi","","","","","","","","","","","","","2","2","2","2","2","2","2","2","2","","1996","2012","","","USA","Engelsk","0","http://ieeexplore.ieee.org/xpl/RecentIssue.jsp?punumber=6221036"
"441448","IEEE transactions on systems, man and cybernetics. Part C, Applications and reviews","17-Jun-2015 11:59:13","IEEE transactions on systems, man and cybernetics. Part C, Applications and reviews","0","1094-6977","1558-2442","","IKT","Realfag og teknologi","","","","","","","","","","","","","1","1","1","1","1","1","1","1","1","","1998","2012","","","USA","","0","http://www.ieee.org/index.html"
"441449","IEEE Transactions on Vehicular Technology","18-Aug-2023 13:56:25","IEEE Transactions on Vehicular Technology","1","0018-9545","1939-9359","","IKT","Realfag og teknologi","2","2","2","2","2","2","2","2","2","2","2","2","2","2","2","2","2","2","2","2","2","","1967","","","IEEE Geoscience and Remote Sensing Society","USA","","0","http://ieeexplore.ieee.org/xpl/RecentIssue.jsp?punumber=25"
"441450","IEEE Transactions on Very Large Scale Integration (vlsi) Systems","18-Aug-2023 13:56:25","IEEE Transactions on Very Large Scale Integration (vlsi) Systems","1","1063-8210","1557-9999","","IKT","Realfag og teknologi","","1","1","1","1","1","1","1","1","1","1","1","1","1","1","1","1","1","2","1","1","","1993","","","","USA","","0","http://www.ieee.org/index.html"
"441451","IEEE Transactions on Visualization and Computer Graphics","18-Aug-2023 13:56:25","IEEE Transactions on Visualization and Computer Graphics","1","1077-2626","1941-0506","","IKT","Realfag og teknologi","2","2","2","2","2","2","2","2","2","2","2","2","2","2","2","2","2","2","2","2","2","18231","1995","","IEEE (Institute of Electrical and Electronics Engineers)","","USA","","0","http://www.computer.org/portal/site/transactions/menuitem.eda2ca84d8d67764cfe79d108bcd45f3/index.jsp?&pName=transactions_level1&path=transactions/tvcg/content&file=about.xml&xsl=article.xsl&"
"441452","IEEE Transactions on Wireless Communications","18-Aug-2023 13:56:25","IEEE Transactions on Wireless Communications","1","1536-1276","1558-2248","","IKT","Realfag og teknologi","2","2","2","2","2","2","2","2","2","2","2","2","2","2","2","2","1","1","2","2","1","","2002","","","IEEE Geoscience and Remote Sensing Society","USA","","0","http://ieeexplore.ieee.org/xpl/RecentIssue.jsp?punumber=7693&year=2005"
"441453","IEEE wireless communications","18-Aug-2023 13:56:25","IEEE wireless communications","1","1536-1284","1558-0687","","IKT","Realfag og teknologi","","1","1","1","1","2","2","2","2","2","2","2","2","2","2","2","1","1","1","1","1","","2002","","","","USA","","0","http://www.ieee.org/index.html"
"441454","IEEE/ACM Transactions on Computational Biology & Bioinformatics","18-Aug-2023 13:56:25","IEEE/ACM Transactions on Computational Biology & Bioinformatics","1","1545-5963","1557-9964","","IKT","Realfag og teknologi","","1","1","1","1","1","1","1","1","1","1","1","1","1","1","1","1","1","1","1","1","18231","2004","","IEEE (Institute of Electrical and Electronics Engineers)","","USA","Engelsk","0","http://www.computer.org/portal/site/transactions/menuitem.105363178fd279bc8a9ca0108bcd45f3/index.jsp?pName=tcbb_home"
"441455","IEEE/ACM Transactions on Networking","18-Aug-2023 13:56:25","IEEE/ACM Transactions on Networking","1","1063-6692","1558-2566","","IKT","Realfag og teknologi","2","2","2","2","2","2","2","2","2","2","2","2","2","2","2","2","2","2","2","2","2","19395","1993","","IEEE Sarnoff Symposium","","USA","","0","http://ieeexplore.ieee.org/xpl/RecentIssue.jsp?punumber=90"
"441456","IEEE/ASME transactions on mechatronics","18-Aug-2023 13:56:25","IEEE/ASME transactions on mechatronics","1","1083-4435","1941-014X","","IKT","Realfag og teknologi","2","2","2","2","2","2","2","2","1","1","1","1","1","1","1","1","1","1","1","1","1","","1996","","","","","","0","http://www.ieee.org/index.html"
"441457","IEICE transactions on communications","18-Aug-2023 13:56:25","IEICE transactions on communications","1","0916-8516","1745-1345","","IKT","Realfag og teknologi","","1","1","1","1","1","1","1","1","1","1","1","1","1","1","1","1","1","1","1","1","","1992","","","","USA","","0","http://www.ieice.org/eng/index.html"
"441458","IEICE transactions on electronics","18-Aug-2023 13:56:25","IEICE transactions on electronics","1","0916-8524","1745-1353","","IKT","Realfag og teknologi","","1","1","1","1","1","1","1","1","1","1","1","1","1","1","1","1","1","1","1","1","","1992","","","","","","0","http://www.ieice.org/eng/index.html"
"441459","IEICE Transactions on Fundamentals of Electronics Communications and Computer Sciences","18-Aug-2023 13:56:25","IEICE Transactions on Fundamentals of Electronics Communications and Computer Sciences","1","0916-8508","1745-1337","","IKT","Realfag og teknologi","","1","1","1","1","1","1","1","1","1","1","1","1","1","1","1","1","1","1","1","1","","1992","","","","Storbritannia","","0","http://ietfec.oxfordjournals.org/"
"441460","IEICE transactions on information and systems","18-Aug-2023 13:56:25","IEICE transactions on information and systems","1","0916-8532","1745-1361","","IKT","Realfag og teknologi","","1","1","1","1","1","1","1","1","1","1","1","1","1","1","1","1","1","1","1","1","","1992","","","","","","0","http://www.ieice.org/eng/index.html"
