"473034","The Internet Journal of Mental Health","04-Aug-2022 14:46:30","The Internet Journal of Mental Health","0","","1531-2941","","Samfunnsmedisin","Medisin og helsefag","","","","0","0","0","0","0","0","0","0","0","0","0","0","0","0","","","","","","2001","2013","","Internet Scientific Publications","USA","Engelsk","0","http://ispub.com/IJMH"
"473035","The Internet Journal of Microbiology","06-Jun-2023 12:22:29","The Internet Journal of Microbiology","1","","1937-8289","","Ikke tildelt","Ikke tildelt","","0","0","0","0","0","0","0","0","0","0","0","0","0","0","0","0","","","","","","2004","","","","","","0","http://www.ispub.com/ostia/index.php?xmlFilePath=journals/ijmb/front.xml"
"473036","The Internet Journal of Nanotechnology","06-Jun-2023 12:22:29","The Internet Journal of Nanotechnology","1","","1937-8262","","Ikke tildelt","Ikke tildelt","","0","0","0","0","0","0","0","0","0","0","0","0","0","0","0","0","","","","","","2004","","","","","","0","http://www.ispub.com/ostia/index.php?xmlFilePath=journals/ijnt/front.xml"
"473037","The Internet Journal of Nephrology","06-Jun-2023 12:22:29","The Internet Journal of Nephrology","1","","1540-2665","","Ikke tildelt","Ikke tildelt","","0","0","0","0","0","0","0","0","0","0","0","0","0","0","0","0","","","","","","2003","","","","","","0","http://www.ispub.com/ostia/index.php?xmlFilePath=journals/ijne/front.xml"
"473038","The Internet Journal of Neurology","06-Jun-2023 12:22:29","The Internet Journal of Neurology","1","","1531-295X","","Ikke tildelt","Ikke tildelt","","0","0","0","0","0","0","0","0","0","0","0","0","0","0","0","0","","","","","","2001","","","","","","0","http://www.ispub.com/ostia/index.php?xmlFilePath=journals/ijn/front.xml"
"473039","The Internet Journal of Neuromonitoring","06-Jun-2023 12:22:29","The Internet Journal of Neuromonitoring","1","","1531-300X","","Ikke tildelt","Ikke tildelt","","0","0","0","0","0","0","0","0","0","0","0","0","0","0","0","0","","","","","","2000","","","","","","0","http://www.ispub.com/ostia/index.php?xmlFilePath=journals/ijnm/front.xml"
"473040","The Internet Journal of Neurosurgery","06-Jun-2023 12:22:29","The Internet Journal of Neurosurgery","1","","1528-8285","","Ikke tildelt","Ikke tildelt","","0","0","0","0","0","0","0","0","0","0","0","0","0","0","0","0","","","","","","2003","","","","","","0","http://www.ispub.com/ostia/index.php?xmlFilePath=journals/ijns/front.xml"
"473041","The Internet Journal of Nuclear Medicine","06-Jun-2023 12:22:29","The Internet Journal of Nuclear Medicine","1","","1539-4638","","Ikke tildelt","Ikke tildelt","","0","0","0","0","0","0","0","0","0","0","0","0","0","0","0","0","","","","","","2002","","","","","","0","http://www.ispub.com/ostia/index.php?xmlFilePath=journals/ijnuc/front.xml"
"473042","The Internet Journal of Nutrition and Wellness","06-Jun-2023 12:22:29","The Internet Journal of Nutrition and Wellness","1","","1937-8297","","Ikke tildelt","Ikke tildelt","","0","0","0","0","0","0","0","0","0","0","0","0","0","0","0","0","","","","","","2005","","","","","","0","http://www.ispub.com/ostia/index.php?xmlFilePath=journals/ijnw/front.xml"
"473043","The Internet Journal of Oncology","06-Jun-2023 12:22:29","The Internet Journal of Oncology","1","","1528-8331","","Ikke tildelt","Ikke tildelt","","0","0","0","0","0","0","0","0","0","0","0","0","0","0","0","0","","","","","","2000","","","","","","0","http://www.ispub.com/ostia/index.php?xmlFilePath=journals/ijo/front.xml"
"473044","The Internet Journal of Ophthalmology and Visual Science","06-Jun-2023 12:22:29","The Internet Journal of Ophthalmology and Visual Science","1","","1528-8269","","Ikke tildelt","Ikke tildelt","","0","0","0","0","0","0","0","0","0","0","0","0","0","0","0","0","","","","","","2000","","","","","","0","http://www.ispub.com/ostia/index.php?xmlFilePath=journals/ijovs/front.xml"
"473045","The Internet Journal of Orthopedic Surgery","06-Jun-2023 12:22:29","The Internet Journal of Orthopedic Surgery","1","","1531-2968","","Ikke tildelt","Ikke tildelt","","0","0","0","0","0","0","0","0","0","0","0","0","0","0","0","0","","","","","","2001","","","","","","0","http://www.ispub.com/ostia/index.php?xmlFilePath=journals/ijos/front.xml"
"473046","The Internet Journal of Otorhinolaryngology","06-Jun-2023 12:22:29","The Internet Journal of Otorhinolaryngology","1","","1528-8420","","Ikke tildelt","Ikke tildelt","","0","0","0","0","0","0","0","0","0","0","0","0","0","0","0","0","","","","","","2000","","","","","","0","http://www.ispub.com/ostia/index.php?xmlFilePath=journals/ijorl/front.xml"
"473047","The Internet Journal of Pathology","08-Jun-2023 11:40:28","The Internet Journal of Pathology","1","","1528-8307","","Ikke tildelt","Ikke tildelt","","0","0","0","0","0","0","0","0","0","0","0","0","0","0","0","0","","","","","","2001","","","","","","0","http://www.ispub.com/ostia/index.php?xmlFilePath=journals/ijpa/front.xml"
"473048","The Internet Journal of Pediatrics and Neonatology","06-Jun-2023 12:22:29","The Internet Journal of Pediatrics and Neonatology","1","","1528-8374","","Ikke tildelt","Ikke tildelt","","0","0","0","0","0","0","0","0","0","0","0","0","0","0","0","0","","","","","","2001","","","","","","0","http://www.ispub.com/ostia/index.php?xmlFilePath=journals/ijpn/front.xml"
"473049","The Internet Journal of Perfusionists","06-Jun-2023 12:22:29","The Internet Journal of Perfusionists","1","","1531-3026","","Ikke tildelt","Ikke tildelt","","0","0","0","0","0","0","0","0","0","0","0","0","0","0","0","0","","","","","","1999","","","","","","0","http://www.ispub.com/ostia/index.php?xmlFilePath=journals/ijpf/front.xml"
"473050","The Internet Journal of Pharmacology","06-Jun-2023 12:22:29","The Internet Journal of Pharmacology","1","","1531-2976","","Ikke tildelt","Ikke tildelt","","0","0","0","0","0","0","0","0","0","0","0","0","0","0","0","0","","","","","","2001","","","","","","0","http://www.ispub.com/ostia/index.php?xmlFilePath=journals/ijpharm/front.xml"
"473051","The Internet Journal of Plastic Surgery","06-Jun-2023 12:22:29","The Internet Journal of Plastic Surgery","1","","1528-8293","","Ikke tildelt","Ikke tildelt","","0","0","0","0","0","0","0","0","0","0","0","0","0","0","0","0","","","","","","2001","","","","","","0","http://www.ispub.com/ostia/index.php?xmlFilePath=journals/ijps/front.xml"
"473052","The Internet Journal of Pulmonary Medicine","06-Jun-2023 12:22:29","The Internet Journal of Pulmonary Medicine","1","","1531-2984","","Ikke tildelt","Ikke tildelt","","0","0","0","0","0","0","0","0","0","0","0","0","0","0","0","0","","","","","","2000","","","","","","0","http://www.ispub.com/ostia/index.php?xmlFilePath=journals/ijpm/front.xml"
"473053","The Internet Journal of Radiology","06-Jun-2023 12:22:29","The Internet Journal of Radiology","1","","1528-8404","","Ikke tildelt","Ikke tildelt","","0","0","0","0","0","0","0","0","0","0","0","0","0","0","0","0","","","","","","2000","","","","","","0","http://www.ispub.com/ostia/index.php?xmlFilePath=journals/ijra/front.xml"
"473054","The Internet Journal of Rescue and Disaster Medicine","06-Jun-2023 12:22:29","The Internet Journal of Rescue and Disaster Medicine","1","","1531-2992","","Ikke tildelt","Ikke tildelt","","0","0","0","0","0","0","0","0","0","0","0","0","0","0","0","0","","","","","","1998","","","","","","0","http://www.ispub.com/ostia/index.php?xmlFilePath=journals/ijrdm/front.xml"
"473055","The Internet Journal of Rheumatology","08-Jun-2023 11:40:28","The Internet Journal of Rheumatology","1","","1528-8412","","Ikke tildelt","Ikke tildelt","","0","0","0","0","0","0","0","0","0","0","0","0","0","0","0","0","","","","","","2002","","","","","","0","http://www.ispub.com/ostia/index.php?xmlFilePath=journals/ijrh/front.xml"
"473056","The Internet Journal of Spine Surgery","06-Jun-2023 12:22:29","The Internet Journal of Spine Surgery","1","","1937-8270","","Ikke tildelt","Ikke tildelt","","0","0","0","0","0","0","0","0","0","0","0","0","0","0","0","0","","","","","","2003","","","","","","0","http://www.ispub.com/ostia/index.php?xmlFilePath=journals/ijss/front.xml"
"473057","The Internet Journal of Surgery","06-Jun-2023 12:22:29","The Internet Journal of Surgery","1","","1528-8242","","Ikke tildelt","Ikke tildelt","","0","0","0","0","0","0","0","0","0","0","0","0","0","0","0","0","","","","","","2000","","","","","","0","http://www.ispub.com/ostia/index.php?xmlFilePath=journals/ijs/front.xml"
"473058","The Internet Journal of Third World Medicine","06-Jun-2023 12:22:29","The Internet Journal of Third World Medicine","1","","1539-4646","","Ikke tildelt","Ikke tildelt","","0","0","0","0","0","0","0","0","0","0","0","0","0","0","0","0","","","","","","2002","","","","","","0","http://www.ispub.com/ostia/index.php?xmlFilePath=journals/ijtwm/front.xml"
"473059","The Internet Journal of Thoracic and Cardiovascular Surgery","06-Jun-2023 12:22:29","The Internet Journal of Thoracic and Cardiovascular Surgery","1","","1524-0274","","Ikke tildelt","Ikke tildelt","","0","0","0","0","0","0","0","0","0","0","0","0","0","0","0","0","","","","","","1997","","","","","","0","http://www.ispub.com/ostia/index.php?xmlFilePath=journals/ijtcvs/front.xml"
"473060","The Internet Journal of Toxicology","06-Jun-2023 12:22:29","The Internet Journal of Toxicology","1","","1559-3916","","Ikke tildelt","Ikke tildelt","","0","0","0","0","0","0","0","0","0","0","0","0","0","0","0","0","","","","","","2003","","","","","","0","http://www.ispub.com/ostia/index.php?xmlFilePath=journals/ijto/front.xml"
"473061","The Internet Journal of Tropical Medicine","06-Jun-2023 12:22:29","The Internet Journal of Tropical Medicine","1","","1540-2681","","Ikke tildelt","Ikke tildelt","","0","0","0","0","0","0","0","0","0","0","0","0","0","0","0","0","","","","","","2003","","","","","","0","http://www.ispub.com/ostia/index.php?xmlFilePath=journals/ijtm/front.xml"
"473062","The Internet Journal of Urology","06-Jun-2023 12:22:29","The Internet Journal of Urology","1","","1528-8390","","Ikke tildelt","Ikke tildelt","","0","0","0","0","0","0","0","0","0","0","0","0","0","0","0","0","","","","","","2002","","","","","","0","http://www.ispub.com/ostia/index.php?xmlFilePath=journals/iju/front.xml"
"473063","The Internet Journal of Veterinary Medicine","06-Jun-2023 12:22:29","The Internet Journal of Veterinary Medicine","1","","1937-8165","","Ikke tildelt","Ikke tildelt","","0","0","0","0","0","0","0","0","0","0","0","0","0","0","0","0","","","","","","2002","","","","","","0","http://www.ispub.com/ostia/index.php?xmlFilePath=journals/ijvm/front.xml"
"473064","The Internet Journal of World Health and Societal Politics","06-Jun-2023 12:22:29","The Internet Journal of World Health and Societal Politics","1","","1540-269X","","Ikke tildelt","Ikke tildelt","","0","0","0","0","0","0","0","0","0","0","0","0","0","0","0","0","","","","","","2002","","","","","","0","http://www.ispub.com/ostia/index.php?xmlFilePath=journals/ijwh/front.xml"
"473065","Intervalles","15-Aug-2023 13:31:38","Intervalles","1","","1784-8180","","Tverrfaglig humanistisk forskning","Humaniora","0","1","1","1","1","1","1","1","1","1","1","1","1","1","1","1","1","","","","","","2007","","","Université de Liège","Belgia","","0","http://www.cipa.ulg.ac.be/interintro.php"
"473066","Invenio","15-Aug-2023 13:31:38","Invenio","1","0329-3475","","","Tverrfaglig samfunnsforskning","Samfunnsvitenskap","0","1","1","1","1","1","1","1","1","1","1","1","1","1","1","1","1","","","","","","2006","","","Universidad del Centro Educativo Latinoamericano","Argentina","","0","http://redalyc.uaemex.mx/redalyc/src/inicio/HomRevRed.jsp?iCveEntRev=877"
