"Tidsskrift id","Original tittel","Sist endret","Internasjonal tittel","Aktiv","Print ISSN","Online ISSN","Open Access","NPI Fagfelt","NPI Fagområde","Nivå 2024","Nivå 2023","Nivå 2022","Nivå 2021","Nivå 2020","Nivå 2019","Nivå 2018","Nivå 2017","Nivå 2016","Nivå 2015","Nivå 2014","Nivå 2013","Nivå 2012","Nivå 2011","Nivå 2010","Nivå 2009","Nivå 2008","Nivå 2007","Nivå 2006","Nivå 2005","Nivå 2004","Forlag id","Etablert år","Nedlagt år","Forlag","Utgiver","Utgiverland","Språk","Konferanserapport","Url"
"487197","Trudy Instituta Russkogo Iazyka imeni V.V. Vinogradova","08-Jun-2023 11:40:28","Proceedings of the V.V. Vinogradov Russian Language Institute","1","2311-150X","","","Slavisk-baltisk","Humaniora","","1","1","1","1","1","","","","","","","","","","","","","","","","","2014","","","The V.V. Vinogradov Russian Language Institute of the Russian Academy of Sciences","Russland","Russisk","1","http://www.ruslang.ru/rli"
"487199","Problems of Management in the 21st Century","08-Jun-2023 11:40:28","Problems of Management in the 21st Century","1","2029-6932","2538-712X","","Økonomisk-administrative fag","Samfunnsvitenskap","","0","0","0","0","0","1","1","1","1","","","","","","","","","","","","","2011","","","Scientific Methodical Centre","Litauen","Engelsk","0","http://www.scientiasocialis.lt/pmc/"
"487206","Anuarul Institutului de Cercetări Socio-Umane „C.S. Nicolăescu-Plopșor”","28-Jun-2023 07:51:19","C.S. Nicolăescu-Plopşor - Institute for Research in Social Studies and Humanities Yearbook (CSNIPSSH Yearbook)","1","1841-0898","2501-0468","","Historie og Idéhistorie","Humaniora","0","1","1","1","1","1","1","1","0","","","","","","","","","","","","","","1999","","","Editura Academiei Române","Romania","Engelsk","0","https://npissh.ro/"
"487207","Modern Africa: Politics, History, and Society","28-Jun-2023 07:51:28","Modern Africa: Politics, History, and Society","1","2336-3274","2570-7558","DOAJ","Tverrfaglig samfunnsforskning","Samfunnsvitenskap","","1","","","","","","","","","","","","","","","","","","","","","2013","","","Philosophical Faculty, University of Hradec Kralove","Tsjekkia","Engelsk","0","https://uni.uhk.cz/africa/index.php/ModAfr."
"487210","Journal on Efficiency and Responsibility in Education and Science","18-Aug-2023 13:56:25","Journal on Efficiency and Responsibility in Education and Science","1","2336-2375","1803-1617","DOAJ","Pedagogikk og utdanning","Samfunnsvitenskap","","1","1","1","1","1","","","","","","","","","","","","","","","","","2008","","","Czech University of Life Sciences Prague","Tsjekkia","Engelsk","0","https://www.eriesjournal.com/index.php/eries"
"487211","Poznańskie Studia Polonistyczne. Seria Literacka","18-Aug-2023 13:56:25","Poznań Polish Studies. Literary Series","1","1233-8680","","DOAJ","Slavisk-baltisk","Humaniora","","1","1","1","1","1","1","","","","","","","","","","","","","","","","1994","","","Wydawnictwo Poznańskie Studia Polonistyczne, Uniwersytet im. Adama Mickiewicza w Poznaniu","Polen","Polsk","0","https://pressto.amu.edu.pl/index.php/pspsl"
"487213","eLyra","06-Jun-2023 12:22:29","eLyra","1","","2182-8954","","Litteraturvitenskap","Humaniora","","0","0","0","0","0","","","","","","","","","","","","","","","","","2013","","","Universidade do Porto. Instituto de Literatura Comparada Margarida Losa","Portugal","Portugisisk","0","https://www.elyra.org/index.php/elyra"
"487215","Verfassung und Recht in Übersee","18-Aug-2023 13:56:25","Law and Politics in Africa, Asia, Latin America","1","0506-7286","","","Rettsvitenskap","Samfunnsvitenskap","","1","1","1","1","1","1","1","","","","","","","","","","","","","","","1968","","","Nomos","Tyskland","Flerspråklig","0","http://www.vrue.nomos.de"
"487217","Nursing Times (NT)","06-Jun-2023 12:22:29","Nursing Times (NT)","1","0954-7762","","","Sykepleie","Medisin og helsefag","","1","1","1","1","1","1","1","1","1","0","0","0","0","0","0","0","0","0","0","","","1987","","","EMAP Publishing Ltd.","Storbritannia","Engelsk","0","http://www.nursingtimes.net/"
"487218","Journal of Marine Science and Engineering","06-Oct-2023 06:16:23","Journal of Marine Science and Engineering","1","","2077-1312","DOAJ","Konstruksjonsfag","Realfag og teknologi","","X","1","1","1","1","1","1","1","1","","","","","","","","","","","","26778","2013","","MDPI","","Internasjonal","Engelsk","0","http://www.mdpi.com/journal/jmse"
"487219","Dynamics in the History of Religions","08-Jun-2023 11:42:57","Dynamics in the History of Religions","1","1878-8106","1878-8114","","Teologi og religionsvitenskap","Humaniora","","1","1","1","1","1","1","1","1","1","","","","","","","","","","","","18109","2012","","Brill Academic Publishers","","Nederland","Engelsk","0","http://www.brill.com/publications/dynamics-history-religions"
"487220","Open Chemistry","18-Aug-2023 13:56:25","Open Chemistry","1","","2391-5420","DOAJ","Kjemi og materialteknologi","Realfag og teknologi","","1","1","1","1","1","1","1","1","1","1","","","","","","","","","","","18493","2014","","Walter de Gruyter (De Gruyter)","De Gruyter Open Access","Polen","Engelsk","0","https://www.degruyter.com/journal/key/CHEM/html"
"487221","Open Mathematics","18-Aug-2023 13:56:25","Open Mathematics","1","","2391-5455","DOAJ","Matematikk","Realfag og teknologi","","1","1","1","1","1","1","1","1","1","1","","","","","","","","","","","18493","2014","","Walter de Gruyter (De Gruyter)","De Gruyter Open Access","Polen","Engelsk","0","https://www.degruyter.com/journal/key/MATH/html"
"487222","Open Physics","18-Aug-2023 13:56:25","Open Physics","1","","2391-5471","DOAJ","Fysikk","Realfag og teknologi","","1","1","1","1","1","1","1","1","1","1","","","","","","","","","","","18493","2014","","Walter de Gruyter (De Gruyter)","De Gruyter Open Access","Polen","Engelsk","0","https://www.degruyter.com/journal/key/PHYS/html"
"487223","Open Life Sciences","18-Aug-2023 13:56:25","Open Life Sciences","1","","2391-5412","DOAJ","Biovitenskap","Realfag og teknologi","","1","1","1","1","1","1","1","1","1","1","","","","","","","","","","","18493","2014","","Walter de Gruyter (De Gruyter)","De Gruyter Open Access","Polen","Engelsk","0","https://www.degruyter.com/journal/key/BIOL/html"
"487224","Open Geosciences","18-Aug-2023 13:56:25","Open Geosciences","1","","2391-5447","DOAJ","Geovitenskap","Realfag og teknologi","","1","1","1","1","1","1","1","1","1","1","","","","","","","","","","","18493","2014","","Walter de Gruyter (De Gruyter)","De Gruyter Open Access","Polen","Engelsk","0","https://www.degruyter.com/journal/key/GEO/html"
"487225","Open Engineering","18-Aug-2023 13:56:25","Open Engineering","1","","2391-5439","DOAJ","Konstruksjonsfag","Realfag og teknologi","","1","1","1","1","1","1","1","1","1","1","","","","","","","","","","","18493","2014","","Walter de Gruyter (De Gruyter)","De Gruyter Open Access","Polen","Engelsk","0","https://www.degruyter.com/journal/key/ENG/html"
"487226","Recyclable Catalysis","04-Aug-2022 14:46:30","Recyclable Catalysis","0","","2084-7629","","Kjemi og materialteknologi","Realfag og teknologi","","","","1","1","1","1","1","1","1","","","","","","","","","","","","26520","2013","2017","De Gruyter Open","","Polen","Engelsk","0","http://NA"
"487229","Yearbook of the Poznan Linguistic Meeting","06-Jun-2023 12:22:29","Yearbook of the Poznan Linguistic Meeting","1","","2449-7525","","Lingvistikk","Humaniora","","1","1","1","1","1","1","1","","","","","","","","","","","","","","","2014","","","Sciendo","Polen","Engelsk","0","https://content.sciendo.com/view/journals/yplm/yplm-overview.xml?language=en"
"487237","Questions and Answers in Linguistics","08-Jun-2023 11:39:34","Questions and Answers in Linguistics","1","","2299-8942","","Lingvistikk","Humaniora","","1","1","1","1","1","1","1","1","","","","","","","","","","","","","","2013","","","Sciendo","Polen","Engelsk","0","https://content.sciendo.com/view/journals/qal/qal-overview.xml"
"487239","Administration - Journal of the Institute of Public Administration of Ireland","28-Jun-2023 07:51:18","Administration - Journal of the Institute of Public Administration of Ireland","1","0001-8325","2449-9471","DOAJ","Statsvitenskap","Samfunnsvitenskap","","1","","","","","","","","","","","","","","","","","","","","","1953","","","The Institute of Public Administration of Ireland, Sciendo","Irland, Polen","Engelsk","0","https://sciendo.com/fr/journal/ADMIN"
"487247","Порівняльно-педагогічні студії","06-Jun-2023 12:22:29","Studies in Comparative Education","1","2306-5532","2312-1904","DOAJ","Pedagogikk og utdanning","Samfunnsvitenskap","","1","1","1","1","","","","","","","","","","","","","","","","","","2009","","","Pavlo Tychyna Uman State Pedagogical University","Ukraina","Ukrainsk","0","http://pps.udpu.edu.ua"
"487249","Creativity. Theories – Research - Applications","18-Aug-2023 13:56:25","Creativity. Theories – Research - Applications","1","","2354-0036","","Tverrfaglig samfunnsforskning","Samfunnsvitenskap","","1","1","1","","","","","","","","","","","","","","","","","","26520","2014","","De Gruyter Open","","Polen","Engelsk","0","https://sciendo.com/journal/CTRA"
"487250","Management & Marketing","18-Aug-2023 13:56:25","Management & Marketing","1","1842-0206","2069-8887","DOAJ","Økonomisk-administrative fag","Samfunnsvitenskap","","1","1","1","1","1","1","1","","","","","","","","","","","","","","","2006","","","Sciendo","Romania","Engelsk","0","https://sciendo.com/journal/MMCKS"
"487259","Peptidomics","04-Aug-2022 14:46:30","Peptidomics","0","","2084-7203","","Biovitenskap","Realfag og teknologi","","","","1","1","1","1","1","1","1","","","","","","","","","","","","18493","2014","2017","Walter de Gruyter (De Gruyter)","De Gruyter Open Access","Polen","Engelsk","0","https://www.degruyter.com/journal/key/PED/html"
"487260","Nonautonomous Dynamical Systems","18-Aug-2023 13:56:25","Nonautonomous Dynamical Systems","1","","2353-0626","DOAJ","Matematikk","Realfag og teknologi","","1","1","1","1","1","1","1","1","1","","","","","","","","","","","","18493","2013","","Walter de Gruyter (De Gruyter)","De Gruyter Open Access","Polen","Engelsk","0","https://www.degruyter.com/journal/key/MSDS/html"
"487263","Inflammasome","04-Aug-2022 14:46:30","Inflammasome","0","","2300-102X","","Biovitenskap","Realfag og teknologi","","","","1","1","1","1","1","1","1","","","","","","","","","","","","26520","2013","2017","De Gruyter Open","","Polen","Engelsk","0","http://NA"
"487270","Curved and Layered Structures","18-Aug-2023 13:56:25","Curved and Layered Structures","1","","2353-7396","DOAJ","Konstruksjonsfag","Realfag og teknologi","","1","1","1","1","1","1","1","1","1","","","","","","","","","","","","18493","2014","","Walter de Gruyter (De Gruyter)","De Gruyter Open Access","Polen","Engelsk","0","https://www.degruyter.com/journal/key/CLS/html"
"487271","Journal of Cybersecurity","18-Aug-2023 13:56:25","Journal of Cybersecurity","1","","2057-2093","DOAJ","Tverrfaglig samfunnsforskning","Samfunnsvitenskap","","1","1","1","1","1","1","1","","","","","","","","","","","","","","18364","2015","","Oxford University Press","","Storbritannia","Engelsk","0","https://academic.oup.com/cybersecurity"
"487272","Non-Genetic Inheritance","04-Aug-2022 14:46:30","Non-Genetic Inheritance","0","","2084-8846","","Biovitenskap","Realfag og teknologi","","","","1","1","1","1","1","1","1","","","","","","","","","","","","26520","2012","2015","De Gruyter Open","","Polen","Engelsk","0","http://na"
"487273","Molecular Based Mathematical Biology","26-May-2021 17:05:10","Molecular Based Mathematical Biology","0","","2299-3266","","Tverrfaglig naturvitenskap og medisin","Realfag og teknologi","","","","","","","","1","1","1","","","","","","","","","","","","26520","2013","2017","De Gruyter Open","","Polen","Engelsk","0","https://www.degruyter.com/journal/key/CMB/html"
"487277","Acta Universitatis Lodziensis. Folia Linguistica Rossica","06-Jun-2023 12:22:29","Acta Universitatis Lodziensis. Folia Linguistica Rossica","1","1731-8025","2353-9623","DOAJ","Slavisk-baltisk","Humaniora","","1","1","1","1","1","1","","","","","","","","","","","","","","","","1998","","","Wydawnictwo Uniwersytetu Łódzkiego (Universitetet i Lodz)","Polen","Polsk","0","https://wydawnictwo.uni.lodz.pl/redakcje-czasopism/acta-universitatis-lodziensis-folia-linguistica-rossica/"
"487278","B.A.S. - British and American Studies","18-Aug-2023 13:56:25","B.A.S. - British and American Studies","1","1224-3086","2457-7715","DOAJ","Engelsk","Humaniora","","1","1","1","","","","","","","","","","","","","","","","","","","1996","","","West University of Timișoara, Romania","Romania","Engelsk","0","http://bas.journals.uvt.ro/"
"487281","DNA Barcodes","04-Aug-2022 14:46:30","DNA Barcodes","0","","2299-1077","","Biovitenskap","Realfag og teknologi","","","","1","1","1","1","1","1","1","","","","","","","","","","","","26520","2013","2018","De Gruyter Open","","Polen","Engelsk","0","http://NA"
"487282","Analysis and Geometry in Metric Spaces","18-Aug-2023 13:56:25","Analysis and Geometry in Metric Spaces","1","","2299-3274","DOAJ","Matematikk","Realfag og teknologi","","1","1","1","1","1","1","1","1","1","","","","","","","","","","","","18493","2013","","Walter de Gruyter (De Gruyter)","De Gruyter Open Access","Polen","Engelsk","0","https://www.degruyter.com/journal/key/AGMS/html"
"487283","Psychology of Violence","18-Aug-2023 13:56:25","Psychology of Violence","1","2152-0828","2152-081X","","Psykologi","Medisin og helsefag","","1","1","1","1","1","1","1","1","1","","","","","","","","","","","","18063","2011","","American Psychological Association (APA)","","USA","Engelsk","1","http://www.apa.org/pubs/journals/vio/"
"487284","Journal of Hydrology Regional Studies","18-Aug-2023 13:56:25","Journal of Hydrology Regional Studies","1","","2214-5818","DOAJ","Geovitenskap","Realfag og teknologi","","1","1","1","1","1","1","1","1","1","","","","","","","","","","","","18173","2014","","Elsevier","","Nederland","Engelsk","0","http://www.journals.elsevier.com/journal-of-hydrology-regional-studies"
"487285","Big Data Research","18-Aug-2023 13:56:25","Big Data Research","1","","2214-5796","","IKT","Realfag og teknologi","","1","1","1","1","1","1","1","1","1","","","","","","","","","","","","18173","2014","","Elsevier","","Nederland","Engelsk","0","http://www.sciencedirect.com/science/journal/22145796"
"487286","thersites. Journal for Transcultural Presences & Diachronic Identities from Antiquity to Date","06-Jun-2023 12:22:29","thersites. Journal for Transcultural Presences & Diachronic Identities from Antiquity to Date","1","","2364-7612","DOAJ","Gresk og latin","Humaniora","","0","0","0","0","0","0","0","0","0","","","","","","","","","","","","","2015","","","Klassische Philologie Inst. für Altertumswiss, Johannes Gutenberg-Universitaet","Tyskland","Flerspråklig","0","http://www.thersites.journal.de"
"487287","IZA Journal of Migration","08-Jun-2023 11:42:57","IZA Journal of Migration","1","","2193-9039","DOAJ","Økonomisk-administrative fag","Samfunnsvitenskap","","1","1","1","1","1","1","1","1","1","","","","","","","","","","","","22512","2012","","Springer","","Tyskland","Engelsk","0","http://www.izajom.com/"
"487288","Journal of Public Child Welfare","18-Aug-2023 13:56:25","Journal of Public Child Welfare","1","1554-8732","1554-8740","","Tverrfaglig samfunnsforskning","Samfunnsvitenskap","","1","1","1","1","1","1","1","1","1","","","","","","","","","","","","18402","2005","","Routledge","","USA","Engelsk","0","http://www.tandfonline.com/action/journalInformation?show=aimsScope&journalCode=wpcw20"
"487289","Linguística : Revista de Estudos Linguísticos da Universidade do Porto","06-Jun-2023 12:22:29","Linguistics: journal of linguistic studies at the University of Porto","1","1646-6195","2182-9713","DOAJ","Lingvistikk","Humaniora","","1","1","1","1","1","1","1","1","1","","","","","","","","","","","","","2006","","","Universidade do Porto. Faculdade de Letras","Portugal","Flerspråklig","0","http://ler.letras.up.pt/site/default.aspx?qry=id04id191&sum=sim"
"487290","Multiple Sclerosis International","08-Jun-2023 11:39:34","Multiple Sclerosis International","1","2090-2654","2090-2662","DOAJ","Nevrologi","Medisin og helsefag","","1","1","1","1","1","1","1","1","1","","","","","","","","","","","","18220","2010","","Hindawi Limited","","Storbritannia","Engelsk","0","https://www.hindawi.com/journals/msi/"
"487291","Strategic Management Review","15-Aug-2023 13:31:38","Strategic Management Review","1","","1930-4560","","Økonomisk-administrative fag","Samfunnsvitenskap","0","1","1","1","1","1","1","1","1","1","","","","","","","","","","","","","2006","","","University of Texas at Dallas. School of Management","USA","Engelsk","0","http://www.strategicmanagementreview.com/"
"487292","Virologica Sinica","18-Aug-2023 13:56:25","Virologica Sinica","1","1674-0769","1995-820X","","Biovitenskap","Realfag og teknologi","","1","1","1","1","1","1","1","1","1","","","","","","","","","","","","22512","2007","","Springer","","Kina","Engelsk","0","https://www.springer.com/journal/12250"
"487293","Proceedings of the ... International Conference on Research Challenges in Information Science","08-Jun-2023 11:39:34","Proceedings of the ... International Conference on Research Challenges in Information Science","1","2151-1349","2151-1357","","Biblioteks- og informasjonsvitenskap","Samfunnsvitenskap","","1","1","1","1","1","1","1","1","1","","","","","","","","","","","","19108","2007","","IEEE conference proceedings","","USA","Engelsk","1","http://ieeexplore.ieee.org/xpl/conhome.jsp?punumber=1002452"
"487294","Proceedings - SPE International Symposium on Oilfield Chemistry","16-Aug-2019 14:21:40","Proceedings - SPE International Symposium on Oilfield Chemistry","0","1046-1779","","","Geovitenskap","Realfag og teknologi","","","","","","","","","","0","","","","","","","","","","","","15236","1980","1989","Society of Petroleum Engineers","","USA","Engelsk","1","https://www.onepetro.org/"
"487295","Proceedings (International Conference of the Learning Sciences)","18-Aug-2023 13:54:28","Proceedings (International Conference of the Learning Sciences)","1","1814-9316","","","Pedagogikk og utdanning","Samfunnsvitenskap","","1","1","1","1","1","1","1","1","1","","","","","","","","","","","","25319","1991","","International Society of the Learning Sciences (ISLS)","","Internasjonal","Engelsk","1","http://www.lulu.com/shop/search.ep?contributorId=341614"
"487296","Proceedings of the ACM Conference on Computer and Communications Security","18-Aug-2023 13:56:25","Proceedings of the ACM Conference on Computer and Communications Security","1","1543-7221","","","IKT","Realfag og teknologi","","1","1","1","1","1","1","1","1","1","","","","","","","","","","","","18077","2000","","Association for Computing Machinery (ACM)","","USA","Engelsk","1","http://dl.acm.org/"
"487297","Proceedings of the Combustion Institute","18-Aug-2023 13:56:25","Proceedings of the Combustion Institute","1","1540-7489","1873-2704","","Kjemi og materialteknologi","Realfag og teknologi","","1","1","2","2","2","2","2","2","1","","","","","","","","","","","","18173","2000","","Elsevier","","USA","Engelsk","1","http://www.sciencedirect.com/science/journal/15407489"
"487298","The proceedings of the ... international conference on e-learning","06-Jun-2023 12:22:29","The proceedings of the ... international conference on e-learning","1","2048-8882","2048-8890","","Pedagogikk og utdanning","Samfunnsvitenskap","","1","1","1","1","1","1","1","1","1","","","","","","","","","","","","","2006","","","Academic Publishing","Storbritannia","Engelsk","1","http://academic-conferences.org/icel/icel-home.htm"
"487299","Proceedings - International Telemetering Conference","06-Jun-2023 12:22:29","Proceedings - International Telemetering Conference","1","0884-5123","1546-2196","","IKT","Realfag og teknologi","","1","1","1","1","1","1","1","1","1","","","","","","","","","","","","24922","1965","","ISA - International Society of Automation","","USA","Engelsk","1","https://www.isa.org/"
"487300","Proceedings of the National Academy of Sciences, India, Section B: biological sciences","18-Aug-2023 13:56:25","Proceedings of the National Academy of Sciences, India, Section B: biological sciences","1","0369-8211","2250-1746","","Biovitenskap","Realfag og teknologi","","1","1","1","1","1","1","1","1","1","","","","","","","","","","","","","1930","","","National Academy of Sciences","India","Engelsk","1","http://www.springer.com/life+sciences/journal/40011"
"487301","Revista Mexicana de Analisis de la Conducta","18-Aug-2023 13:56:25","Mexican journal of behaviour analysis","1","0185-4534","","","Psykologi","Medisin og helsefag","","1","1","1","1","1","1","1","1","1","","","","","","","","","","","","","1975","","","Sociedad Mexicana de Analisis de la Conducta","Mexico","Flerspråklig","0","http://rmac-mx.org/"
"487302","Revue de l'OFCE (En ligne)","18-Aug-2023 13:56:25","Revue de l'OFCE (En ligne)","1","1265-9576","1777-5647","","Økonomisk-administrative fag","Samfunnsvitenskap","","1","1","1","1","1","1","1","1","1","","","","","","","","","","","","","1994","","","Presses de Sciences Po","Frankrike","Fransk","0","http://www.cairn.info/revue-de-l-ofce.htm"
"487303","RSC Energy and Environment Series","18-Aug-2023 13:56:25","RSC Energy and Environment Series","1","2044-0774","2044-0782","","Energi","Realfag og teknologi","","1","1","1","1","1","1","1","1","1","","","","","","","","","","","","19875","2010","","Royal Society of Chemistry (RSC)","","Storbritannia","Engelsk","0","http://pubs.rsc.org/en/journals/journalissues/ee"
"487305","Simulation Series","06-Jun-2023 12:22:29","Simulation Series","1","0735-9276","","","IKT","Realfag og teknologi","","1","1","1","1","1","1","1","1","1","","","","","","","","","","","","19284","1981","","The Society for Modeling and Simulation International","","USA","Engelsk","0","http://www.worldcat.org/title/simulation-series/oclc/8875970"
"487306","Statistika","18-Aug-2023 13:56:25","Statistika","1","0322-788X","1804-8765","DOAJ","Matematikk","Realfag og teknologi","","1","1","1","1","1","1","1","1","1","","","","","","","","","","","","","1964","","","Cesky Statisticky Urad","Tsjekkia","Engelsk","0","https://www.czso.cz/csu/czso/2-statistika"
"487307","Tissue Engineering Part B: Reviews","18-Aug-2023 13:56:25","Tissue Engineering Part B: Reviews","1","1937-3368","1937-3376","","Biovitenskap","Realfag og teknologi","","1","1","1","1","1","1","1","1","1","","","","","","","","","","","","18316","2008","","Mary Ann Liebert","","USA","Engelsk","0","https://www.liebertpub.com/loi/teb"
"487308","Tourism Social Science Series","08-Jun-2023 11:42:57","Tourism Social Science Series","1","1571-5043","","","Tverrfaglig samfunnsforskning","Samfunnsvitenskap","","1","1","1","1","1","1","1","1","1","","","","","","","","","","","","17801","1996","","Emerald Group Publishing Limited","","Nederland","Engelsk","0","http://www.emeraldgrouppublishing.com/products/books/series.htm?id=1571-5043"
"487309","Research note PNW","06-Jun-2023 12:22:29","Research note PNW","1","0737-7150","","","Biovitenskap","Realfag og teknologi","","1","1","1","1","1","1","1","1","1","","","","","","","","","","","","","1980","","","The Station","USA","Engelsk","0","http://www.fs.fed.us/pnw/publications/index.shtml"
"487310","International Symposium on Medical Information and Communication Technology","08-Jun-2023 11:42:57","International Symposium on Medical Information and Communication Technology","1","2326-828X","2326-8301","","Biovitenskap","Realfag og teknologi","","1","1","1","1","1","1","1","1","1","","","","","","","","","","","","19108","2006","","IEEE conference proceedings","","USA","Engelsk","1","http://ieeexplore.ieee.org/xpl/conhome.jsp?punumber=1800343"
"487311","Conference proceedings WPMC","08-Jun-2023 11:42:57","Conference proceedings Wireless Personal Multimedia Communications","1","1347-6890","1882-5621","","Biblioteks- og informasjonsvitenskap","Samfunnsvitenskap","","1","1","1","1","1","1","1","1","1","","","","","","","","","","","","","1998","","","Causal Productions","Japan","Engelsk","1","http://www.wikicfp.com/cfp/program?id=3148&f=Wireless+Personal+Multimedia+Communications"
"487312","IUCrJ","18-Aug-2023 13:56:25","IUCrJ","1","","2052-2525","DOAJ","Kjemi og materialteknologi","Realfag og teknologi","","1","1","1","1","1","1","1","1","1","","","","","","","","","","","","","2014","","","International Union of Crystallography","Storbritannia","Engelsk","0","http://journals.iucr.org/m/"
"487313","Journal of Agrometeorology","18-Aug-2023 13:56:25","Journal of Agrometeorology","1","0972-1665","","","Biovitenskap","Realfag og teknologi","","1","1","1","1","1","1","1","1","1","","","","","","","","","","","","","1999","","","Association of Agrometeorologists","India","Engelsk","0","http://www.agrimetassociation.org/journal.htm"
"487314","Journal of Environmental Chemical Engineering","18-Aug-2023 13:56:25","Journal of Environmental Chemical Engineering","1","","2213-3437","","Kjemi og materialteknologi","Realfag og teknologi","","1","1","1","1","1","1","1","1","1","","","","","","","","","","","","18173","2013","","Elsevier","","Nederland","Engelsk","0","http://www.sciencedirect.com/science/journal/22133437"
"487315","Journal of Intelligent Systems","18-Aug-2023 13:56:25","Journal of Intelligent Systems","1","0334-1860","2191-026X","DOAJ","IKT","Realfag og teknologi","","1","1","1","1","1","1","1","1","1","","","","","","","","","","","","18493","1988","","Walter de Gruyter (De Gruyter)","","Tyskland","Engelsk","0","http://www.degruyter.com/view/j/jisys"
