"484711","International Review of Economics","18-Aug-2023 13:56:25","International Review of Economics","1","1865-1704","1863-4613","","Økonomisk-administrative fag","Samfunnsvitenskap","","1","1","1","1","1","1","1","1","1","1","","","","","","","","","","","22512","2007","","Springer","","Tyskland","Engelsk","0","http://www.springer.com/economics/policy/journal/12232"
"484712","Iranian Journal of Allergy, Asthma and Immunology","18-Aug-2023 13:56:25","Iranian Journal of Allergy, Asthma and Immunology","1","1735-1502","1735-5249","DOAJ","Hjerte, kar og luftveier","Medisin og helsefag","","1","1","1","1","1","1","1","1","1","1","","","","","","","","","","","","2000","","","Immunology, Asthma and Allergy Research Institute","Iran","Engelsk","0","http://ijaai.tums.ac.ir/index.php/ijaai"
"484713","Journal of Neurological Surgery Reports","06-Jun-2023 12:22:29","Journal of Neurological Surgery Reports","1","2193-6358","2193-6366","DOAJ","Nevrologi","Medisin og helsefag","","1","1","1","1","1","1","1","1","1","1","","","","","","","","","","","18197","2012","","Thieme","","Tyskland","Engelsk","0","http://www.thieme.com/index.php?page=shop.product_details&flypage=flypage.tpl&product_id=1378&category_id=90&keyword=journal+neurological+surgery+reports&option=com_virtuemart&Itemid=53"
"484714","Proceedings, annual STS-conference","08-Jun-2023 11:40:28","Proceedings, annual STS-conference","1","","2304-4233","","Biblioteks- og informasjonsvitenskap","Samfunnsvitenskap","","0","0","0","0","0","0","0","0","0","0","","","","","","","","","","","","2006","","","Inter-University Research Centre for Technology, Work and Culture","Østerrike","Flerspråklig","1","http://www.ifz.aau.at/ias-sts/publications"
"484715","Kinesitherapie","18-Aug-2023 13:56:25","Kinesitherapie","1","1779-0123","2213-1566","","Sosialforskning","Samfunnsvitenskap","","1","1","1","1","1","1","1","1","1","1","","","","","","","","","","","18173","2006","","Elsevier","","Frankrike, Nederland","Engelsk","0","http://www.sciencedirect.com/science/journal/17790123"
"484716","WWER Fuel Performance, Modelling and Experimental Support","06-Jun-2023 12:22:29","WWER Fuel Performance, Modelling and Experimental Support","1","1313-4531","","","Energi","Realfag og teknologi","","1","1","1","1","1","1","1","1","1","1","","","","","","","","","","","","2004","","","Institute for Nuclear Research and Nuclear Energy of the Bulgarian Academy of Sciences","Bulgaria","Engelsk","1","http://www.inrne.bas.bg/en"
"484717","Kyoto Journal of Mathematics","18-Aug-2023 13:56:25","Kyoto Journal of Mathematics","1","2156-2261","2154-3321","","Matematikk","Realfag og teknologi","","1","1","1","1","1","1","1","1","1","1","","","","","","","","","","","18151","2010","","Duke University Press","","USA","Engelsk","0","https://www.math.kyoto-u.ac.jp/journal/"
"484718","Mini-Reviews in Organic Chemistry","18-Aug-2023 13:56:25","Mini-Reviews in Organic Chemistry","1","1570-193X","1875-6298","","Kjemi og materialteknologi","Realfag og teknologi","","1","1","1","1","1","1","1","1","1","1","","","","","","","","","","","26744","2004","","Bentham Science Publishers","","Nederland","Engelsk","0","https://www.eurekaselect.com/node/622"
"484719","Patient","18-Aug-2023 13:56:25","Patient","1","1178-1653","1178-1661","","Sosialforskning","Samfunnsvitenskap","","1","1","1","1","1","1","1","1","1","1","","","","","","","","","","","","2008","","","Wolters Kluwer Health","New Zealand","Engelsk","0","http://link.springer.com/journal/40271"
"484720","Research Journal of Pharmaceutical, Biological and Chemical Sciences","08-Jun-2023 11:40:28","Research Journal of Pharmaceutical, Biological and Chemical Sciences","1","","0975-8585","","Farmasi, farmakologi og toksikologi","Medisin og helsefag","","0","0","0","0","0","1","1","1","1","1","","","","","","","","","","","","2010","","","B. M. Vrushabendra Swamy","India","Engelsk","0","http://www.rjpbcs.com/"
"484721","Research on Managing Groups and Teams","06-Jun-2023 12:22:29","Research on Managing Groups and Teams","1","1534-0856","","","Tverrfaglig samfunnsforskning","Samfunnsvitenskap","","1","1","1","1","1","1","1","1","1","1","","","","","","","","","","","17801","1998","","Emerald Group Publishing Limited","","USA","Engelsk","0","http://www.emeraldinsight.com/series/rmgt"
"484722","Revista Portuguesa de Estomatologia, Medicina Dentaria e Cirurgia Maxilofacial","18-Aug-2023 13:56:25","Revista Portuguesa de Estomatologia, Medicina Dentaria e Cirurgia Maxilofacial","1","1646-2890","1647-6700","DOAJ","Sosialforskning","Samfunnsvitenskap","","1","1","1","1","1","1","1","1","1","1","","","","","","","","","","","","1999","","","Carlos Gamito","Portugal","Portugisisk","0","http://www.journals.elsevier.com/revista-portuguesa-de-estomatologia-medicina-dentaria-e-cirugia-maxilofacial/"
"484723","Revue Francaise de Photogrammetrie et de Teledetection","18-Aug-2023 13:56:25","Revue Francaise de Photogrammetrie et de Teledetection","1","1768-9791","","DOAJ","Geografi","Samfunnsvitenskap","","1","1","1","1","1","1","1","1","1","1","","","","","","","","","","","","2004","","","Societe Francaise de Photogrammetrie et de Teledetection","Frankrike","Fransk","0","http://www.sfpt.fr/rfpt/index.php/RFPT/"
"484724","South African Journal of Geology","18-Aug-2023 13:56:25","South African Journal of Geology","1","1012-0750","1996-8590","","Geovitenskap","Realfag og teknologi","","1","1","1","1","1","1","1","1","1","1","","","","","","","","","","","","1984","","","Geological Society of South Africa","Sør-Afrika","Engelsk","0","http://sajg.geoscienceworld.org/"
"484725","Proceedings of the Participatory Design Conference (PDC)","08-Jun-2023 11:42:57","Proceedings of the Participatory Design Conference (PDC)","1","2150-5896","2150-590X","","IKT","Realfag og teknologi","","1","1","1","1","1","1","1","1","1","1","","","","","","","","","","","18077","1990","","Association for Computing Machinery (ACM)","Computer Professionals for Social Responsibility","USA","Engelsk","1","https://dl.acm.org/conference/pdc"
"484726","Studia Migracyjne - Przegląd Polonijny","08-Jun-2023 11:39:34","Migration Studies - Review of Polish Diaspora","1","2081-4488","","","Tverrfaglig samfunnsforskning","Samfunnsvitenskap","","1","1","1","1","1","1","1","1","1","1","","","","","","","","","","","","2009","","","Committee for Migration Studies of Polish Academy of Sciences","Polen","Polsk","0","http://www.kbnm.pan.pl/wydawnictwa/34-studia-migracyjne--przegld-polonijny-/spisy-treci/114-nr-1-2016"
"484727","Modern Approaches in Solid Earth Sciences","18-Aug-2023 13:56:25","Modern Approaches in Solid Earth Sciences","1","1876-1682","","","Geovitenskap","Realfag og teknologi","","1","1","1","1","1","1","1","1","1","1","","","","","","","","","","","22512","2008","","Springer","","Nederland","Engelsk","0","http://www.springer.com/series/7377"
"484728","Communications in Mathematics and Statistics","18-Aug-2023 13:56:25","Communications in Mathematics and Statistics","1","2194-6701","2194-671X","","Matematikk","Realfag og teknologi","","1","1","1","1","1","1","1","1","1","1","","","","","","","","","","","22512","2013","","Springer","","Tyskland","Engelsk","0","http://link.springer.com/journal/40304"
"484729","Frontiers in Veterinary Science","18-Aug-2023 13:56:25","Frontiers in Veterinary Science","1","","2297-1769","DOAJ","Veterinærmedisin","Medisin og helsefag","","1","1","1","1","1","1","1","1","1","1","","","","","","","","","","","26841","2014","","Frontiers Media S.A.","","Sveits","Engelsk","0","https://www.frontiersin.org/journals/veterinary-science"
"484730","Monografías sobre el Antiguo Cercano Oriente","08-Jun-2023 11:39:34","Ancient Near East Monographs","1","","1851-8761","","Tverrfaglig humanistisk forskning","Humaniora","","1","1","1","1","1","1","1","1","1","1","","","","","","","","","","","14962","","","Society of Biblical Literature (SBL) Press","","Argentina","Flerspråklig","0","http://www.sbl-site.org/publications/books_ANEmonographs.aspx"
"484731","Health Technology Assessment","18-Aug-2023 13:56:25","Health Technology Assessment","1","1366-5278","2046-4924","DOAJ","Sosialforskning","Samfunnsvitenskap","","1","1","1","1","1","1","1","1","1","1","","","","","","","","","","","","1997","","","National Institute for Health Research","Storbritannia","Engelsk","0","http://ushamp-build.squiz.co.uk/jl/hta"
"484732","Skiascope. Göteborgs konstmuseums skriftserie","15-Aug-2023 13:31:38","Skiascope: Gothenburg Museum of Art Publication Series","1","2001-872X","","","Kunsthistorie","Humaniora","0","1","1","1","1","1","1","1","1","1","1","","","","","","","","","","","","2009","","","Göteborgs konstmuseum","Sverige","Flerspråklig","0","http://konstmuseum.goteborg.se/wps/portal/konstm"
"484733","Mathematics and Visualization","18-Aug-2023 13:56:25","Mathematics and Visualization","1","1612-3786","2197-666X","","Matematikk","Realfag og teknologi","","1","1","1","1","1","1","1","1","1","1","","","","","","","","","","","22512","2001","","Springer","","Tyskland","Engelsk","0","http://link.springer.com/bookseries/4562"
"484734","Intelligent Systems Reference Library","18-Aug-2023 13:56:25","Intelligent Systems Reference Library","1","1868-4394","","","Tverrfaglig naturvitenskap og medisin","Realfag og teknologi","","1","1","1","1","1","1","1","1","1","1","","","","","","","","","","","22512","2009","","Springer","","Tyskland","Engelsk","0","http://www.springer.com/series/8578"
"484735","International Journal of Management, Economics and Social Sciences (IJMESS)","08-Jun-2023 11:40:28","International Journal of Management, Economics and Social Sciences (IJMESS)","1","","2304-1366","","Økonomisk-administrative fag","Samfunnsvitenskap","","1","1","1","1","1","0","0","0","","","","","","","","","","","","","","2012","","","IJMESS","USA","Engelsk","0","http://ijmess.com"
"484736","Przegląd Prawa Konstytucyjnego","06-Jun-2023 12:22:29","Constitutional Law Review","1","2082-1212","","","Rettsvitenskap","Samfunnsvitenskap","","1","1","1","1","","","","","","","","","","","","","","","","","20282","2010","","Wydawnictwu Adam Marszalek","","Polen","Polsk","0","https://marszalek.com.pl/przegladprawakonstytucyjnego/Autorzy.html"
"484737","Anglica - An International Journal of English Studies","18-Aug-2023 13:56:25","Anglica - An International Journal of English Studies","1","0860-5734","","DOAJ","Engelsk","Humaniora","","1","1","1","1","1","1","","","","","","","","","","","","","","","19013","1988","","University of Warsaw Press","","Polen","Engelsk","0","http://www.anglica.ia.uw.edu.pl"
"484738","Studia Ceranea. Journal of the Waldemar Ceran Research Centre for the History and Culture of the Mediterranean Area and South-East Europe","18-Aug-2023 13:56:25","Studia Ceranea. Journal of the Waldemar Ceran Research Centre for the History and Culture of the Mediterranean Area and South-East Europe","1","2084-140X","2449-8378","DOAJ","Historie og Idéhistorie","Humaniora","","1","1","1","1","","","","","","","","","","","","","","","","","","2011","","","Łódź University Press","Polen","Engelsk","0","https://czasopisma.uni.lodz.pl/sceranea/index"
"484745","Health Psychology Report","18-Aug-2023 13:56:25","Health Psychology Report","1","2353-4184","2353-5571","DOAJ","Psykologi","Medisin og helsefag","","1","1","1","1","1","1","1","1","1","","","","","","","","","","","","","2013","","","Termedia Publishing House","Polen","Engelsk","0","http://www.termedia.pl/Journal/Health_Psychology_Report-74"
"484746","Current Issues in Personality Psychology","18-Aug-2023 13:56:25","Current Issues in Personality Psychology","1","2353-4192","2353-561X","DOAJ","Psykologi","Medisin og helsefag","","1","1","1","1","1","1","","","","","","","","","","","","","","","24288","2013","","University of Gdansk Press","Termedia Publishing House","Polen","Engelsk","0","http://www.termedia.pl/Journal/Current_Issues_in_Personality_Psychology-75"
"484747","Prace Komisji Historii Nauki Polskiej Akademii Umiejętności","01-Jul-2017 14:05:22","The Proceedings of the PAU Commission on the History of Science","0","1731-6715","2392-1749","DOAJ","Historie og Idéhistorie","Humaniora","","","","","","","","","","1","","","","","","","","","","","","","1999","2016","","Polska Akademia Umiejetnosci (Polish Academy of Arts and Sciences)","Polen","Polsk","1","http://pau.krakow.pl/index.php/en/publications/scientific-journals/proceedings-of-the-pau-commission-on-the-history-of-science"
"484751","Bulletin of Geography. Socio-economic Series","18-Aug-2023 13:56:25","Bulletin of Geography. Socio-economic Series","1","1732-4254","2083-8298","","Tverrfaglig samfunnsforskning","Samfunnsvitenskap","","1","1","1","1","1","1","1","1","","","","","","","","","","","","","","2003","","","Sciendo","Polen","Engelsk","0","https://content.sciendo.com/view/journals/bog/bog-overview.xml"
"484758","Global Veterinaria","06-Jun-2023 12:22:29","Global Veterinaria","1","1992-6197","1999-8163","","Biovitenskap","Realfag og teknologi","","0","0","0","0","0","0","0","0","0","0","","","","","","","","","","","","2007","","","IDOSI Publications","Pakistan","Engelsk","0","http://www.idosi.org/gv/gv.htm"
"484759","Publication (Norsk forening for fjellsprengningsteknikk)","06-Jun-2023 12:22:29","Publication (Norsk forening for fjellsprengningsteknikk)","1","1893-4757","","","Tverrfaglig teknologi","Realfag og teknologi","","0","0","0","0","0","0","0","0","0","0","","","","","","","","","","","","","","","Norsk Forening for Fjellsprengningsteknikk - NFF","","Norsk (bokmål)","0","http://www.nff.no/"
"484760","Textes & Langues","06-Jun-2023 12:22:29","Textes & Langues","1","1763-1823","","","Romansk","Humaniora","","0","0","0","0","0","0","0","0","0","0","","","","","","","","","","","","2003","","","Presses universitaires de Lyon","Frankrike","Fransk","0","http://www.vjf.cnrs.fr/clt/"
"484762","Journal of Globalization Studies","18-Aug-2023 13:56:25","Journal of Globalization Studies","1","2075-8103","","","Tverrfaglig samfunnsforskning","Samfunnsvitenskap","","1","1","1","1","1","1","1","1","1","","","","","","","","","","","","","2010","","","Uchitel Publishing House","Russland","Engelsk","0","http://www.sociostudies.org/journal/jogs/"
