"Tidsskrift id","Original tittel","Sist endret","Internasjonal tittel","Aktiv","Print ISSN","Online ISSN","Open Access","NPI Fagfelt","NPI Fagområde","Nivå 2024","Nivå 2023","Nivå 2022","Nivå 2021","Nivå 2020","Nivå 2019","Nivå 2018","Nivå 2017","Nivå 2016","Nivå 2015","Nivå 2014","Nivå 2013","Nivå 2012","Nivå 2011","Nivå 2010","Nivå 2009","Nivå 2008","Nivå 2007","Nivå 2006","Nivå 2005","Nivå 2004","Forlag id","Etablert år","Nedlagt år","Forlag","Utgiver","Utgiverland","Språk","Konferanserapport","Url"
"493779","Budownictwo i Architektura","06-Jun-2023 12:22:29","Civil Engineering and Architecture","1","1899-0665","2544-3275","DOAJ","Konstruksjonsfag","Realfag og teknologi","","1","1","1","1","","","","","","","","","","","","","","","","","","2007","","","Lublin University of Technology","Polen","Flerspråklig","0","https://ph.pollub.pl/index.php/bia/index"
"493793","International Journal of Advances in Management and Economics","08-Jun-2023 11:40:28","International Journal of Advances in Management and Economics","1","","2278-3369","","Samfunnsøkonomi","Samfunnsvitenskap","","0","0","0","0","0","0","","","","","","","","","","","","","","","","2012","","","Kiban Research Publications","India","Engelsk","0","http://managementjournal.info/index.php/IJAME"
"493806","Alkalmazott Műszaki és Pedagógiai tudományos folyóirat","06-Jun-2023 12:17:35","Journal of Applied Technical and Educational Sciences (jATES)","1","","2560-5429","","IKT","Realfag og teknologi","","1","1","1","1","1","","","","","","","","","","","","","","","","","2017","","","ST Press (Subotica Tech)","Serbia","Flerspråklig","0","https://jates.org/index.php/jatespath"
"493807","Emotions: History, Culture, Society (EHCS)","18-Aug-2023 13:56:25","Emotions: History, Culture, Society (EHCS)","1","2206-7485","2208-522X","","Historie og Idéhistorie","Humaniora","","1","1","1","","","","","","","","","","","","","","","","","","18109","2017","","Brill Academic Publishers","Society for the History of Emotions","Australia","Engelsk","0","https://brill.com/view/journals/ehcs/ehcs-overview.xml"
"493809","Folia Iuridica Universitatis Wratislaviensis","06-Jun-2023 12:22:29","Folia Iuridica Universitatis Wratislaviensis","1","","2450-3932","","Rettsvitenskap","Samfunnsvitenskap","","1","1","1","","","","","","","","","","","","","","","","","","","2015","","","Uniwersytet Wrocławski","Polen","Polsk","0","https://fiw.prawo.uni.wroc.pl/index.php/pl/"
"493811","RChD: Creación y Pensamiento","08-Jun-2023 11:39:34","RChD: Creación y Pensamiento","1","0719-8426","0719-837X","DOAJ","Arkitektur og design","Humaniora","","1","1","1","1","1","","","","","","","","","","","","","","","","","2016","","","Universidad de Chile","Chile","Spansk","0","https://rchd.uchile.cl/"
"493813","Journal of Pedagogical Research","18-Aug-2023 13:56:25","Journal of Pedagogical Research","1","","2602-3717","DOAJ","Pedagogikk og utdanning","Samfunnsvitenskap","","1","1","1","1","","","","","","","","","","","","","","","","","","2017","","","Sahin Danisman","Tyrkia","Engelsk","0","https://www.ijopr.com/"
"493814","Türk Bilgisayar ve Matematik Eğitimi Dergisi (TÜRKBİLMAT)","06-Jun-2023 12:22:29","Turkish Journal of Computer and Mathematics Education (TURCOMAT)","1","","1309-4653","","Matematikk","Realfag og teknologi","","0","0","1","1","1","","","","","","","","","","","","","","","","","2009","","","KaradenizTeknik Üniversitesi Uzaktan Egitimi Merkezi","Tyrkia","Engelsk","0","https://www.turcomat.org/index.php/turkbilmat"
"493821","Journal of Cyberspace Studies","08-Jun-2023 11:40:28","Journal of Cyberspace Studies","1","2588-5499","2588-5502","DOAJ","Tverrfaglig teknologi","Realfag og teknologi","","0","0","0","0","0","0","","","","","","","","","","","","","","","","2018","","","University of Tehran","Iran","Engelsk","0","https://jcss.ut.ac.ir/"
"493829","Психолінгвістика. Психолингвистика","18-Aug-2023 13:56:25","Psycholinguistics","1","2309-1797","2415-3397","DOAJ","Psykologi","Medisin og helsefag","","1","1","1","1","1","1","","","","","","","","","","","","","","","","2008","","","Pereiaslav-Khmelnytskyi Hryhorii Skovoroda State Pedagogical University","Ukraina","Engelsk","0","https://psycholing-journal.com/index.php/journal"
"493833","Revista do prosesso comparada","06-Jun-2023 12:22:29","Journal of Comparative Procedural Law","1","2358-7164","","","Rettsvitenskap","Samfunnsvitenskap","","0","0","0","0","0","0","","","","","","","","","","","","","","","","2014","","","Thomson Reuters","Brasil","Portugisisk","0","http://revistadeprocessocomparado.com.br/en/rpc/"
"493839","European Journal of Educational & Social Sciences","06-Jun-2023 12:22:29","European Journal of Educational & Social Sciences","1","","2564-6621","","Pedagogikk og utdanning","Samfunnsvitenskap","","0","0","0","0","","","","","","","","","","","","","","","","","","2016","","","Ali Korkut","Tyrkia","Flerspråklig","0","https://dergipark.org.tr/tr/pub/ejees"
"493846","Didacticae: Revista de Investigación en Didácticas Específicas","08-Jun-2023 11:40:28","Didacticae: Journal of Research in Specific Didactics","1","","2462-2737","DOAJ","Pedagogikk og utdanning","Samfunnsvitenskap","","1","1","1","","","","","","","","","","","","","","","","","","","2017","","","Facultat d'Educació Universitat de Barcelona","Spania","Flerspråklig","0","https://revistes.ub.edu/index.php/didacticae/"
"493855","Ciudades","18-Aug-2023 13:56:25","Ciudades","1","1133-6579","2445-3943","DOAJ","Arkitektur og design","Humaniora","","1","1","1","1","1","1","","","","","","","","","","","","","","","","1993","","","Instituto Universitario de Urbanística (Universidad de Valladolid)","Spania","Spansk","0","https://iuu.uva.es/journal/about/"
"493860","Digital Studies (DSCN)","18-Aug-2023 13:56:25","Le champ numérique (DSCN)","1","","1918-3666","DOAJ","Tverrfaglig humanistisk forskning","Humaniora","","1","1","1","1","1","1","","","","","","","","","","","","","","","","2009","","","Open Library of Humanities","Canada","Engelsk","0","https://www.digitalstudies.org"
"493861","Proceedings of the European Conference on Management, Leadership and Governance (ECMLG)","08-Jun-2023 11:40:28","Proceedings of the European Conference on Management, Leadership and Governance (ECMLG)","1","2048-9021","2048-903X","","Økonomisk-administrative fag","Samfunnsvitenskap","","1","1","1","1","1","1","","","","","","","","","","","","","","","","","","","Reading: Academic Publishing","Storbritannia","Engelsk","1","http://www.academic-conferences.org/conferences/ecmlg/"
"493862","Zoosystematica Rossica","18-Aug-2023 13:56:25","Zoosystematica Rossica","1","0320-9180","2410-0226","","Biovitenskap","Realfag og teknologi","","1","1","1","1","1","1","","","","","","","","","","","","","","","","1993","","","Zoological Institute, Russian Academy of Sciences, St Petersburg","Russland","Engelsk","0","http://www.zin.ru/journals/zsr/"
"493863","Journal of gender, agriculture and food security","06-Jun-2023 12:22:29","Journal of gender, agriculture and food security","1","","2413-922X","","Tverrfaglig samfunnsforskning","Samfunnsvitenskap","","0","0","0","0","0","0","","","","","","","","","","","","","","","","","","","Africa Centre for Gender, Social Research and Impact Assessment","","","0","http://agrigender.net/"
"493864","Marŭk'ŭsŭchuŭi yŏn'gu","06-Jun-2023 12:17:35","Marxism 21","1","1738-2998","","","Historie og Idéhistorie","Humaniora","","1","1","1","1","1","1","","","","","","","","","","","","","","","","2004","","","National Gyeongsang University, South Korea","Sør-Korea","Flerspråklig","0","http://marxism21e.gnu.ac.kr/issmarx-e/sub.do?mCode=MN0007"
"493865","Territorio Italia - Land Administration, Cadastre, Real Estate","06-Jun-2023 12:22:29","Territorio Italia - Land Administration, Cadastre, Real Estate","1","2240-7707","2499-2674","DOAJ","Tverrfaglig teknologi","Realfag og teknologi","","0","0","0","0","0","0","","","","","","","","","","","","","","","","2011","","","Ministero dell'Economia e delle Finanze * Agenzia delle Entrate","Italia","Italiensk","0","http://www.agenziaentrate.gov.it/wps/content/Nsilib/Nsi/Agenzia/Agenzia+comunica/Prodotti+editoriali/Pubblicazioni+cartografia_catasto_mercato_immobiliare/Territorio_Italia"
"493866","Continental Thought & Theory: A Journal of Intellectual Freedom (CT&T)","06-Jun-2023 12:22:29","Continental Thought & Theory: A Journal of Intellectual Freedom (CT&T)","1","","2463-333X","DOAJ","Tverrfaglig humanistisk forskning","Humaniora","","1","1","1","1","0","0","","","","","","","","","","","","","","","","2016","","","University of Canterbury, New Zealand","New Zealand","Engelsk","0","http://ctt.canterbury.ac.nz/"
"493867","Journal of Religion & Spirituality in Social Work: Social Thought","18-Aug-2023 13:56:25","Journal of Religion & Spirituality in Social Work: Social Thought","1","1542-6432","1542-6440","","Sosialforskning","Samfunnsvitenskap","","1","1","1","1","1","1","","","","","","","","","","","","","","","18442","2003","","Taylor & Francis","","USA","Engelsk","0","https://www.tandfonline.com/action/journalInformation?journalCode=wrsp20"
"493868","Plasma","08-Jun-2023 11:39:34","Plasma","1","","2571-6182","DOAJ","Fysikk","Realfag og teknologi","","1","1","1","1","1","1","","","","","","","","","","","","","","","26778","2017","","MDPI","","Sveits","Engelsk","0","http://www.mdpi.com/journal/plasma"
"493869","Amodern","06-Jun-2023 12:22:29","Amodern","1","","2371-5286","","Tverrfaglig humanistisk forskning","Humaniora","","1","1","1","1","1","1","","","","","","","","","","","","","","","","2013","","","Concordia University and Lakehead University","Canada","Engelsk","0","http://amodern.net"
"493870","INTERSECTIONALITIES: A GLOBAL JOURNAL OF SOCIAL WORK ANALYSIS, RESEARCH, POLITY, AND PRACTICE","15-Aug-2023 13:31:38","INTERSECTIONALITIES: A GLOBAL JOURNAL OF SOCIAL WORK ANALYSIS, RESEARCH, POLITY, AND PRACTICE","1","","1925-1270","","Sosialforskning","Samfunnsvitenskap","0","1","1","1","1","1","1","","","","","","","","","","","","","","","","2012","","","","Canada","Engelsk","0","http://journals.library.mun.ca/ojs/index.php/IJ/index"
"493871","IEEE International Conference on Biometrics, Theory, Applications and Systems","06-Jun-2023 12:22:29","IEEE International Conference on Biometrics, Theory, Applications and Systems","1","2474-9680","2474-9699","","IKT","Realfag og teknologi","","0","0","0","0","0","0","","","","","","","","","","","","","","","18231","2007","","IEEE (Institute of Electrical and Electronics Engineers)","","USA","Engelsk","1","http://ieeexplore.ieee.org/xpl/conhome.jsp?punumber=1001496"
"493872","Slavica Revalensia","06-Jun-2023 12:22:29","Slavica Revalensia","1","2346-5824","2504-7531","","Slavisk-baltisk","Humaniora","","0","0","0","0","0","0","","","","","","","","","","","","","","","","2014","","","Tallinna Ülikooli Kirjastus","Estland","Russisk","0","http://publications.tlu.ee/index.php/slavica/"
"493873","Drones","18-Aug-2023 13:56:25","Drones","1","","2504-446X","DOAJ","Tverrfaglig teknologi","Realfag og teknologi","","1","1","1","1","1","1","","","","","","","","","","","","","","","26778","2017","","MDPI","","Sveits","Engelsk","0","http://www.mdpi.com/journal/drones/about"
"493874","Murmurations: Journal of Transformative Systemic Practice","06-Jun-2023 12:22:29","Murmurations: Journal of Transformative Systemic Practice","1","","2516-0052","DOAJ","Psykologi","Medisin og helsefag","","1","1","1","1","0","0","","","","","","","","","","","","","","","","2017","","","Everything is Connected Press","Storbritannia","Engelsk","0","http://murmurations.cloud/ojs/index.php/murmurations"
"493875","Evolutionary Psychological Science","18-Aug-2023 13:56:25","Evolutionary Psychological Science","1","","2198-9885","","Psykologi","Medisin og helsefag","","1","1","1","1","1","1","","","","","","","","","","","","","","","22512","2015","","Springer","","Tyskland","Engelsk","0","https://www.springer.com/journal/40806"
"493877","Animal Technology and Welfare","18-Aug-2023 13:56:25","Animal Technology and Welfare","1","1742-0385","","","Veterinærmedisin","Medisin og helsefag","","1","1","1","1","1","1","","","","","","","","","","","","","","","","2002","","","Institute of Animal Technology of Great Britain","Storbritannia","Engelsk","0","http://www.iat.org.uk"
"493878","Asian Pacific Journal of Reproduction","18-Aug-2023 13:56:25","Asian Pacific Journal of Reproduction","1","2305-0500","","DOAJ","Biovitenskap","Realfag og teknologi","","1","1","1","1","1","1","","","","","","","","","","","","","","","15103","2012","","Wolters Kluwer","","","Engelsk","0","http://www.apjr.net"
"493880","International Journal of Health Sciences (IJHS)","08-Jun-2023 11:39:34","International Journal of Health Sciences (IJHS)","1","1658-3639","1658-7774","DOAJ","Biomedisin","Medisin og helsefag","","1","1","1","1","1","1","","","","","","","","","","","","","","","","2007","","","Qassim University","Saudi-Arabia","Engelsk","0","https://ijhs.org.sa"
"493881","ДУХОВНІСТЬ ОСОБИСТОСТІ:методологія, теорія і практика","06-Jun-2023 12:22:29","SPIRITUALITY OF A PERSONALITY:Methodology, Theory and Practice","1","2220-6310","","","Teatervitenskap og drama","Humaniora","","0","0","0","0","0","0","","","","","","","","","","","","","","","","2004","","","","","Engelsk","0","http://domtp.turion.info/"
"493882","Fisheries and Aquatic Sciences (FAS)","18-Aug-2023 13:56:25","Fisheries and Aquatic Sciences (FAS)","1","2234-1749","2234-1757","DOAJ","Biovitenskap","Realfag og teknologi","","1","1","1","1","1","1","","","","","","","","","","","","","","","","2009","","","Korean Society of Fisheries and Aquatic Sciences","Storbritannia, Sør-Korea","Engelsk","0","https://www.e-fas.org/"
"493883","Gruppe. Interaktion. Organisation. Zeitschrift fur Angewandte Organisationspsychologie (GIO)","18-Aug-2023 13:56:25","Gruppe. Interaktion. Organisation. Zeitschrift fur Angewandte Organisationspsychologie (GIO)","1","2366-6145","2366-6218","","Psykologi","Medisin og helsefag","","1","1","1","1","1","1","","","","","","","","","","","","","","","22512","2016","","Springer","","Sveits, Tyskland","Flerspråklig","0","https://www.springer.com/journal/11612"
"493884","Science and Engineering of Composite Materials","18-Aug-2023 13:56:25","Science and Engineering of Composite Materials","1","0792-1233","2191-0359","DOAJ","Kjemi og materialteknologi","Realfag og teknologi","","1","1","1","1","1","1","","","","","","","","","","","","","","","18493","1988","","Walter de Gruyter (De Gruyter)","","Tyskland","Engelsk","0","http://www.degruyter.com/view/j/secm"
"493885","Journal of Building Engineering","18-Aug-2023 13:56:25","Journal of Building Engineering","1","2352-7102","","","Konstruksjonsfag","Realfag og teknologi","","1","1","1","1","1","1","","","","","","","","","","","","","","","18173","2015","","Elsevier","","Storbritannia","Engelsk","0","https://www.sciencedirect.com/journal/journal-of-building-engineering"
"493886","Journal of Radiology Case Reports","18-Aug-2023 13:56:25","Journal of Radiology Case Reports","1","1943-0922","","DOAJ","Radiologi og billeddiagnostikk","Medisin og helsefag","","1","1","1","1","1","1","","","","","","","","","","","","","","","","2007","","","","USA","Engelsk","0","http://www.radiologycases.com/index.php/radiologycases"
"493887","Journal of Traditional and Complementary Medicine","18-Aug-2023 13:56:25","Journal of Traditional and Complementary Medicine","1","2225-4110","","DOAJ","Generell medisin","Medisin og helsefag","","1","1","1","1","1","1","","","","","","","","","","","","","","","18173","2011","","Elsevier","","Taiwan","Engelsk","0","http://www.journals.elsevier.com/journal-of-traditional-and-complementary-medicine/"
"493888","Leukemia Research Reports","18-Aug-2023 13:56:25","Leukemia Research Reports","1","2213-0489","","DOAJ","Onkologi","Medisin og helsefag","","1","1","1","1","1","1","","","","","","","","","","","","","","","18173","2012","","Elsevier","","Nederland","Engelsk","0","http://www.elsevier.com/"
"493889","Medicina Paliativa","18-Aug-2023 13:56:25","Medicina Paliativa","1","1134-248X","","","Farmasi, farmakologi og toksikologi","Medisin og helsefag","","1","1","1","1","1","1","","","","","","","","","","","","","","","18173","1994","","Elsevier","","Spania","Engelsk","0","http://www.journals.elsevier.com/medicina-paliativa/"
"493890","Schweizer Archiv fur Neurologie und Psychiatrie","19-Aug-2019 16:03:48","Schweizer Archiv fur Neurologie und Psychiatrie","0","0258-7661","","DOAJ","Nevrologi","Medisin og helsefag","","","","","","","","","","","","","","","","","","","","","","","1985","2015","","","Sveits","Engelsk","0","http://www.sanp.ch"
"493891","Science Bulletin","18-Aug-2023 13:56:25","Science Bulletin","1","2095-9273","","","Tverrfaglig naturvitenskap og medisin","Realfag og teknologi","","1","1","1","1","1","1","","","","","","","","","","","","","","","","2015","","","","Kina","Engelsk","0","http://www.sciencedirect.com/science/journal/20959273"
"493892","Slovak Raptor Journal","06-Jun-2023 12:22:29","Slovak Raptor Journal","1","1337-3463","","","Biovitenskap","Realfag og teknologi","","1","1","1","1","1","1","","","","","","","","","","","","","","","","2007","","","Ochrana Dravcov na Slovensku","Slovakia","Engelsk","0","http://www.dravce.sk/web/index.php?option=com_content&view=article&id=661&Itemid=142&lang=sk"
"493893","Tijdschrift voor Bedrijfs- en Verzekeringsgeneeskunde","18-Aug-2023 13:56:25","Tijdschrift voor Bedrijfs- en Verzekeringsgeneeskunde","1","0929-600X","","","Generell medisin","Medisin og helsefag","","0","0","0","0","0","0","","","","","","","","","","","","","","","","1993","","","","Nederland","Engelsk","0","http://www.bsl.nl/"
"493894","Annals of Occupational and Environmental Medicine (AOEM)","18-Aug-2023 13:56:25","Annals of Occupational and Environmental Medicine (AOEM)","1","","2052-4374","DOAJ","Samfunnsmedisin","Medisin og helsefag","","1","1","1","1","1","1","","","","","","","","","","","","","","","16994","2013","","BioMed Central (BMC)","Kamje Press/xmlink","Storbritannia","Engelsk","0","https://aoemj.org/"
"493895","Contributions of the Astronomical Observatory Skalnate Pleso","18-Aug-2023 13:56:25","Contributions of the Astronomical Observatory Skalnate Pleso","1","1335-1842","","","Geovitenskap","Realfag og teknologi","","1","1","1","1","1","1","","","","","","","","","","","","","","","","1990","","","","Slovakia","Engelsk","0","http://www.ta3.sk/caosp/index.html"
"493896","Endoscopic Ultrasound","18-Aug-2023 13:56:25","Endoscopic Ultrasound","1","2303-9027","","","Radiologi og billeddiagnostikk","Medisin og helsefag","","1","1","1","1","1","1","","","","","","","","","","","","","","","","2012","","","Spring International S & T Publishing Media Co.","Kina","Engelsk","0","http://www.eusjournal.com/"
"493897","Environment and Planning C: Politics and Space","18-Aug-2023 13:56:25","Environment and Planning C: Politics and Space","1","2399-6544","2399-6552","","Geografi","Samfunnsvitenskap","","1","1","1","1","1","1","","","","","","","","","","","","","","","18411","2017","","Sage Publications","","Storbritannia","Engelsk","0","http://journals.sagepub.com/home/epc"
"493898","European Journal of Radiology Open (EJR Open)","18-Aug-2023 13:56:25","European Journal of Radiology Open (EJR Open)","1","","2352-0477","DOAJ","Radiologi og billeddiagnostikk","Medisin og helsefag","","1","1","1","1","1","1","","","","","","","","","","","","","","","18173","2014","","Elsevier","","Storbritannia","Engelsk","0","https://www.sciencedirect.com/journal/european-journal-of-radiology-open"
"493899","Papers in Language Testing and Assessment (PLTA)","06-Jun-2023 12:22:29","Papers in Language Testing and Assessment (PLTA)","0","","2201-0009","","Lingvistikk","Humaniora","","","1","1","1","1","1","","","","","","","","","","","","","","","","2012","2022","","Association for Language Testing and Assessment of Australia and New Zealand","Australia","Engelsk","0","https://www.altaanz.org/about-sila.html"
"493900","IEEE Transactions on Computational Social Systems","18-Aug-2023 13:56:25","IEEE Transactions on Computational Social Systems","1","","2329-924X","","IKT","Realfag og teknologi","","1","1","1","1","1","0","","","","","","","","","","","","","","","18231","2014","","IEEE (Institute of Electrical and Electronics Engineers)","","USA","Engelsk","0","http://ieeexplore.ieee.org/xpl/aboutJournal.jsp?punumber=6570650"
"493901","TEM JOURNAL - Technology, Education, Management, Informatics","18-Aug-2023 13:56:25","TEM JOURNAL - Technology, Education, Management, Informatics","1","2217-8309","2217-8333","DOAJ","IKT","Realfag og teknologi","","1","1","1","1","","","","","","","","","","","","","","","","","","2012","","","TEM JOURNAL","Serbia","Engelsk","0","http://www.temjournal.com"
"493903","Modern China Studies","15-Aug-2023 13:31:38","Modern China Studies","1","2160-0295","2160-0317","","Statsvitenskap","Samfunnsvitenskap","0","1","1","1","1","1","1","","","","","","","","","","","","","","","","1994","","","National Sun Yat-sen University","USA","Kinesisk","0","http://www.modernchinastudies.org/"
"493904","Journal for Advancement of Marketing Education","18-Aug-2023 13:56:25","Journal for Advancement of Marketing Education","1","2326-3296","1537-5137","","Økonomisk-administrative fag","Samfunnsvitenskap","","1","1","1","1","1","1","","","","","","","","","","","","","","","","2001","","","Marketing Management Association","USA","Engelsk","0","http://www.mmaglobal.org/publications/jame/jame-submission-guidelines/"
"493905","Journal of Legal Anthropology","08-Jun-2023 11:42:57","Journal of Legal Anthropology","1","1758-9576","1758-9584","DOAJ","Sosialantropologi","Samfunnsvitenskap","","1","1","1","1","1","1","","","","","","","","","","","","","","","18089","2008","","Berghahn Books","","USA","Engelsk","0","http://www.berghahnjournals.com/jla"
"493906","El Boletín Chileno de Herpetología","06-Jun-2023 12:22:29","The Chilean Herpetology Bulletin","1","0719-6172","","","Biovitenskap","Realfag og teknologi","","1","1","1","1","1","1","","","","","","","","","","","","","","","","2014","","","","Chile","Spansk","0","http://www.boletindeherpetologia.com"
"493910","American Journal of Physiology - Renal Physiology (AJP)","18-Aug-2023 13:56:25","American Journal of Physiology - Renal Physiology","1","1931-857X","1522-1466","","Nefrologi","Medisin og helsefag","","1","1","1","2","2","2","2","2","2","2","2","2","2","2","2","2","2","2","2","","","1997","","","American Physiological Society","USA","Engelsk","0","https://www.physiology.org/ajprenal/about"
"493911","Youth & Policy","06-Jun-2023 12:22:29","Youth & Policy","1","","2057-4266","","Sosialforskning","Samfunnsvitenskap","","0","0","0","0","0","0","","","","","","","","","","","","","","","","2010","","","Youth & Policy","Storbritannia","Engelsk","0","http://www.youthandpolicy.org"
"493912","Journal of Alcoholism & Drug Dependence","08-Jun-2023 11:40:28","Journal of Alcoholism & Drug Dependence","1","","2329-6488","","Sosialforskning","Samfunnsvitenskap","","0","0","0","0","0","0","","","","","","","","","","","","","","","","2013","","","OMICS International","USA","Engelsk","0","https://www.omicsonline.org/alcoholism-and-drug-dependence.php"
"493913","Research Papers in Language Teaching and Learning","08-Jun-2023 11:40:28","Research Ppaers in Language Teaching and Learning","1","1792-1244","","DOAJ","Lingvistikk","Humaniora","","1","1","1","1","1","1","","","","","","","","","","","","","","","","2010","","","Hellenic Open University, School of Humanities","Hellas","Flerspråklig","0","http://rpltl.eap.gr"
"493914","International Journal of E-Entrepreneurship and Innovation (IJEEI)","18-Aug-2023 13:56:25","International Journal of E-Entrepreneurship and Innovation (IJEEI)","1","1947-8585","1947-8593","","Tverrfaglig samfunnsforskning","Samfunnsvitenskap","","1","1","1","1","1","1","","","","","","","","","","","","","","","","2009","","","IGI Global","USA","Engelsk","0","https://www.igi-global.com/journal/international-journal-entrepreneurship-innovation/1130"
"493915","Children","24-Aug-2023 13:59:59","Children","1","","2227-9067","DOAJ","Pediatri","Medisin og helsefag","","1","1","1","1","1","1","","","","","","","","","","","","","","","26778","2014","","MDPI","","Sveits","Engelsk","0","https://www.mdpi.com/journal/children"
"493916","Research Notes","06-Jun-2023 12:22:29","Research Notes","1","1756-509X","","","Lingvistikk","Humaniora","","0","0","0","0","0","0","","","","","","","","","","","","","","","","","","","Cambridge Assessment English","Storbritannia","Engelsk","0","http://www.cambridgeenglish.org/researchnotes"
"493917","History of Humanities","18-Aug-2023 13:56:25","History of Humanities","1","2379-3163","2379-3171","","Historie og Idéhistorie","Humaniora","","1","1","1","1","1","1","","","","","","","","","","","","","","","18459","2016","","University of Chicago Press","","USA","Engelsk","0","https://www.journals.uchicago.edu/toc/hoh/current"
"493918","New Americanists in Poland","15-Aug-2023 13:31:38","New Americanists in Poland","1","2191-2254","","","Engelsk","Humaniora","0","1","1","1","1","1","1","","","","","","","","","","","","","","","","2011","","","Peter Lang","Tyskland","Engelsk","0","https://www.peterlang.com/view/serial/NAMP"
"493919","Российский электронный научный журнал","06-Jun-2023 12:22:29","Russian electronic scientific journal","1","","2308-9644","","Samfunnsøkonomi","Samfunnsvitenskap","","0","0","0","0","0","0","","","","","","","","","","","","","","","","2013","","","Bashkir State Agrarian University","Russland","Russisk","0","http://journal.bsau.ru/"
