"Tidsskrift id","Original tittel","Sist endret","Internasjonal tittel","Aktiv","Print ISSN","Online ISSN","Open Access","NPI Fagfelt","NPI Fagområde","Nivå 2024","Nivå 2023","Nivå 2022","Nivå 2021","Nivå 2020","Nivå 2019","Nivå 2018","Nivå 2017","Nivå 2016","Nivå 2015","Nivå 2014","Nivå 2013","Nivå 2012","Nivå 2011","Nivå 2010","Nivå 2009","Nivå 2008","Nivå 2007","Nivå 2006","Nivå 2005","Nivå 2004","Forlag id","Etablert år","Nedlagt år","Forlag","Utgiver","Utgiverland","Språk","Konferanserapport","Url"
"483923","Journal of Economic Development, Environment and People","06-Jun-2023 12:22:29","Journal of Economic Development, Environment and People","1","","2285-3642","DOAJ","Samfunnsøkonomi","Samfunnsvitenskap","","1","1","1","1","1","1","1","1","","","","","","","","","","","","","","2012","","","Editura Fundatiei Romania de Maine","Romania","Engelsk","0","http://ojs.spiruharet.ro/index.php/jedep/issue/archive"
"483926","Espacio, Tiempo y Educación","18-Aug-2023 13:56:25","Espacio, Tiempo y Educación","1","","2340-7263","DOAJ","Historie og Idéhistorie","Humaniora","","1","1","1","1","1","1","1","","","","","","","","","","","","","","","2013","","","FahrenHouse","Spania","Flerspråklig","0","http://www.espaciotiempoyeducacion.com/ojs/index.php/ete"
"483939","Journal of the British Archaeological Association","18-Aug-2023 13:56:25","Journal of the British Archaeological Association","1","0068-1288","1747-6704","","Arkeologi og konservering","Humaniora","","1","1","1","1","1","1","1","1","1","","","","","","","","","","","","18442","1845","","Taylor & Francis","","Storbritannia","Engelsk","0","http://www.tandfonline.com/toc/yjba20/current"
"483943","Jahrbuch der Raabe-Gesellschaft","08-Jun-2023 11:42:57","The Raabe Society Yearbook","1","0075-2371","1865-8857","","Litteraturvitenskap","Humaniora","","0","0","0","0","0","0","0","","","","","","","","","","","","","","18493","1960","","Walter de Gruyter (De Gruyter)","","Tyskland","Tysk","0","https://www.degruyter.com/view/j/jdrg"
"483961","Kościół i Prawo","06-Jun-2023 12:22:29","Kościół i Prawo","1","0208-7928","2544-5804","DOAJ","Rettsvitenskap","Samfunnsvitenskap","","1","1","1","1","1","1","","","","","","","","","","","","","","","","1981","","","Towarzystwo Naukowe Katolickiego Uniwersytetu Lubelskiego: Katolicki Uniwersytet Lubelski. Katedra Ko?cielnego Prawa Publicznego i Konstytucyjnego","Polen","Flerspråklig","0","http://czasopisma.tnkul.pl/index.php/kip/index"
"483966","Lletres Asturianes","08-Jun-2023 11:39:34","Asturian Letters","1","0212-0534","2174-9612","","Romansk","Humaniora","","1","1","1","1","1","","","","","","","","","","","","","","","","","1982","","","Academia de la Llingua Asturiana","Spania","Flerspråklig","0","http://www.academiadelallingua.com/lletresasturianes"
"483971","Psychoterapia","18-Aug-2023 13:56:25","Psychoterapia","1","0239-4170","2391-5862","","Psykiatri","Medisin og helsefag","","1","1","1","1","1","","","","","","","","","","","","","","","","","1973","","","Polskie Towarzystwo Psychiatryczne","Polen","Flerspråklig","0","http://www.psychoterapiaptp.pl/"
"483978","Buddhist Studies Review","18-Aug-2023 13:56:25","Buddhist Studies Review","1","0265-2897","1747-9681","","Teologi og religionsvitenskap","Humaniora","","1","1","1","1","1","1","1","1","","","","","","","","","","","","","18177","1984","","Equinox Publishing","","Storbritannia","Engelsk","0","http://equinoxpub.com/journals/index.php/BSR"
"483979","Northern Scotland","18-Aug-2023 13:56:25","Northern Scotland","1","0306-5278","2042-2717","","Historie og Idéhistorie","Humaniora","","1","1","1","1","1","","","","","","","","","","","","","","","","18159","1972","","Edinburgh University Press","","Storbritannia","Engelsk","0","https://www.euppublishing.com/loi/nor"
"483985","Bibliothek Forschung und Praxis","08-Jun-2023 11:42:57","Bibliothek Forschung und Praxis","1","0341-4183","1865-7648","","Biblioteks- og informasjonsvitenskap","Samfunnsvitenskap","","1","1","1","1","1","1","","","","","","","","","","","","","","","18493","1977","","Walter de Gruyter (De Gruyter)","","Tyskland","Flerspråklig","0","http://www.degruyter.com/view/j/bfup"
"483989","Geografski Vestnik","18-Aug-2023 13:56:25","Geographical Bulletin","1","0350-3895","1580-335X","","Geografi","Samfunnsvitenskap","","1","1","1","1","1","","","","","","","","","","","","","","","","","1924","","","Zveza Geografskih Drustev Slovenije","Slovenia","Slovensk","0","https://ojs.zrc-sazu.si/gv/index"
"483991","Časopis za kritiko znanosti","08-Jun-2023 11:40:28","Journal for the Critique of Science, Imagination, and New Anthropology","1","0351-4285","","","Tverrfaglig humanistisk forskning","Humaniora","","0","0","0","0","0","","","","","","","","","","","","","","","","","1978","","","Študentska organizacija Univerze v Ljubljani","Slovenia","Slovensk","0","http://www.ckz.si/en/"
"483993","Urbani Izziv","18-Aug-2023 13:56:25","Urbani Izziv","1","0353-6483","1855-8399","DOAJ","Geografi","Samfunnsvitenskap","","1","1","1","1","1","1","1","1","","","","","","","","","","","","","","1989","","","Urban Planning Institute of the Republic of Slovenia","Slovenia","Flerspråklig","0","http://urbani-izziv.uirs.si/en/Urbaniizziv.aspx"
"483998","Religious Studies and Theology","18-Aug-2023 13:56:25","Religious Studies and Theology","1","0829-2922","1747-5414","","Teologi og religionsvitenskap","Humaniora","","1","1","1","1","1","1","1","1","","","","","","","","","","","","","18177","1985","","Equinox Publishing","","Storbritannia","Engelsk","0","http://equinoxpub.com/journals/index.php/RSTNULL"
"484000","Acta Asiatica Varsoviensia","18-Aug-2023 13:56:25","Acta Asiatica Varsoviensia","1","0860-6102","2449-8653","DOAJ","Historie og Idéhistorie","Humaniora","","1","1","1","1","1","1","1","1","","","","","","","","","","","","","","1988","","","Polska Akademia Nauk. Instytut Kultur Srodziemnomorskich i Orientalnych","Polen","Engelsk","0","http://www.iksio.pan.pl/index.php?option=com_content&view=category&id=40&Itemid=57&lang=en"
"484003","Forum Oświatowe","06-Jun-2023 12:17:35","Educational Forum","1","0867-0323","2450-3452","DOAJ","Pedagogikk og utdanning","Samfunnsvitenskap","","1","1","1","1","","","","","","","","","","","","","","","","","","1989","","","Polish Pedagogical Society; University of Lower Silesia","Polen","Flerspråklig","0","https://forumoswiatowe.pl/index.php/czasopismo"
"484009","Estudos do Quaternário","18-Aug-2023 13:56:25","Quaternary Studies","1","0874-0801","2182-8660","","Arkeologi og konservering","Humaniora","","1","1","1","1","1","1","1","1","","","","","","","","","","","","","","1997","","","Associacao Portuguesa para o Estudo do Quaternario","Portugal","Flerspråklig","0","http://www.apeq.pt/ojs/index.php/apeq/index"
"484014","Das Mittelalter: Perspektiven mediävistischer Forschung","08-Jun-2023 11:39:34","Das Mittelalter: Perspektiven mediävistischer Forschung","1","0949-0345","2196-6869","","Historie og Idéhistorie","Humaniora","","1","1","1","1","1","1","1","1","","","","","","","","","","","","","18493","1996","","Walter de Gruyter (De Gruyter)","","Tyskland","Flerspråklig","0","http://www.mediaevistenverband.de/veroffentlichungen/zeitschrift/"
"484015","Scottish Affairs","18-Aug-2023 13:56:25","Scottish Affairs","1","0966-0356","2053-888X","","Tverrfaglig samfunnsforskning","Samfunnsvitenskap","","1","1","1","1","1","","","","","","","","","","","","","","","","18159","1992","","Edinburgh University Press","","Storbritannia","Engelsk","0","https://www.euppublishing.com/loi/scot"
"484021","Perfect Beat","18-Aug-2023 13:56:25","Perfect Beat","1","1038-2909","1836-0343","","Musikkvitenskap","Humaniora","","1","1","1","1","1","1","1","1","1","","","","","","","","","","","","18177","1992","","Equinox Publishing","","Australia","Engelsk","0","http://www.equinoxpub.com/journals/index.php/PB"
"484034","Vegueta: Anuario de la Facultad de Geografía e Historia","18-Aug-2023 13:56:25","Vegueta: Anuario de la Facultad de Geografía e Historia","1","1133-598X","2341-1112","","Historie og Idéhistorie","Humaniora","","1","1","","","","","","","","","","","","","","","","","","","18729","1992","","Universidad de las Palmas de Gran Canaria","Facultad de Geografia e Historia","Spania","Flerspråklig","0","https://revistavegueta.ulpgc.es/ojs/index.php/revistavegueta"
"484035","RIED. Revista Iberoamericana de Educación a Distancia","18-Aug-2023 13:56:25","RIED. Revista Iberoamericana de Educación a Distancia","1","1138-2783","1390-3306","DOAJ","Pedagogikk og utdanning","Samfunnsvitenskap","","1","1","1","1","1","1","1","1","","","","","","","","","","","","","","1998","","","Asociation Iberoamericana de Educacion Superior a Distancia (AIESAD)","Spania","Spansk","0","http://revistas.uned.es/index.php/ried"
"484044","Acta academica karviniensia","06-Jun-2023 12:22:29","Acta academica karviniensia","1","1212-415X","2533-7610","","Økonomisk-administrative fag","Samfunnsvitenskap","","1","1","1","1","1","1","","","","","","","","","","","","","","","","1998","","","Slezska Univerzita v Opave","Tsjekkia","Flerspråklig","0","https://www.slu.cz/opf/en/science-and-research/acta-academica-karviniensia/"
"484051","Revista română de sociologie","08-Jun-2023 11:39:34","Romanian Journal of Sociology","1","1224-9262","2392-8549","DOAJ","Sosiologi","Samfunnsvitenskap","","1","1","1","1","1","1","1","1","","","","","","","","","","","","","","1996","","","Revista Romana de Sociologie","Romania","Rumensk","0","http://www.revistadesociologie.ro/"
"484052","Perichoresis. The Theological Journal of Emanuel University","18-Aug-2023 13:56:25","Perichoresis. The Theological Journal of Emanuel University","1","1224-984X","2284-7308","DOAJ","Teologi og religionsvitenskap","Humaniora","","1","1","1","1","1","1","1","1","1","","","","","","","","","","","","","1997","","","Sciendo","Romania","Flerspråklig","0","https://content.sciendo.com/view/journals/perc/perc-overview.xml?language=en"
"484058","European Spatial Research and Policy","18-Aug-2023 13:56:25","European Spatial Research and Policy","1","1231-1952","1896-1525","DOAJ","Tverrfaglig samfunnsforskning","Samfunnsvitenskap","","1","1","1","1","1","1","1","1","","","","","","","","","","","","","","1994","","","Lodz University Press","Polen","Engelsk","0","https://czasopisma.uni.lodz.pl/esrap/index"
"484064","Balkan Journal of Philosophy","18-Aug-2023 13:56:25","Balkan Journal of Philosophy","1","1313-888X","2367-5438","","Filosofi","Humaniora","","1","1","1","1","1","1","","","","","","","","","","","","","","","","2009","","","Academic Publishing House","Bulgaria","Engelsk","0","http://www.pdcnet.org/bjp"
"484069","XLinguae: European Scientific Language Journal","18-Aug-2023 13:56:25","XLinguae: European Scientific Language Journal","1","1337-8384","2453-711X","","Lingvistikk","Humaniora","","1","1","1","","","","","","","","","","","","","","","","","","","2008","","","Slovenská Vzdelávacia a Obstarávacia s.r.o.","Slovakia","Flerspråklig","0","http://www.xlinguae.eu/"
"484074","Theology and Sexuality","18-Aug-2023 13:56:25","Theology and Sexuality","1","1355-8358","1745-5170","","Teologi og religionsvitenskap","Humaniora","","1","1","1","1","","","","","","","","","","","","","","","","","18442","1994","","Taylor & Francis","","Storbritannia","Engelsk","0","https://www.tandfonline.com/toc/yths20/current"
"484097","Classica Cracoviensia","06-Jun-2023 12:22:29","Classica Cracoviensia","1","1505-8913","2391-6753","DOAJ","Gresk og latin","Humaniora","","1","1","1","","","","","","","","","","","","","","","","","","","1995","","","Księgarnia Akademicka","Polen","Flerspråklig","0","https://journals.akademicka.pl/cc/index"
"484098","Roczniki Psychologiczne","18-Aug-2023 13:56:25","Annals of Psychology","1","1507-7888","2451-4306","","Psykologi","Medisin og helsefag","","1","1","1","1","","","","","","","","","","","","","","","","","","1998","","","Towarzystwo Naukowe Katolickiego Uniwersytetu Lubelskiego","Polen","Flerspråklig","0","https://ojs.tnkul.pl/index.php/rpsych/index"
"484100","Comparative Economic Research","18-Aug-2023 13:56:25","Comparative Economic Research","1","1508-2008","2082-6737","DOAJ","Økonomisk-administrative fag","Samfunnsvitenskap","","1","1","1","1","1","","","","","","","","","","","","","","","","","1998","","","University of Łódź","Polen","Engelsk","0","http://www.degruyter.com/view/j/cer"
"484101","Archives of Psychiatry and Psychotherapy","18-Aug-2023 13:56:25","Archives of Psychiatry and Psychotherapy","1","1509-2046","2083-828X","","Farmasi, farmakologi og toksikologi","Medisin og helsefag","","1","1","1","1","1","","","","","","","","","","","","","","","","","1999","","","Polskie Towarzystwo Psychiatryczne","Polen","Engelsk","0","http://www.archivespp.pl/"
"484106","Essays in the Philosophy of Humanism","08-Jun-2023 11:42:57","Essays in the Philosophy of Humanism","1","1522-7340","2052-8388","","Filosofi","Humaniora","","1","1","1","1","1","1","1","1","","","","","","","","","","","","","18177","1997","","Equinox Publishing","","USA","Engelsk","0","http://www.equinoxpub.com/journals/index.php/EPH"
"484108","Journal of the Gilded Age and Progressive Era (JGAPE)","18-Aug-2023 13:56:25","Journal of the Gilded Age and Progressive Era (JGAPE)","1","1537-7814","1943-3557","","Historie og Idéhistorie","Humaniora","","1","1","1","1","1","1","","","","","","","","","","","","","","","18118","2002","","Cambridge University Press","","USA","Engelsk","0","http://journals.cambridge.org/action/displayJournal?jid=JGA"
"484111","Journal of Conflict Archaeology","18-Aug-2023 13:56:25","Journal of Conflict Archaeology","1","1574-0773","1574-0781","","Arkeologi og konservering","Humaniora","","1","1","1","1","1","","","","","","","","","","","","","","","","18442","2005","","Taylor & Francis","University of Glasgow/Centre for Battlefield Archaeology.","Storbritannia","Engelsk","0","https://www.tandfonline.com/toc/yjca20/current"
"484114","ELIA: Estudios de Lingüística Inglesa Aplicada","18-Aug-2023 13:56:25","ELIA: Estudios de Lingüística Inglesa Aplicada","1","1576-5059","2253-8283","DOAJ","Lingvistikk","Humaniora","","1","1","1","1","1","1","1","","","","","","","","","","","","","","","2000","","","University of Seville, Spain","Spania","Flerspråklig","0","http://editorial.us.es/en/elia"
"484120","Journal of the Association for Information Science and Technology","18-Aug-2023 13:56:25","Journal of the Association for Information Science and Technology","1","2330-1635","2330-1643","","Biblioteks- og informasjonsvitenskap","Samfunnsvitenskap","2","2","2","2","2","2","2","2","2","2","2","","","","","","","","","","","18270","2014","","John Wiley & Sons","","USA","Engelsk","0","https://asistdl.onlinelibrary.wiley.com/journal/23301643"
"484121","International Journal of Education in Mathematics, Science and Technology (IJEMST)","28-Jun-2023 07:51:24","International Journal of Education in Mathematics, Science and Technology (IJEMST)","1","","2147-611X","","Pedagogikk og utdanning","Samfunnsvitenskap","","1","","","","","","","","","","","","","","","","","","","","","2013","","","Necmettin Erbakan University,  International Society for Technology, Education and Science (ISTES)","Tyrkia","Engelsk","0","https://www.ijemst.net/index.php/ijemst"
"484123","Revista Letral","18-Aug-2023 13:56:25","Revista Letral","1","","1989-3302","DOAJ","Romansk","Humaniora","","1","1","1","1","1","1","1","1","1","1","","","","","","","","","","","","2008","","","Departamento de Literatura Española, Universidad de Granada","Spania","Spansk","0","http://revistaseug.ugr.es/index.php/letral"
"484124","Studies in Polish Linguistics","18-Aug-2023 13:56:25","Studies in Polish Linguistics","1","1732-8160","2300-5920","","Lingvistikk","Humaniora","","1","1","1","1","1","1","1","1","1","1","","","","","","","","","","","13129","2004","","Jagiellonian University Press","","Polen","Engelsk","0","http://www.ejournals.eu/SPL/"
"484125","Studia Etymologica Cracoviensia","08-Jun-2023 11:42:57","Studia Etymologica Cracoviensia","1","1427-8219","2084-3836","","Lingvistikk","Humaniora","","1","1","1","1","1","1","1","1","1","1","","","","","","","","","","","13129","1996","","Jagiellonian University Press","","Polen","Flerspråklig","0","http://www.ejournals.eu/SEC/"
"484126","International Business and Global Economy","08-Jun-2023 11:40:28","International Business and Global Economy","1","2300-6102","2353-9496","","Økonomisk-administrative fag","Samfunnsvitenskap","","1","1","1","1","1","1","1","1","1","1","","","","","","","","","","","","2013","","","Wydawnictwo Uniwersytetu Gdanskiego","Polen","Flerspråklig","0","http://www.ejournals.eu/IBage/"
"484127","Digital Icons: Studies in Russian, Eurasian and Central European New Media","08-Jun-2023 11:39:34","Digital Icons: Studies in Russian, Eurasian and Central European New Media","1","","2043-7633","","Kulturvitenskap","Humaniora","","1","1","1","1","1","1","1","1","1","1","","","","","","","","","","","","2009","","","School of Modern Languages and Cultures","Storbritannia","Engelsk","0","http://www.digitalicons.org"
"484128","Annals of Computer Science and Information Systems","08-Jun-2023 11:39:34","Annals of Computer Science and Information Systems","1","","2300-5963","DOAJ","IKT","Realfag og teknologi","","1","1","1","1","1","1","1","1","1","1","","","","","","","","","","","18231","2013","","IEEE (Institute of Electrical and Electronics Engineers)","","Polen","Engelsk","1","http://annals-csis.org/"
"484129","The Lancet Psychiatry","18-Aug-2023 13:56:25","The Lancet Psychiatry","1","2215-0374","2215-0366","","Psykiatri","Medisin og helsefag","2","2","2","2","1","1","1","1","1","1","0","","","","","","","","","","","18173","2014","","Elsevier","","Storbritannia","Engelsk","0","https://www.thelancet.com/journals/lanpsy/home"
"484130","Zeitschrift für Psychodrama und Soziometri","06-Jun-2023 12:17:35","Zeitschrift für Psychodrama und Soziometri","1","1619-5507","1862-2526","","Psykologi","Medisin og helsefag","","1","1","1","1","1","1","1","1","1","1","","","","","","","","","","","22512","2002","","Springer","","Tyskland","Flerspråklig","0","http://www.zps-digetal.de"
"484131","Sustainable Energy, Grids and Networks","18-Aug-2023 13:56:25","Sustainable Energy, Grids and Networks","1","","2352-4677","","Elektrofag","Realfag og teknologi","","1","1","1","1","1","1","1","1","0","0","","","","","","","","","","","18173","2014","","Elsevier","","Nederland","Engelsk","0","http://www.sciencedirect.com/science/journal/23524677"
"484132","Essays in Romanticism","15-Aug-2023 13:31:38","Essays in Romanticism","1","2049-6699","2049-6702","","Litteraturvitenskap","Humaniora","0","1","1","1","1","1","1","1","1","1","1","","","","","","","","","","","18300","2011","","Liverpool University Press","","Storbritannia","Engelsk","0","https://wfs.gc.cuny.edu/eir/"
"484133","Linguistic Research","18-Aug-2023 13:56:25","Linguistic Research","1","1229-1374","","","Lingvistikk","Humaniora","","1","1","1","1","1","1","1","1","1","1","","","","","","","","","","","","1979","","","Institute for the Study of Language and Information, Kyung Hee University","Sør-Korea","Flerspråklig","0","http://isli.khu.ac.kr/journal/"
"484134","Nordisk politiforskning","07-May-2020 10:02:13","Nordic Journal of Studies in Policing","0","","1894-8693","DOAJ","Tverrfaglig samfunnsforskning","Samfunnsvitenskap","","","","","","1","1","1","1","1","1","","","","","","","","","","","18455","2014","2019","Universitetsforlaget","","Norge","Flerspråklig","0","http://www.idunn.no/ts/nordisk_politiforskning"
"484135","H-Soz-Kult. Kommunikation und Fachinformation für die Geschichtswissenschaften","08-Jun-2023 11:40:28","H-Soz-Kult. Communication and information services for historical research","1","","2196-5307","","Historie og Idéhistorie","Humaniora","","0","0","0","0","0","0","0","0","0","0","","","","","","","","","","","","1996","","","Clio-online-Historisches Fachinformationssystem e.V. (Humboldt-Universität zu Berlin)","Tyskland","Flerspråklig","0","http://www.hsozkult.de"
"484136","Geographie und ihre Didaktik","08-Jun-2023 11:39:34","Journal of Geography education","1","2198-4298","","DOAJ","Geografi","Samfunnsvitenskap","","1","1","1","1","1","1","1","1","1","1","","","","","","","","","","","","2014","","","Hochschulverbans für Geographie und ihre Didaktik","Tyskland","Tysk","0","http://compute.ku-eichstaett.de/hgd/geo_und_ihre_didaktik"
"484137","Dreigroschenheft. Informationen zu Bertolt Brecht","06-Jun-2023 12:22:29","Dreigroschenheft. Informations on Bertolt Brecht","1","0949-8028","","","Litteraturvitenskap","Humaniora","","0","0","0","0","0","0","0","0","0","0","","","","","","","","","","","","1994","","","Wißner-Verlag, Augsburg","Tyskland","Tysk","0","http://www.dreigroschenheft.de/"
"484138","Das Brecht-Jahrbuch","08-Jun-2023 11:42:57","The Brecht Yearbook","1","0734-8665","","","Litteraturvitenskap","Humaniora","","0","0","0","0","0","0","0","0","0","0","","","","","","","","","","","","1982","","","Camden House for the International Brecht Society","USA","Engelsk","0","http://www.brechtsociety.org/media/brecht_yearbook"
"484139","Sleep Health","18-Aug-2023 13:56:25","Sleep Health","1","2352-7218","2352-7226","","Sosialforskning","Samfunnsvitenskap","","1","1","1","1","1","1","1","1","1","0","","","","","","","","","","","18173","2014","","Elsevier","","Nederland","Engelsk","0","http://www.sciencedirect.com/science/journal/23527218"
"484140","World journal for pediatric & congenital heart surgery","18-Aug-2023 13:56:25","World journal for pediatric & congenital heart surgery","1","2150-1351","2150-136X","","Hjerte, kar og luftveier","Medisin og helsefag","","1","1","1","1","1","1","1","1","1","1","","","","","","","","","","","18411","2010","","Sage Publications","","USA","Engelsk","0","http://pch.sagepub.com"
"484141","Computational and Structural Biotechnology Journal","18-Aug-2023 13:56:25","Computational and Structural Biotechnology Journal","1","","2001-0370","DOAJ","Biovitenskap","Realfag og teknologi","","1","1","1","1","1","1","1","1","1","1","","","","","","","","","","","18173","2011","","Elsevier","","Sverige","Engelsk","0","http://www.journals.elsevier.com/computational-and-structural-biotechnology-journal/"
"484142","Applied neuropsychology: Adult","18-Aug-2023 13:56:25","Applied neuropsychology: Adult","1","2327-9095","2327-9109","","Psykologi","Medisin og helsefag","","1","1","1","1","1","1","1","1","1","1","","","","","","","","","","","18442","2012","","Taylor & Francis","","USA","Engelsk","0","https://www.tandfonline.com/toc/hapn21/current"
"484143","Nordic Atlas of Language Structures (NALS) Journal","08-Jun-2023 11:40:28","Nordic Atlas of Language Structures (NALS) Journal","1","","2387-2667","DOAJ","Lingvistikk","Humaniora","","1","1","1","1","1","1","1","1","1","1","","","","","","","","","","","","2014","","","Institutt for lingvistiske og nordiske studier, Universitetet i Oslo","Norge","Engelsk","0","https://journals.uio.no/index.php/NALS"
"484144","Empirical Research in Vocational Education and Training","18-Aug-2023 13:56:25","Empirical Research in Vocational Education and Training","1","1877-6337","1877-6345","DOAJ","Pedagogikk og utdanning","Samfunnsvitenskap","","1","1","1","1","1","1","1","1","0","0","","","","","","","","","","","22512","2009","","Springer","","Tyskland","Engelsk","0","https://ervet-journal.springeropen.com"
"484145","AIMS Energy","18-Aug-2023 13:56:25","AIMS Energy","1","2333-8326","2333-8334","DOAJ","Energi","Realfag og teknologi","","1","1","1","1","1","1","1","1","1","1","","","","","","","","","","","","2013","","","Aimspress","USA","Engelsk","0","http://aimspress.ijournals.cn/aimse/ch/index.aspx"
"484146","Health Psychology Open (HPO)","18-Aug-2023 13:56:25","Health Psychology Open (HPO)","1","","2055-1029","DOAJ","Psykologi","Medisin og helsefag","","1","1","1","1","1","1","0","0","0","0","","","","","","","","","","","18411","2014","","Sage Publications","","Storbritannia","Engelsk","0","https://uk.sagepub.com/en-gb/eur/journal/health-psychology-open"
"484147","Social & Public Policy Review","15-Aug-2023 13:31:38","Social & Public Policy Review","1","","1752-704X","","Statsvitenskap","Samfunnsvitenskap","0","1","1","1","1","1","1","1","1","1","1","","","","","","","","","","","19176","2007","","University of Plymouth Press","","Storbritannia","Engelsk","0","http://www.uppress.co.uk/socialpublicpolicyreview.htm"
"484148","Radiological Physics and Technology","18-Aug-2023 13:56:25","Radiological Physics and Technology","1","1865-0333","1865-0341","","Radiologi og billeddiagnostikk","Medisin og helsefag","","1","1","1","1","1","1","1","1","1","1","","","","","","","","","","","22512","2008","","Springer","","Japan","Engelsk","0","https://www.springer.com/journal/12194"
"484149","Japanese Journal of Radiological Technology","06-Jun-2023 12:22:29","Japanese Journal of Radiological Technology","1","0369-4305","1881-4883","","Radiologi og billeddiagnostikk","Medisin og helsefag","","0","0","0","0","0","0","0","0","0","0","","","","","","","","","","","","1944","","","Nihon Hoshasen Gijutsu Gakkai","Japan","Engelsk","0","https://www.jstage.jst.go.jp/browse/jjrt"
"484150","Journal of Medical Imaging and Health Informatics","08-Jun-2023 11:39:34","Journal of Medical Imaging and Health Informatics","1","2156-7018","2156-7026","","Radiologi og billeddiagnostikk","Medisin og helsefag","","0","0","0","1","1","1","1","1","1","1","","","","","","","","","","","18064","2010","","American Scientific Publishers","","USA","Engelsk","0","http://www.aspbs.com/jmihi/contact_jmihi.htm"
