"Tidsskrift id","Original tittel","Sist endret","Internasjonal tittel","Aktiv","Print ISSN","Online ISSN","Open Access","NPI Fagfelt","NPI Fagområde","Nivå 2024","Nivå 2023","Nivå 2022","Nivå 2021","Nivå 2020","Nivå 2019","Nivå 2018","Nivå 2017","Nivå 2016","Nivå 2015","Nivå 2014","Nivå 2013","Nivå 2012","Nivå 2011","Nivå 2010","Nivå 2009","Nivå 2008","Nivå 2007","Nivå 2006","Nivå 2005","Nivå 2004","Forlag id","Etablert år","Nedlagt år","Forlag","Utgiver","Utgiverland","Språk","Konferanserapport","Url"
"499973","Movimento","18-Aug-2023 13:56:25","Movimento","1","0104-754X","1982-8918","DOAJ","Idrettsforskning","Medisin og helsefag","","1","1","1","1","","","","","","","","","","","","","","","","","","1994","","","Universidade Federal do Rio Grande do Sul Escola de Educação Física","Brasil","Portugisisk","0","https://www.seer.ufrgs.br/Movimento/index"
"499974","Stigma and Health","18-Aug-2023 13:56:25","Stigma and Health","1","2376-6972","2376-6964","","Psykologi","Medisin og helsefag","","1","1","1","1","","","","","","","","","","","","","","","","","18063","2015","","American Psychological Association (APA)","","USA","Engelsk","0","https://www.apa.org/pubs/journals/sah"
"499975","BUP-håndboka: oppsummert forskning om effekt av tiltak for barn og unges psykiske helse","04-Aug-2022 14:46:30","BUP-håndboka: oppsummert forskning om effekt av tiltak for barn og unges psykiske helse","0","","2535-7220","","Psykologi","Medisin og helsefag","","","","0","0","","","","","","","","","","","","","","","","","","2018","2019","","Regionsenter for barn og unges psykiske helse øst og sør (RBUP)","Norge","Norsk (bokmål)","0","http://tiltakshandboka.no"
"499976","Nordeuropäische Arbeiten zur Literatur, Sprache und Kultur","08-Jun-2023 11:42:57","Northern European Studies in Literature, Language and Culture","1","2196-9760","","","Litteraturvitenskap","Humaniora","","1","1","1","1","","","","","","","","","","","","","","","","","18372","2013","","Peter Lang Publishing Group","","Tyskland","Tysk","0","https://www.peterlang.com/view/serial/NAL"
"499977","TRAJECTORIA","06-Jun-2023 12:22:29","TRAJECTORIA","1","","2435-4074","","Sosialantropologi","Samfunnsvitenskap","","1","1","1","1","","","","","","","","","","","","","","","","","","2020","","","National Museum of Ethnology, Japan","Japan","Engelsk","0","https://trajectoria.minpaku.ac.jp"
"499978","International Journal of Research, Innovation and Commercialisation","08-Jun-2023 11:40:28","International Journal of Research, Innovation and Commercialisation","1","2051-9931","2051-994X","","Tverrfaglig teknologi","Realfag og teknologi","","1","1","1","1","","","","","","","","","","","","","","","","","17842","2017","","InderScience Publishers","","Storbritannia","Engelsk","0","https://www.inderscience.com/jhome.php?jcode=ijric"
"499979","International Journal of Intelligent Systems Design and Computing (IJISDC)","06-Jun-2023 12:22:29","International Journal of Intelligent Systems Design and Computing (IJISDC)","1","2052-8477","2052-8485","","Tverrfaglig teknologi","Realfag og teknologi","","1","1","1","1","","","","","","","","","","","","","","","","","17842","2015","","InderScience Publishers","","Storbritannia","Engelsk","0","https://www.inderscience.com/jhome.php?jcode=ijisdc"
"499980","Journal of Geovisualization and Spatial Analysis (JGSA)","18-Aug-2023 13:56:25","Journal of Geovisualization and Spatial Analysis (JGSA)","1","2509-8810","2509-8829","","Geovitenskap","Realfag og teknologi","","1","1","1","1","","","","","","","","","","","","","","","","","22512","2017","","Springer","","Sveits","Engelsk","0","https://www.springer.com/journal/41651"
"499981","Journal of Nonlinear and Variational Analysis","18-Aug-2023 13:56:25","Journal of Nonlinear and Variational Analysis","1","2560-6921","2560-6778","","Matematikk","Realfag og teknologi","","1","1","1","1","","","","","","","","","","","","","","","","","","2017","","","Biemdas Academic Publishers Inc.","Canada","Engelsk","0","http://jnva.biemdas.com/"
"499982","Materials Today Nano","18-Aug-2023 13:56:25","Materials Today Nano","1","","2588-8420","","Kjemi og materialteknologi","Realfag og teknologi","","1","1","1","1","","","","","","","","","","","","","","","","","18173","2018","","Elsevier","","Nederland","Engelsk","0","http://www.sciencedirect.com/science/journal/25888420"
"499983","Matériaux & Techniques","18-Aug-2023 13:56:25","Matériaux & Techniques","1","0032-6895","1778-3771","","Kjemi og materialteknologi","Realfag og teknologi","","1","1","1","1","","","","","","","","","","","","","","","","","","1970","","","","Frankrike","Flerspråklig","0","https://www.mattech-journal.org/"
"499984","Barcelona Respiratory Network Reviews (BRN Reviews)","06-Jun-2023 12:22:29","Barcelona Respiratory Network Reviews (BRN Reviews)","1","2462-3172","2385-7110","DOAJ","Hjerte, kar og luftveier","Medisin og helsefag","","0","0","0","0","","","","","","","","","","","","","","","","","","2015","","","Permanyer","Spania","Engelsk","0","https://www.brnreviews.com/index.php"
"499985","Brasiliana: Journal for Brazilian Studies","06-Jun-2023 12:22:29","Brasiliana: Journal for Brazilian Studies","1","","2245-4373","DOAJ","Tverrfaglig samfunnsforskning","Samfunnsvitenskap","","1","1","1","1","","","","","","","","","","","","","","","","","","2012","","","King's College London","Danmark","Flerspråklig","0","https://tidsskrift.dk/bras/index"
"499986","Organization Theory (OT)","08-Jun-2023 11:39:34","Organization Theory (OT)","1","","2631-7877","","Økonomisk-administrative fag","Samfunnsvitenskap","","1","1","1","1","","","","","","","","","","","","","","","","","18411","2020","","Sage Publications","","Storbritannia","Engelsk","0","https://journals.sagepub.com/home/ott"
"499987","Schlesische Grenzgänger","06-Jun-2023 12:22:29","Schlesische Grenzgänger","1","1867-6847","","","Litteraturvitenskap","Humaniora","","1","1","1","1","","","","","","","","","","","","","","","","","25702","2009","","Leipziger Universitätsverlag","","Tyskland","Tysk","0","https://www.univerlag-leipzig.de/catalog/bookstore/category/44-Schlesische_Grenzgaenger"
"499988","Eurasian Journal of Business and Economics (EJBE)","08-Jun-2023 11:40:28","Eurasian Journal of Business and Economics (EJBE)","1","1694-5948","1694-5972","DOAJ","Samfunnsøkonomi","Samfunnsvitenskap","","1","1","1","1","","","","","","","","","","","","","","","","","","2007","","","Ala-Too International University","Kirgisistan","Engelsk","0","http://ejbe.org/"
"499989","Journal of Chinese Writing System","18-Aug-2023 13:56:25","Journal of Chinese Writing System","1","2513-8502","2513-8510","","Lingvistikk","Humaniora","","1","1","1","1","","","","","","","","","","","","","","","","","18411","2017","","Sage Publications","","Storbritannia","Engelsk","0","https://journals.sagepub.com/home/cws"
"499990","SpringerBriefs in Information Systems","06-Jun-2023 12:22:29","SpringerBriefs in Information Systems","1","2192-4929","2192-4937","","IKT","Realfag og teknologi","","0","0","0","0","","","","","","","","","","","","","","","","","22512","2012","","Springer","","Tyskland","Engelsk","0","https://www.springer.com/series/10189?detailsPage=titles"
"499991","Phytopathology Research","18-Aug-2023 13:56:25","Phytopathology Research","1","2096-5362","2524-4167","DOAJ","Biovitenskap","Realfag og teknologi","","1","1","1","1","","","","","","","","","","","","","","","","","16994","2019","","BioMed Central (BMC)","China Agricultural University","Kina, Storbritannia","Engelsk","0","https://phytopatholres.biomedcentral.com/"
"499992","Contributions to Management Science","18-Aug-2023 13:56:25","Contributions to Management Science","1","1431-1941","2197-716X","","Tverrfaglig teknologi","Realfag og teknologi","","1","1","1","1","","","","","","","","","","","","","","","","","22512","1990","","Springer","","Tyskland","Engelsk","0","https://www.springer.com/series/1505"
"499993","Bonn zoological Bulletin (BzB)","18-Aug-2023 13:56:25","Bonn zoological Bulletin (BzB)","1","2190-7307","2363-6947","DOAJ","Biovitenskap","Realfag og teknologi","","1","1","1","1","","","","","","","","","","","","","","","","","","2010","","","Zoologisches Forschungsmuseum Alexander Koenig","Tyskland","Engelsk","0","https://www.zoologicalbulletin.de/"
"499994","Journal of the Austrian Association for American Studies (JAAS)","06-Jun-2023 12:22:29","Journal of the Austrian Association for American Studies (JAAS)","1","","2616-9533","","Tverrfaglig humanistisk forskning","Humaniora","","1","1","1","1","","","","","","","","","","","","","","","","","","2020","","","Austrian association for American studies","Østerrike","Engelsk","0","https://jaaas.eu"
"499995","Journal of Applied Research on Children (JARC)","18-Aug-2023 13:54:28","Journal of Applied Research on Children (JARC)","1","","2155-5834","DOAJ","Tverrfaglig samfunnsforskning","Samfunnsvitenskap","","1","1","1","1","","","","","","","","","","","","","","","","","","2010","","","Children at Risk Institute, Texas Medical Center Library","USA","Engelsk","0","https://digitalcommons.library.tmc.edu/childrenatrisk/about.html"
"499996","Selected Proceedings of the Workshop on Immigrant Languages in the Americas (WILA)","06-Jun-2023 12:22:29","Selected Proceedings of the Workshop on Immigrant Languages in the Americas (WILA)","1","2688-5816","2688-5840","","Lingvistikk","Humaniora","","1","1","1","1","","","","","","","","","","","","","","","","","22601","2018","","Cascadilla Press","","USA","Engelsk","1","http://www.cascadilla.com/wila.html"
"499997","Global Transitions","18-Aug-2023 13:56:25","Global Transitions","1","","2589-7918","DOAJ","Tverrfaglig samfunnsforskning","Samfunnsvitenskap","","1","1","1","1","","","","","","","","","","","","","","","","","18173","2019","","Elsevier","KeAi Communication","Kina","Engelsk","0","https://www.sciencedirect.com/journal/global-transitions"
"499998","Energy and Built Environment (EBE)","18-Aug-2023 13:56:25","Energy and Built Environment (EBE)","1","","2666-1233","DOAJ","Energi","Realfag og teknologi","","1","1","1","1","","","","","","","","","","","","","","","","","18173","2020","","Elsevier","KeAi Communication","","Engelsk","0","https://www.sciencedirect.com/journal/energy-and-built-environment"
"499999","Manuscripta Publications in Manuscript Research (MSSP)","06-Jun-2023 12:22:29","Manuscripta Publications in Manuscript Research (MSSP)","1","2565-8735","","","Tverrfaglig humanistisk forskning","Humaniora","","1","1","1","0","","","","","","","","","","","","","","","","","18108","2015","","Brepols","","Belgia","Engelsk","0","http://www.brepols.net/Pages/BrowseBySeries.aspx?TreeSeries=MSSP"
"500000","AIMS Mathematics","18-Aug-2023 13:56:25","AIMS Mathematics","1","","2473-6988","DOAJ","Matematikk","Realfag og teknologi","","1","1","1","1","","","","","","","","","","","","","","","","","18659","2016","","American Institute of Mathematical Sciences (AIMS) Press","","USA","Engelsk","0","https://www.aimspress.com/journal/Math"
"500007","Przegląd Nauk o Obronności","06-Jun-2023 12:22:29","Defence Science Review (DSR)","1","2450-6869","2719-6763","DOAJ","Statsvitenskap","Samfunnsvitenskap","","1","1","1","","","","","","","","","","","","","","","","","","","2016","","","Military University of Technology","Polen","Engelsk","0","http://www.defencesciencereview.com.pl/"
"500015","International Journal of Educational Research Open","18-Aug-2023 13:56:25","International Journal of Educational Research Open","1","","2666-3740","DOAJ","Pedagogikk og utdanning","Samfunnsvitenskap","","1","1","1","1","","","","","","","","","","","","","","","","","18173","2020","","Elsevier","","Storbritannia","Engelsk","0","https://www.sciencedirect.com/journal/International-Journal-of-Educational-Research-Open"
"500016","Psychology of Popular Media","18-Aug-2023 13:56:25","Psychology of Popular Media","1","2689-6567","2689-6575","","Psykologi","Medisin og helsefag","","1","1","1","1","","","","","","","","","","","","","","","","","18063","2020","","American Psychological Association (APA)","","USA","Engelsk","0","https://www.apa.org/pubs/journals/ppm/"
"500017","Journal of Hazardous Materials Letters","18-Aug-2023 13:56:25","Journal of Hazardous Materials Letters","1","","2666-9110","DOAJ","Tverrfaglig teknologi","Realfag og teknologi","","1","1","1","1","","","","","","","","","","","","","","","","","18173","2020","","Elsevier","","Nederland","Engelsk","0","https://www.journals.elsevier.com/journal-of-hazardous-materials-letters/"
"500018","Wellbeing, Space and Society","18-Aug-2023 13:56:25","Wellbeing, Space and Society","1","","2666-5581","DOAJ","Tverrfaglig samfunnsforskning","Samfunnsvitenskap","","1","1","1","1","","","","","","","","","","","","","","","","","18173","2020","","Elsevier","","Storbritannia","Engelsk","0","https://www.journals.elsevier.com/wellbeing-space-and-society/"
"500019","Journal of Migration and Health","18-Aug-2023 13:56:25","Journal of Migration and Health","1","","2666-6235","DOAJ","Tverrfaglig samfunnsforskning","Samfunnsvitenskap","","1","1","1","1","","","","","","","","","","","","","","","","","18173","2020","","Elsevier","","Storbritannia","Engelsk","0","https://www.sciencedirect.com/journal/journal-of-migration-and-health"
"500020","International Journal of Forensic Engineering and Management","06-Jun-2023 12:22:29","International Journal of Forensic Engineering and Management","1","1478-1476","1479-3091","","Tverrfaglig teknologi","Realfag og teknologi","","1","1","1","1","","","","","","","","","","","","","","","","","17842","2020","","InderScience Publishers","","Storbritannia","Engelsk","0","https://www.inderscience.com/jhome.php?jcode=ijfem"
"500021","ES Food & Agroforestry (FAF)","06-Jun-2023 12:22:29","ES Food & Agroforestry (FAF)","1","2687-7295","2687-7309","","Biovitenskap","Realfag og teknologi","","1","1","1","1","","","","","","","","","","","","","","","","","","2020","","","The Engineered Science Publisher","USA","Engelsk","0","http://www.espublisher.com/journals/id/es-food-agroforestry"
"500022","Linguistic Minorities in Europe Online (LME)","08-Jun-2023 11:40:28","Linguistic Minorities in Europe Online (LME)","1","","2510-5361","","Lingvistikk","Humaniora","","1","1","1","1","","","","","","","","","","","","","","","","","18335","2019","","De Gruyter Mouton","","Tyskland","Engelsk","0","https://www.degruyter.com/view/db/lme"
"500023","Dance Articulated","08-Jun-2023 11:39:34","Dance Articulated","1","","2703-8327","DOAJ","Dans","Humaniora","","1","1","1","1","","","","","","","","","","","","","","","","","","2020","","","NTNU Open Access Journals","Norge","Engelsk","0","https://www.ntnu.no/ojs/index.php/ps/index"
"500024","Earth System Governance","18-Aug-2023 13:56:25","Earth System Governance","1","","2589-8116","DOAJ","Statsvitenskap","Samfunnsvitenskap","","1","1","1","","","","","","","","","","","","","","","","","","18173","2019","","Elsevier","","Nederland","Engelsk","0","https://www.sciencedirect.com/journal/earth-system-governance"
"500028","Open Research Europe","18-Aug-2023 13:56:25","Open Research Europe","1","","2732-5121","DOAJ","Tverrfaglig naturvitenskap og medisin","Realfag og teknologi","","1","1","1","","","","","","","","","","","","","","","","","","","2021","","","European Commission, F1000 Research Limited","Storbritannia","Engelsk","0","https://open-research-europe.ec.europa.eu/"
"500033","Acta Biomedica","18-Aug-2023 13:56:25","Acta Biomedica","1","0392-4203","2531-6745","","Biomedisin","Medisin og helsefag","","1","1","1","1","","","","","","","","","","","","","","","","","","1984","","","Mattioli 1885","Italia","Engelsk","0","https://www.mattioli1885journals.com/index.php/actabiomedica"
"500034","Acta Pharmaceutica Sinica B (APSB)","18-Aug-2023 13:56:25","Acta Pharmaceutica Sinica B (APSB)","1","2211-3835","2211-3843","DOAJ","Farmasi, farmakologi og toksikologi","Medisin og helsefag","","1","1","1","1","","","","","","","","","","","","","","","","","18173","2011","","Elsevier","","Nederland","Engelsk","0","https://www.sciencedirect.com/journal/acta-pharmaceutica-sinica-b"
"500035","Acta Zoologica Bulgarica","18-Aug-2023 13:56:25","Acta Zoologica Bulgarica","1","0324-0770","2603-3798","","Biovitenskap","Realfag og teknologi","","1","1","1","1","","","","","","","","","","","","","","","","","","1975","","","Bulgarian Academy of Sciences, Institute of Biodiversity and Ecosystem Research (BAS)","Bulgaria","Flerspråklig","0","http://www.acta-zoologica-bulgarica.eu/"
"500036","Advances in Chronic Kidney Disease","18-Aug-2023 13:56:25","Advances in Chronic Kidney Disease","1","1548-5595","1548-5609","","Nefrologi","Medisin og helsefag","","1","1","1","1","","","","","","","","","","","","","","","","","18173","2004","","Elsevier","National Kidney Foundation","USA","Engelsk","0","https://www.sciencedirect.com/journal/advances-in-chronic-kidney-disease"
"500039","Advances in Mathematics: Scientific Journal (AMSJ)","06-Jun-2023 12:22:29","Advances in Mathematics: Scientific Journal (AMSJ)","1","1857-8365","1857-8438","","Matematikk","Realfag og teknologi","","1","1","1","1","","","","","","","","","","","","","","","","","","2012","","","Jolevska-Tuneska Biljana","Makedonia","Engelsk","0","https://research-publication.com/?page_id=9"
"500040","American Journal of Ophthalmology Case Reports","18-Aug-2023 13:56:25","American Journal of Ophthalmology Case Reports","1","","2451-9936","DOAJ","Øyesykdommer","Medisin og helsefag","","1","1","1","1","","","","","","","","","","","","","","","","","18173","2016","","Elsevier","","Nederland","Engelsk","0","https://www.sciencedirect.com/journal/american-journal-of-ophthalmology-case-reports"
"500041","The Anatolian Journal of Cardiology","18-Aug-2023 13:56:25","The Anatolian Journal of Cardiology","1","2149-2263","2149-2271","DOAJ","Hjerte, kar og luftveier","Medisin og helsefag","","1","1","1","1","","","","","","","","","","","","","","","","","","2015","","","KARE Publishing","Tyrkia","Engelsk","0","http://www.anakarder.com/"
"500042","Annual Review of Vision Science","18-Aug-2023 13:56:25","Annual Review of Vision Science","1","2374-4642","2374-4650","","Tverrfaglig naturvitenskap og medisin","Realfag og teknologi","","1","1","1","1","","","","","","","","","","","","","","","","","26446","2015","","Annual Reviews","","USA","Engelsk","0","https://www.annualreviews.org/journal/vision"
"500043","The Application of Clinical Genetics","18-Aug-2023 13:56:25","The Application of Clinical Genetics","1","","1178-704X","DOAJ","Biovitenskap","Realfag og teknologi","","1","1","1","1","","","","","","","","","","","","","","","","","","2008","","","Dove Medical Press","New Zealand","Engelsk","0","https://www.dovepress.com/the-application-of-clinical-genetics-journal"
"500046","Temes de Disseny","18-Aug-2023 13:56:25","Temes de Disseny","1","2604-9155","2604-6032","DOAJ","Arkitektur og design","Humaniora","","1","1","","","","","","","","","","","","","","","","","","","","2011","","","Elisava Barcelona School of Design and Engineering","Spania","Flerspråklig","0","https://raco.cat/index.php/Temes/index"
"500047","Maritime Transport Research","18-Aug-2023 13:56:25","Maritime Transport Research","1","","2666-822X","DOAJ","Konstruksjonsfag","Realfag og teknologi","","1","1","1","","","","","","","","","","","","","","","","","","18173","2020","","Elsevier","","","Engelsk","0","https://www.journals.elsevier.com/maritime-transport-research"
"500065","Autoimmunity Highlights","23-Aug-2022 15:03:34","Autoimmunity Highlights","0","2038-0305","2038-3274","","Biomedisin","Medisin og helsefag","","","","1","1","","","","","","","","","","","","","","","","","16994","2010","2021","BioMed Central (BMC)","","Italia","Engelsk","0","https://autoimmunhighlights.biomedcentral.com/"
"500066","BMJ Nutrition, Prevention and Health","18-Aug-2023 13:56:25","BMJ Nutrition, Prevention and Health","1","","2516-5542","DOAJ","Ernæring","Medisin og helsefag","","1","1","1","1","","","","","","","","","","","","","","","","","","2018","","","BMJ Publishing Group","Storbritannia","Engelsk","0","https://nutrition.bmj.com/"
"500067","British Journal of Hospital Medicine (BJHM)","18-Aug-2023 13:56:25","British Journal of Hospital Medicine (BJHM)","1","1750-8460","1759-7390","","Generell medisin","Medisin og helsefag","","1","1","1","1","1","1","1","1","1","1","1","1","1","1","1","1","1","1","","","","2005","","","MA Healthcare","Storbritannia","Engelsk","0","https://www.magonlinelibrary.com/journal/hmed"
"500068","Bulletin of the Geological Society of Malaysia","18-Aug-2023 13:56:25","Bulletin of the Geological Society of Malaysia","1","0126-6187","","DOAJ","Geovitenskap","Realfag og teknologi","","1","1","1","1","","","","","","","","","","","","","","","","","","1977","","","Persatuan Geologi Malaysia (Geological Society of Malaysia (GSM))","Malaysia","Engelsk","0","https://gsm.org.my/content.php?id=99"
"500069","BYU Studies Quarterly","18-Aug-2023 13:56:25","BYU Studies Quarterly","1","2167-8472","2167-8480","","Teologi og religionsvitenskap","Humaniora","","0","0","0","0","","","","","","","","","","","","","","","","","18785","2012","","Brigham Young University","","USA","Engelsk","0","https://byustudies.byu.edu/"
"500070","Chem","18-Aug-2023 13:56:25","Chem","1","2451-9308","2451-9294","","Kjemi og materialteknologi","Realfag og teknologi","","1","1","1","1","","","","","","","","","","","","","","","","","18173","2016","","Elsevier","Cell Press","USA","Engelsk","0","https://www.sciencedirect.com/journal/chem"
"500072","Engineering and Applied Science Research (EASR)","18-Aug-2023 13:56:25","Engineering and Applied Science Research (EASR)","1","2539-6161","2539-6218","DOAJ","Tverrfaglig teknologi","Realfag og teknologi","","1","1","1","1","","","","","","","","","","","","","","","","","","2017","","","Faculty of Engineering, Khon Kaen University","Thailand","Engelsk","0","https://ph01.tci-thaijo.org/index.php/easr/index"
"500073","European Urology Open Science","18-Aug-2023 13:56:25","European Urology Open Science","1","2666-1691","2666-1683","DOAJ","Kirurgiske fag","Medisin og helsefag","","1","1","1","1","","","","","","","","","","","","","","","","","18173","2020","","Elsevier","","Nederland","Engelsk","0","https://www.sciencedirect.com/journal/european-urology-open-science"
"500074","Family Medicine and Community Health (FMCH)","18-Aug-2023 13:56:25","Family Medicine and Community Health (FMCH)","1","2305-6983","2009-8774","DOAJ","Samfunnsmedisin","Medisin og helsefag","","1","1","1","1","","","","","","","","","","","","","","","","","","2013","","","BMJ Publishing Group","Irland","Engelsk","0","https://fmch.bmj.com/"
"500075","European Zoological Journal","18-Aug-2023 13:56:25","European Zoological Journal","1","","2475-0263","DOAJ","Biovitenskap","Realfag og teknologi","","1","1","1","1","1","1","1","","","","","","","","","","","","","","18442","2017","","Taylor & Francis","","Storbritannia","Engelsk","0","https://www.tandfonline.com/toc/tizo21/current"
"500076","Field Actions Science Report (FACTS Reports)","18-Aug-2023 13:56:25","Field Actions Science Report (FACTS Reports)","1","1867-139X","1867-8521","DOAJ","Sosiologi","Samfunnsvitenskap","","1","1","1","1","","","","","","","","","","","","","","","","","","2009","","","Institut Veolia Environnement","Frankrike","Engelsk","0","https://journals.openedition.org/factsreports/"
"500077","Conference on Lasers and Electro-Optics (CLEO)","06-Jun-2023 12:22:29","Conference on Lasers and Electro-Optics (CLEO)","1","2160-8989","","","IKT","Realfag og teknologi","","1","1","1","1","","","","","","","","","","","","","","","","","18231","2003","","IEEE (Institute of Electrical and Electronics Engineers)","","USA","Engelsk","1","https://ieeexplore.ieee.org/xpl/conhome/1800377/all-proceedings"
"500079","Current Protocols in Bioinformatics","18-Aug-2023 13:54:28","Current Protocols in Bioinformatics","1","1934-3396","1934-340X","","Biovitenskap","Realfag og teknologi","","1","1","1","1","","","","","","","","","","","","","","","","","18270","2002","","John Wiley & Sons","","USA","Engelsk","0","https://currentprotocols.onlinelibrary.wiley.com/journal/1934340x"
"500082","Current Transplantation Reports","18-Aug-2023 13:56:25","Current Transplantation Reports","1","","2196-3029","","Kirurgiske fag","Medisin og helsefag","","1","1","1","1","","","","","","","","","","","","","","","","","22512","2014","","Springer","","Sveits","Engelsk","0","https://www.springer.com/journal/40472"
"500083","Development Engineering","18-Aug-2023 13:56:25","Development Engineering","1","","2352-7285","DOAJ","Tverrfaglig teknologi","Realfag og teknologi","","1","1","1","1","","","","","","","","","","","","","","","","","18173","2016","","Elsevier","","Storbritannia","Engelsk","0","https://www.sciencedirect.com/journal/development-engineering"
"500084","Digital Policy, Regulation and Governance","18-Aug-2023 13:56:25","Digital Policy, Regulation and Governance","1","2398-5038","2398-5046","","Økonomisk-administrative fag","Samfunnsvitenskap","","1","1","1","1","1","1","1","","","","","","","","","","","","","","17801","2017","","Emerald Group Publishing Limited","","Storbritannia","Engelsk","0","https://www.emerald.com/insight/publication/acronym/DPRG"
"500085","EJVES Vascular Forum (EJVES VF)","18-Aug-2023 13:56:25","EJVES Vascular Forum (EJVES VF)","1","","2666-688X","DOAJ","Biomedisin","Medisin og helsefag","","1","1","1","1","","","","","","","","","","","","","","","","","18173","2020","","Elsevier","","Storbritannia","Engelsk","0","https://www.sciencedirect.com/journal/ejves-vascular-forum"
