"477170","Högre Utbildning","08-Jun-2023 11:39:34","Högre Utbildning","1","","2000-7558","DOAJ","Pedagogikk og utdanning","Samfunnsvitenskap","","1","1","1","1","1","1","1","1","1","1","1","1","1","1","","","","","","","18121","2010","","Cappelen Damm Akademisk","","Sverige","Svensk","0","http://hogreutbildning.se/"
"477171","Advances in Human-Computer Interaction","18-Aug-2023 13:56:25","Advances in Human-Computer Interaction","1","1687-5893","1687-5907","DOAJ","IKT","Realfag og teknologi","","1","1","1","1","1","1","1","1","1","1","1","1","1","1","","","","","","","18220","2007","","Hindawi Limited","","Storbritannia","Engelsk","0","https://www.hindawi.com/journals/ahci/"
"477172","European Journal of Physical & Health Education","15-Aug-2023 13:31:38","European Journal of Physical & Health Education","1","2080-8003","","","Pedagogikk og utdanning","Samfunnsvitenskap","0","1","1","1","1","1","1","1","1","1","1","1","1","1","1","","","","","","","","2009","","","Akademia Wychowania Fizycznego i Sportu","Polen","Engelsk","0","http://www.awf.gda.pl/index.php?id=580"
"477173","New Disease Reports","18-Aug-2023 13:56:25","New Disease Reports","1","","2044-0588","","Biovitenskap","Realfag og teknologi","","1","1","1","1","1","1","1","1","1","1","1","1","1","1","","","","","","","","2000","","","British Society for Plant Pathology","Storbritannia","Engelsk","0","http://www.ndrs.org.uk"
"477174","Storia urbana","15-Aug-2023 13:31:38","Storia urbana","1","0391-2248","1972-5523","","Geografi","Samfunnsvitenskap","0","1","1","1","1","1","1","1","1","1","1","1","1","1","1","","","","","","","17046","1977","","Edizioni FrancoAngeli","","Italia","Italiensk","0","http://www.francoangeli.it/riviste/elenco_sommari.asp"
"477175","Territorio","18-Aug-2023 13:56:25","Territorio","1","1825-8689","2239-6330","","Arkitektur og design","Humaniora","","1","1","1","1","1","1","1","1","1","1","1","1","1","1","","","","","","","17046","1996","","Edizioni FrancoAngeli","","Italia","Italiensk","0","http://www.francoangeli.it/riviste/elenco_sommari.asp"
"477176","International Journal of Technology Intelligence and Planning (IJTIP)","18-Aug-2023 13:56:25","International Journal of Technology Intelligence and Planning (IJTIP)","1","1740-2832","1740-2840","","Tverrfaglig teknologi","Realfag og teknologi","","1","1","1","1","1","1","1","1","1","1","1","1","1","1","","","","","","","17842","2004","","InderScience Publishers","","Storbritannia","Engelsk","0","http://www.inderscience.com/browse/index.php?journalID=105"
"477177","Educational & Child Psychology","18-Aug-2023 13:56:25","Educational & Child Psychology","1","0267-1611","2396-8702","","Psykologi","Medisin og helsefag","","1","1","1","1","1","1","1","1","1","1","1","1","1","1","","","","","","","","1984","","","British Psychological Society","Storbritannia","Engelsk","0","http://www.bps.org.uk/publications/member-network-publications/member-publications/educational-child-psychology"
"477178","Revista de Educación Inclusiva","06-Jun-2023 12:22:29","Inclusive Education Journal","1","1889-4208","1989-4643","DOAJ","Pedagogikk og utdanning","Samfunnsvitenskap","","1","1","1","1","1","1","1","1","1","1","1","1","1","1","","","","","","","","2008","","","Universidad de Jaen","Spania","Engelsk","0","http://revistaeducacioninclusiva.es"
"477179","Adelphi Series","15-Aug-2023 13:31:38","Adelphi Series","1","1944-5571","1944-558X","","Statsvitenskap","Samfunnsvitenskap","0","1","1","1","1","1","1","1","1","1","1","1","1","1","1","","","","","","","18442","2009","","Taylor & Francis","","Storbritannia","Engelsk","0","https://www.tandfonline.com/toc/tadl20/current"
"477180","Agriculture and Agricultural Science Procedia","06-Jun-2023 12:22:29","Agriculture and Agricultural Science Procedia","1","","2210-7843","","Biovitenskap","Realfag og teknologi","","1","1","1","1","1","1","1","1","1","1","1","1","1","1","","","","","","","18173","2010","","Elsevier","","Nederland","Engelsk","1","http://www.elsevier.com/wps/find/journaldescription.cws_home/724514/description#description"
"477181","International Journal of Technology and Engineering Education","15-Aug-2023 13:31:38","International Journal of Technology and Engineering Education","1","1816-9325","","","Pedagogikk og utdanning","Samfunnsvitenskap","0","1","1","1","1","1","1","1","1","1","1","1","1","1","1","","","","","","","","2004","","","Association of Engineering Education and Managemen","Taiwan","Engelsk","0","http://ateem.servehttp.com/enindex.html"
"477182","Études Platoniciennes","06-Jun-2023 12:22:29","Études Platoniciennes","1","1770-9687","","","Filosofi","Humaniora","","1","1","1","1","1","1","1","1","1","1","1","1","1","1","","","","","","","18294","2004","","Les Belles Lettres","","Frankrike","Fransk","0","http://www.lesbelleslettres.com/collections/?collection_id=27"
"477183","SIGKDD Explorations","08-Jun-2023 11:40:28","SIGKDD Explorations","1","1931-0145","1931-0153","","IKT","Realfag og teknologi","","1","1","1","1","1","1","1","1","1","1","1","1","1","1","","","","","","","18077","1999","","Association for Computing Machinery (ACM)","","USA","Engelsk","0","http://www.sigkdd.org/explorations/about.php"
"477184","International Journal of Transitions and Innovation systems","08-Jun-2023 11:40:28","International Journal of Transitions and Innovation systems","1","1745-0071","1745-008X","","IKT","Realfag og teknologi","","1","1","1","1","1","1","1","1","1","1","1","1","1","1","","","","","","","17842","2010","","InderScience Publishers","","Storbritannia","Engelsk","0","http://www.inderscience.com/ijtis"
"477185","Studies in Philosophical Theology","08-Jun-2023 11:42:57","Studies in Philosophical Theology","1","1381-2025","","","Teologi og religionsvitenskap","Humaniora","2","2","2","2","2","2","2","2","2","2","2","2","2","1","1","","","","","","","18369","1989","","Peeters Publishers","","Nederland","Engelsk","0","http://www.peeters-leuven.be/Search_serie_book.asp?nr=137"
"477186","Eurographics State of the Art Reports","06-Jun-2023 12:22:29","Eurographics State of the Art Reports","1","1017-4656","","","IKT","Realfag og teknologi","","1","1","1","1","1","1","1","1","1","1","1","1","1","1","","","","","","","19985","2010","","Eurographics - European Association for Computer Graphics","","Sveits","Engelsk","1","http://www.eg.org/EG/DL/conf/EG2010/stars"
"477187","Intelligent Control and Automation","08-Jun-2023 11:40:28","Intelligent Control and Automation","1","2153-0653","2153-0661","","IKT","Realfag og teknologi","","0","0","0","0","0","0","0","0","0","0","0","1","1","1","","","","","","","22903","2009","","Scientific Research Publishing (SCIRP)","","USA","Engelsk","0","http://www.scirp.org/journal/ica/"
"477188","Journal of Pure and Applied Mathematics: Advances and Applications","06-Jun-2023 12:22:29","Journal of Pure and Applied Mathematics: Advances and Applications","1","0974-9381","","","Matematikk","Realfag og teknologi","","1","1","1","1","1","1","1","1","1","1","1","1","1","1","","","","","","","","2009","","","Scientific Advances Publishers","India","Engelsk","0","http://scientificadvances.org/journals2.htm"
"477189","Journal of Numerical Mathematics and Stochastics","06-Jun-2023 12:22:29","Journal of Numerical Mathematics and Stochastics","1","","2151-2302","","Matematikk","Realfag og teknologi","","1","1","1","1","1","1","1","1","1","1","1","1","1","1","","","","","","","","2009","","","Euclidean Press","Libanon","Engelsk","0","http://www.jnmas.org/Contents.html"
"477190","Journal of Math-for-Industry","14-Jun-2019 10:45:55","Journal of Math-for-Industry","0","1884-4774","1884-4782","","Matematikk","Realfag og teknologi","","","","","","","","","","","","1","1","1","1","","","","","","","","2009","2013","","Faculty of Mathematics, Kyushu University","Japan","Engelsk","0","http://gcoe-mi.jp/english/publish_list/"
"477191","Journal of Logic and Analysis","18-Aug-2023 13:56:25","Journal of Logic and Analysis","1","","1759-9008","DOAJ","Matematikk","Realfag og teknologi","","1","1","1","1","1","1","1","1","1","1","1","1","1","1","","","","","","","19542","2009","","Association for Symbolic Logic","","USA","Engelsk","0","http://logicandanalysis.org/"
"477192","Thule - Kungl. Skytteanska Samfundets årsbok","15-Aug-2023 13:31:38","Thule - Kungl. Skytteanska Samfundets årsbok","1","0280-8692","","","Tverrfaglig humanistisk forskning","Humaniora","0","1","1","1","1","1","1","1","1","1","1","1","1","1","","","","","","","","","1983","","","Kungliga Skytteanska Samfundet","Sverige","Svensk","0","http://www.skytteanskasamfundet.se"
"477193","The Renewable Energies and Power Quality Journal (RE&PQJ)","18-Aug-2023 13:56:25","The Renewable Energies and Power Quality Journal (RE&PQJ)","1","","2172-038X","","Elektrofag","Realfag og teknologi","","1","1","1","1","1","1","1","1","1","1","1","1","1","1","","","","","","","","2003","","","European Association for the Development of Renewa","Spania","Engelsk","0","http://www.icrepq.com/rev-main.html"
"477194","Cost Management","08-Jun-2023 11:40:28","Cost Management","1","1092-8057","","","Økonomisk-administrative fag","Samfunnsvitenskap","","1","1","1","1","1","1","1","1","1","1","1","1","1","1","","","","","","","","1992","","","W G & L Financial Reporting & Management Research","USA","Engelsk","0","http://maaw.info/JournalofCostManagement.htm"
"477195","Open Access Journal of Sports Medicine","08-Jun-2023 11:39:34","Open Access Journal of Sports Medicine","1","","1179-1543","DOAJ","Idrettsforskning","Medisin og helsefag","","1","1","1","1","1","1","1","1","1","1","1","1","1","1","","","","","","","","2010","","","Dove Medical Press Ltd.","New Zealand","Engelsk","0","http://www.dovepress.com/open-access-journal-of-sports-medicine-journal"
"477196","TWMS Journal of Pure and Applied Mathematics","06-Jun-2023 12:22:29","TWMS Journal of Pure and Applied Mathematics","1","2076-2585","2219-1259","","Matematikk","Realfag og teknologi","","1","1","1","1","1","1","1","1","1","1","1","1","1","1","","","","","","","","2010","","","Turkic World Mathematical Society","Aserbajdsjan","Engelsk","0","http://iam.bsu.edu.az/en"
"477198","Journal of Emerging Technologies in Accounting","18-Aug-2023 13:56:25","Journal of Emerging Technologies in Accounting","1","1554-1908","1558-7940","","Økonomisk-administrative fag","Samfunnsvitenskap","","1","1","1","1","1","1","1","1","1","1","1","1","1","1","","","","","","","","2004","","","American Accounting Association","USA","Engelsk","0","http://aaahq.org/set/publications/jeta.html"
"477200","Strategic Finance","15-Aug-2023 13:31:38","Strategic Finance","1","1524-833X","","","Økonomisk-administrative fag","Samfunnsvitenskap","0","1","1","1","1","1","1","1","1","1","1","1","1","1","1","","","","","","","","1919","","","Institute of Management Accountants","USA","Engelsk","0","http://www.strategicfinancemag.com"
"477201","Petroleum Accounting and Financial Management","15-Aug-2023 13:31:38","Petroleum Accounting and Financial Management","1","1554-2904","","","Økonomisk-administrative fag","Samfunnsvitenskap","0","1","1","1","1","1","1","1","1","1","1","1","1","1","1","","","","","","","","1982","","","Institute of Petroleum Accounting","USA","Engelsk","0","http://www.ipa.unt.edu/journal.php"
"477202","Allemagne d'aujourd'hui","15-Aug-2023 13:31:38","Allemagne d'aujourd'hui","1","0002-5712","","","Tysk og nederlandsk","Humaniora","0","1","1","1","1","1","1","1","1","1","1","1","1","1","1","","","","","","","18387","1966","","Presses Universitaires du Septentrion","","Frankrike","Fransk","0","http://allemagne-aujourdhui.septentrion.com"
"477203","Texter om svenska med didaktisk inriktning","15-Aug-2023 13:31:38","Texter om svenska med didaktisk inriktning","1","1651-9132","","","Nordisk","Humaniora","0","1","1","1","1","1","1","1","1","1","1","1","1","1","1","","","","","","","","2002","","","Nationella nätverket för svenska med didaktisk inr","Sverige","Svensk","1","http://www.mah.se/lut/smdi-natverk"
"477204","Bergen Language and Linguistics Studies (BeLLS)","08-Jun-2023 11:39:34","Bergen Language and Linguistics Studies (BeLLS)","1","","1892-2449","","Lingvistikk","Humaniora","","1","1","1","1","1","1","1","1","1","1","1","1","1","1","","","","","","","4813","2010","","Universitetet i Bergen","","Norge","Engelsk","0","https://bells.uib.no/"
"477205","History of Education and Children's Literature","18-Aug-2023 13:56:25","History of Education and Children's Literature","1","1971-1093","1971-1131","","Pedagogikk og utdanning","Samfunnsvitenskap","","1","1","1","1","1","1","1","1","1","1","1","1","1","1","","","","","","","","2007","","","Macerata : EUM - Edizioni Università di Macerata","Italia","Engelsk","0","http://www.hecl.it/"
"477206","International Journal of Research on History Didactics, History Education, and History Culture. Yearbook of the International Society for History Didactics (JHEC)","18-Aug-2023 13:54:28","International Journal of Research on History Didactics, History Education, and History Culture. Yearbook of the International Society for History Didactics (JHEC)","1","1608-8751","","","Pedagogikk og utdanning","Samfunnsvitenskap","","1","1","1","1","1","1","1","1","1","1","1","1","1","1","","","","","","","","2001","","","Wochenschau Verlag GmbH","Tyskland","Engelsk","0","http://yearbook-ishd.wochenschau-verlag.de/issues.htm"
